id_artist,artist,bio,listeners,playcount,similar_artist
830e5c4e-6b7d-431d-86ab-00c751281dc5,5 Seconds of Summer,"5 Seconds of Summer (also known as 5SOS) are a 4-piece Australian pop rock/pop punk band. Formed in Sydney, New South Wales, Australia in 2011, the band consists of Luke Hemmings (lead vocals, guitar), Michael Clifford (guitar, vocals), Calum Hood (bass guitar, vocals) and Ashton Irwin (drums, vocals). The group were originally YouTube celebrities, posting videos of themselves covering songs from various artists in 2011. From there, they gained a small following Read more on Last.fm",2228692,205097709,Luke Hemmings
4dd03cbb-4b92-4fc9-9e46-75139a6deea3,Los Zigarros, Read more on Last.fm,9092,206382,Más Birras
0e263fb1-3145-4b61-b3fc-3d99a515baec,Els Pets,"Els Pets are a Catalan pop-rock band from Constantí (Catalonia). They are the only band surviving out of the 4 leading ""Rock Català"" groups of the early 90's (Sopa de Cabra, Sau, Els Pets & Sangtrait). They started to play on the Christmas Eve 1985, Lluís Gavaldà (lead singer, composer and guitarist), Joan Reig ( drums) and Falin Caceres (bass) are the original founders. Guitarist Ramon Vidal participated in the first two albums, and other support musicians have joined them in several gigs. Read more on Last.fm",29343,859031,Lax'n'Busto
507ccf29-0d49-4219-a1a2-1b98f8e91ad0,Lartiste, Read more on Last.fm,95790,1292630,KeBlack
3a51b862-0144-40f6-aa17-6aaeefea29d9,Steven Wilson,"Steven Wilson (born Steven John Wilson on November 3, 1967, in Hemel Hempstead, Hertfordshire, England) is an English musician, singer, songwriter and record producer, most closely associated with the progressive rock genre. Currently a solo artist, he became known as the founder, lead guitarist, lead vocalist and songwriter of the British rock band Porcupine Tree, as well as being a member of several other bands.

Wilson is self-taught as a producer, audio engineer, multi-instrumentalist and singer-songwriter. Read more on Last.fm",349551,23829695,Porcupine Tree
62841baa-52ae-4d69-a086-75a129db03fc,Bakar,"There is more than one artist with this name, including: 
1) Bakar is British singer-songwriter Abubakar Baker Shariff-Farr (born 12 February 1994); 
2) Bakar is French rapper Jamel Mekaidiche (born in Chartres) . 

1) Abubakar Baker Shariff-Farr (born 12 February 1994), better known as Bakar, is a British singer, songwriter and model. Known for his experimental indie rock style, he made his professional solo debut with the mixtape Badkid in May 2018, subsequently releasing the extended play Will You Be My Yellow? in September 2019.  Read more on Last.fm",1315649,28052966,Dominic Fike
00034ede-a1f1-4219-be39-02f36853373e,O Rappa,"O Rappa (pronounced ""Oh Hah-pah"") is a popular Brazilian reggae/rock band from Rio de Janeiro. Their sound is a rich, refreshing meddle of reggae and rock often combined with elements of funk, hip-hop, rap and samba. They are also known for their smart, socially conscious lyrics; the members themselves work on numerous social projects in the country.

Current Formation
    * Marcelo Falcão - vocals
    * Xandão (Alexandre Menezes) - guitars
    * Lauro Farias - bass Read more on Last.fm",494957,18758310,Natiruts
309c62ba-7a22-4277-9f67-4a162526d18a,Beck,"Beck Hansen (born Bek David Campbell, July 8, 1970) is an American musician, singer-songwriter, and multi-instrumentalist.  Beck's music is known for its pop-junk culture collage of musical styles, ironic lyrics, samples, drum machines, live instrumentation and heady sound effects.

Beck was born in Los Angeles, California, to David Campbell (a musician and son of a Presbyterian minister) and Bibbe Hansen (a former dancer for The Velvet Underground, founding member of the satirical band Black Fag, and visual artist). Read more on Last.fm",4145594,157186567,The Flaming Lips
edf078bd-ab50-477a-9e3d-f4c0c1d3470b,STARSET,"Starset is an American alternative rock band formed in 2013 in Columbus, Ohio, by lead vocalist and Downplay former member Dustin Bates

The current lineup consistst of: Dustin Bates (lead vocals, keyboards, piano, synths and guitars), Ron DeChant (bass, keyboards and backing vocals), Brock Richards (guitars and backing vocals) and Adam Gilbert (drums and percussion).

They released their debut studio album, Transmissions, in 2014 with the label Razor & Tie, followed by a second studio album, Vessels, in 2017. Read more on Last.fm",537628,27803516,Downplay
618b6900-0618-4f1e-b835-bccb17f84294,Eric Clapton,"Eric Patrick Clapton CBE (born 30 March 1945) is an English rock and blues guitarist, singer, and songwriter. He is regarded as one of the most successful and influential guitarists in rock music. He ranked second in Rolling Stone's list of the ""100 Greatest Guitarists of All Time"" and fourth in Gibson's ""Top 50 Guitarists of All Time"". In 2023, Rolling Stone named Clapton the 35th best guitarist of all time. He was also named number five in Time magazine's list of ""The 10 Best Electric Guitar Players"" in 2009. Read more on Last.fm",3396244,81134032,B.B. King & Eric Clapton
26da8dcd-b34b-4834-86bf-4942878f774b,Phil Lesh & Communion,See Phil Lesh. Read more on Last.fm,12777,28415,Joe Russo's Almost Dead
0aefc9cb-1f58-43c4-8979-d6bc274b519a,Benny Morrell, Read more on Last.fm,2468,8852,Ray Pelka
e0e1a584-dd0a-4bd1-88d1-c4c62895039d,Foster The People,"Foster the People is an alternative rock band that formed in Los Angeles, California, United States in 2009. The band consists of Mark Foster (vocals, guitar, keyboards), Cubbie Fink (bass, vocals) and Mark Pontius (drums). The band released their debut self-titled EP in January 2011. The band's debut full length album, Torches, was released on May 24, 2011 on Star Time/Columbia. Their first single ""Pumped Up Kicks"" was a sleeper hit during the summer of 2011 and peaked at #1 on the Billboard Alternative Songs Chart Read more on Last.fm",3687798,117884199,Two Door Cinema Club
c707b37e-cb5c-4694-be4d-46beefcb2475,Chris Rea,"Christopher Anton Rea (4 March 1951 – 22 December 2025) was an English rock and blues singer-songwriter and guitarist. He was known for his distinctive raspy voice and his use of slide guitar. Over the course of his career, Rea released 25 studio albums, including two that reached number one on the UK Albums Chart: ""The Road to Hell"" (1989) and its follow-up ""Auberge"" (1991). He achieved his first UK Top 10 single with ""The Road to Hell (Part 2)"", having already established a substantial following across mainland Europe. Read more on Last.fm",1315212,16502810,Mark Knopfler
ea4dfa26-f633-4da6-a52a-f49ea4897b58,R.E.M.,"R.E.M. was an American alternative rock band from Athens, Georgia, formed in 1980 by drummer Bill Berry, guitarist  Peter Buck, bassist/backing vocalist  Mike Mills, and lead vocalist  Michael Stipe. One of the first alternative rock bands, R.E.M. was noted for Buck's ringing, arpeggiated guitar style, Stipe's distinctive vocal quality and obscure lyrics, Mills's melodic bass lines and backing vocals, and Berry's tight, economical style of drumming.  Read more on Last.fm",4333332,154654403,U2
bfb7e36e-b8f6-4c5d-9c43-3fe9ddd7ee12,Self Deception,"Self Deception is a Stockholm based rock band, formed in 2005 by Andreas Clark and Erik Eklund.

The band consists of four hard working tightly bound friends, with high ambition and a big passion for the music they play and love. Influenced mostly from 90's music like westcoast rock, grunge and hardrock.

Band members:
• Andreas Olsson - guitar, lead vocals
• Erik Eklund - drummer
• Gabriel Rauhofer - guitar, backup vocals
• Patrik Hallgren - bass, backup vocals Read more on Last.fm",133550,3261023,Enmy
15f8b799-4c43-4f39-8ceb-9cdce7051b51,The Marcus King Band,"The Marcus King Band is an American blues rock band led by singer, songwriter, and guitarist Marcus King.

Call him the next Duane Allman or Jimi Hendrix, but whatever you do, don’t call Marcus King a child prodigy. Sure, the guitar shredder’s talent shimmers with the same resonance as his heroes, but he’s been wielding an axe since he learned to talk – he started playing when he was 2.

King was born into music, gifted with steel-string DNA and two generations of men before him who nurtured the boy’s musical nature. Read more on Last.fm",103451,1284242,Marcus King
4f8916d6-a7d2-43e9-96b6-ce3168c39c84,Molotov,"Molotov is a Mexican rock and hip hop band formed on September 23, 1995 in Mexico City. Their lyrics feature a mixture of Spanish and English, rapped and sung by all members of the group. Musically, Molotov blends heavy basslines, flamenco guitar riffs and turntable scratches. Molotov is often regarded the Latin response to Rage Against The Machine. Many songs, such as ""Gimme Tha Power"" and ""Frijolero"", are politically inspired. Addressing issues such as disenfranchisement within Mexico and immigration in the United States. Read more on Last.fm",469779,13205076,Control Machete
66fc5bf8-daa4-4241-b378-9bc9077939d2,TOOL,"Tool is an American alternative metal/progressive metal band from Los Angeles. Formed in 1990, the group's line-up includes vocalist Maynard James Keenan, guitarist Adam Jones and drummer Danny Carey. Justin Chancellor has been the band's bassist since 1995, replacing their original bassist Paul D'Amour. Tool has won four Grammy Awards, performed worldwide tours, and produced albums topping the charts in several countries.

To date, the band has released five studio albums, one EP and one box set. Read more on Last.fm",2591971,226667157,A Perfect Circle
14e410f5-97f2-48ba-b1f7-a3a44cbea05c,ASIAN KUNG-FU GENERATION,"ASIAN KUNG-FU GENERATION (アジアン・カンフー・ジェネレーション Ajian Kanfuu Jenereeshon) is a Japanese alternative/indie rock band formed in Yokohama in 1996.

Members:
Vocals & Guitar: 後藤正文 (Masafumi Gotoh)
Guitar & Vocals: 喜多建介 (Kensuke Kita)
Bass & Vocals: 山田貴洋 (Takahiro Yamada)
Drums: 伊地知潔 (Kiyoshi Ijichi)


History:

Starting out as a college band, Asian Kung-Fu Generation released a series of independent EPs featuring lyrics mostly sung in English. Read more on Last.fm",695159,43625487,KANA-BOON
ee944257-940d-44c3-abae-2aae243b9373,Solence,"Solence is a rock band from Sweden, based in Stockholm, founded in 2012. The band consists of Markus Videsäter on vocals, David Strääf on guitar, Jonas Nolér on guitar, Johan Swärd on keys, and David Vikingsson on drums.

The band members are all multi-instrumentalists and music students with shared visions and musical backgrounds. They moved under the same roof in Stockholm in 2013 to completely dedicate themselves to the band.

Solence has a modern Read more on Last.fm",182093,4278381,Dead by April
f0c8f75f-8736-4b1d-b312-9349fcff321d,Wolfmother,"Wolfmother is a Grammy Award-winning hard rock band formed in Sydney, New South Wales in 2000. The band originally consisted of Andrew Stockdale (guitar, vocals), Chris Ross (bass, keyboards), and Myles Heskett  (drums), though Ross and Heskett left the band in August 2008. With the original line up Wolfmother released one album, Wolfmother, and six singles, the highest-charting of which was ""Joker and the Thief"" which reached number eight in Australia. Read more on Last.fm",2055035,44600833,Eagles of Death Metal
7974fd3f-b3e7-4607-a1ad-9d85c07ac3b9,THE ORAL CIGARETTES,"THE ORAL CIGARETTES is a Japanese rock band from Nara Prefecture, formed in 2010. The band consist of vocalist and guitarist Takuya Yamanaka, guitarist Shigenobu Suzuki, bassist and backing vocalist Akirakani Akira and drummer Masaya Nakanishi.

The band was formed by vocalist Takuya and bassist Akira. Takuya used to work at a bank but he didn’t like working under someone else so he decided to make music instead. They were joined by guitarist Shigenobu, who went to the same kindergarten as Takuya. Read more on Last.fm",415768,12138633,Hello Sleepwalkers
6bbb9ed3-bb91-452f-b801-5c9a511de165,She Past Away,"She Past Away is a dark wave band from Bursa, Turkey. The group was formed by Volkan Caner (vocal/guitar) and Idris Akbulut (bass) in 2006. With the live participation of Doruk Ozturkcan in electronic drums, the band was totally shaped by the end of 2009.

Idris Akbulut left She Past Away in 2015 and was replaced by Doruk Ozturkcan as a permanent member. 

Clashing gothic lyrics with buzzsaw guitars, allegedly broken vocals and sensory drum effects Read more on Last.fm",223923,6511937,Twin Tribes
012151a8-0f9a-44c9-997f-ebd68b5389f9,Imagine Dragons,"Imagine Dragons is an American pop rock band formed in 2008 in Las Vegas, Nevada. The group currently consists of lead singer Dan Reynolds, guitarist Wayne Sermon, and bassist Ben McKee. Their debut single, ""It’s Time"", was released in February 2012 and reached the top 20 of several international charts. Their debut album, ""Night Visions"", released in September 2012, produced the singles ""Radioactive"" and ""Demons"" and reached number two on the United States charts. Read more on Last.fm",4021563,248712871,OneRepublic
aa76ec08-45ab-4724-9411-d80b0e59ac59,The Vaccines,"The Vaccines is a London, UK indie rock band formed in 2010, consisting of Justin Young (vocals, guitar), Árni Hjörvar (bass), Freddie Cowan (guitar), and Pete Robertson (drums). After signing to Marshall Teller Records, they released their debut single, ""Wreckin' Bar (Ra Ra Ra)""/""Blow It Up"". The band recorded their first radio session for Marc Riley's BBC 6 Music show in December 2010. They also performed live on Later with Jools Holland. On 5th January 2011 they were placed third in the BBC's 'Sound of 2011' poll.  Read more on Last.fm",1383742,43066518,Spector
681b5ab2-b7dd-4dff-85e9-1e84503ad36a,Memphis May Fire,"Memphis May Fire is a metalcore band with southern rock influences (previously post-hardcore) currently based in Dallas, Texas. The band formed in December 2006, but it was not until February 2007 that the group decided on the name Memphis May Fire having previously gone by ""O Captain, My Captain!"". Since its formation, the band has released two EPs and six full-length albums, the latest being Shapeshifter which was released in March 2025.

In early 2007, the band recorded and self-released an EP, and began creating a local following. Read more on Last.fm",533026,21533917,Wage War
298f4089-1948-44b5-b5e8-d5381f42362f,X Ambassadors,"X Ambassadors is an American alternative rock band hailing from Ithaca, New York. The band was formed in 2009 by brothers Sam and Casey Harris, and childhood friend Noah Feldshuh. Initially, the group started out playing local gigs and self-releasing music, but their unique sound soon caught the attention of record labels.

The band's music is an eclectic mix of genres, including alternative rock, indie rock, and pop. They are known for their energetic and emotional live performances Read more on Last.fm",1118823,16966755,American Authors
e57f0cac-4f56-473c-8d7e-d93f753fd586,Steve Miller Band,"
Steve Miller Band is an American  rock  band formed in 1967-8 in San Francisco, California, USA. The band features Steve Miller on guitar and lead vocals, and is known for a string of (mainly) mid-1970s hit singles that continue to be staples of the classic rock radio format.

Steve Miller (born 5 October 1943) is a blues and rock and roll guitarist and performer. He was born in Milwaukee, Wisconsin but attended high school in Dallas. While at St. Read more on Last.fm",1776065,23613673,Joe Walsh
96855c21-b832-4366-ba12-0d2330c36a86,Phoebe Bridgers,"Phoebe Lucille Bridgers (born August 17, 1994) is an American indie musician from Pasadena, California. Best known for her work as a solo singer-songwriter, she is also known for being part of the musical groups boygenius (with Julien Baker and Lucy Dacus) and Better Oblivion Community Center (with Conor Oberst). Bridgers made her solo debut with the studio album Stranger in the Alps (2017), followed by Punisher (2020) which earned Bridgers widespread critical acclaim and four Grammy Award nominations, including Best New Artist. Read more on Last.fm",2120975,284452858,boygenius
19717f86-c8eb-4d81-980d-629d6ab4a4f3,KISS,"Kiss (often stylized as KIϟϟ) was an American rock band formed in New York City in January 1973 by Paul Stanley, Gene Simmons, Ace Frehley, and Peter Criss. Well known for its members' face paint and stage outfits, the group rose to prominence in the mid–late 1970s with its shocking live performances, which featured fire breathing, blood-spitting, smoking guitars, shooting rockets, levitating drum kits, and pyrotechnics. The band has gone through several lineup changes Read more on Last.fm",3177105,88629137,Ace Frehley
513602fe-202a-4583-afb9-2a2aca8af55b,Upchurch,"Ryan Upchurch (born May 24, 1991), known professionally as Upchurch or Upchurch the Redneck, is an American performer from Cheatham County, Tennessee, on the outskirts of Nashville, Tennessee.[1] He describes himself as a ""comic, rapper, and musician

Upchurch created Upchurch the Redneck with his friend Shade Glover and began uploading videos to YouTube.[2] He released an extended play, Cheatham County, in 2015, followed by a full-length album, Heart of America, in 2016. Read more on Last.fm",44948,2176508,Adam Calhoun
2c629b8c-d751-4131-b785-5690bb5e0fd7,The Kills,"The Kills is an alternative rock duo formed by American vocalist Alison ""VV"" Mosshart and British guitarist Jamie ""Hotel"" Hince that rose to public recognition at the dawn of the hype surrounding the genre's explosion of the early 2000s. Mosshart had been in the Florida punk band Discount and Hince in British rock band Scarfo. When these groups disbanded, the duo, who first met when Mosshart heard Hince practicing in the hotel room above hers, struck up a songwriting partnership. Read more on Last.fm",1430430,51717324,The Dead Weather
38ae1a57-de55-4183-adb4-75ff3739bc4d,Los Hermanos Dalton, Read more on Last.fm,7415,59120,091
87b9b3b8-ab93-426c-a200-4012d667a626,The War On Drugs,"
The War on Drugs is an American indie rock band from Philadelphia, Pennsylvania.

Band member Adam Granduciel (born Adam Granofsky in Dover, Massachusetts) moved from Oakland, California to Philadelphia in  2003, where he met Kurt Vile and began playing music with him. They began playing as The War on Drugs in 2005, and self-released a demo EP. While Vile and Granduciel formed the backbone of the band, they had a number of accompanists early in the group's career Read more on Last.fm",916947,37835858,The National
c0dea069-4f46-4f44-8f44-76831e6abb07,Briston Maroney,"Briston Lee Maroney is an American singer, songwriter, and guitarist from Knoxville, Tennessee who is signed to Canvasback Music and Atlantic Records. He has released two EPs through the labels, including his most recent collection, ""Sunflower” which was partially released and the full album was released April 9, 2021.

Briston Maroney largely grew up in Knoxville, Tennessee. In August 2013, at age 15, Maroney tried out for the 13th season of American Idol at one of its audition bus stops in Knoxville. Read more on Last.fm",613526,13380813,The Backseat Lovers
584c04d2-4acc-491b-8a0a-e63133f4bfc4,Yeah Yeah Yeahs,"Yeah Yeah Yeahs is an American alternative rock band formed in New York City in 2000. The group is composed of vocalist Karen O, guitarist Nick Zinner, and drummer Brian Chase. The band has recorded five studio albums; originally signed to independent Touch and Go Records, their first four albums were released by major record label Interscope. The first, Fever to Tell, was released in 2003. The second, Show Your Bones, was released in 2006 and was named the second best album of the year by NME. Read more on Last.fm",3991859,134268939,Metric
6170f1dd-5a7a-4137-9ce8-5510586fcc07,PUBLIC,"Public is a three-piece indie pop group hailing from Cincinnati, Ohio. The band consists of John Vaughan on lead vocals and guitar, Ben Lapps on drums, and Matt Alvarado on bass. They formed in 2008, initially starting as a songwriting duo with Vaughan and Lapps before Alvarado joined to complete the current lineup of Public.

Drawing inspiration from their roots in classic rock and indie pop, Public released their first EP titled ""Red"" in 2012, quickly establishing a strong local fanbase in Cincinnati. Read more on Last.fm",572119,5633999,Stephen Sanchez
390e4576-41ed-4a71-9e43-3b9550e1a88f,Neil Fallon,"Neil Fallon is the lead singer for the rock band Clutch.  He only has two solo tracks.  Both are compilation releases.  

One is the Black Flag cover of ""American Waste"" with The Rollins band backing him.  This song was released on the ""Rise Above: 24 Black Flag Songs to Benefit the West Memphis Three"" album.  This album is to benefit three kids who were, according to many people, wrongly accused of murder.  

The second is a song from the compilation CD, ""You've Got Your Orders: Volume 1"". Read more on Last.fm",4379,21096,Jeff Moreira
4d6af5df-adb2-4e75-951e-5874feacdc0e,Huecco,"Ivahn was the singer of ""Sugarless"", a Spanish hard rock band. In 2005 he moved to L.A. to record his first maxi single as singer. ""Huecco"" is the name of his new band. It sounds like a mix of rumba, reagge, rock, spanish sounds, samba, punk, hiphop and ska, which is called Rumbaton. He mixed flamenco guitars with electric ones to make riffs.
KC Porter (Santana, Fabulosos Cadillacs, Ricky Martin, Boyz II Men, Bon Jovi) produced his album and Thom Russo(SOAD, Audioslave, Michael Jackson) mixed it. Read more on Last.fm",64775,871043,Alvaro Soler
8653b09a-abbc-4fd7-a754-ff990b9dfc77,Blacktop Mojo,"Seamlessly blending melody with adrenaline fueled, heavy rock and roll, Blacktop Mojo draws in everyone from old metal heads to people whose radio dials have never left top 40 stations. With soaring, gritty vocals and impeccably blended heavy guitar grooves set around a raucous southern stomp, Blacktop Mojo’s live shows are sure to leave fans’ screaming at the top of their lungs with metal horns in the air.
Formed in the final weeks of 2012, Blacktop Mojo began cutting their teeth in the numerous country venues that Texas has to offer Read more on Last.fm",69083,815083,Shaman's Harvest
3dd775da-3e70-432b-9518-8d1ac49dedd9,The Lazys,"Five friends, 20 something and all hailing from NSW’s Central Coast, The Lazys burst on the scene in 2006 combining Punk’s raw edge and anthemic rock.

Building a fan base takes time, but The Lazys bucked the trend and did it in a year, soon coming to the attention of Sydney agent Select Music. The band went on to play before 20,000 fans nationally with fellow Central Coasters Something with numbers. What followed goes against recent industry mantra. Read more on Last.fm",18387,185218,Hardbone
c44e9c22-ef82-4a77-9bcd-af6c958446d6,Mumford & Sons,"Mumford & Sons are an English folk rock band formed in London, United Kingdom in 2007. The band consists of Marcus Mumford (lead vocals, electric guitar, acoustic guitar, drums), Ben Lovett (vocals, keyboards, piano), and Ted Dwane (vocals, bass guitar, double bass). Banjo player Winston Marshall left the band in 2021. 

Mumford & Sons have released four studio albums: Sigh No More (2009), Babel (2012), Wilder Mind (2015), and Delta (2018). Sigh No More peaked at number two on the UK Albums Chart and the Billboard 200 in the US Read more on Last.fm",2667238,136918270,Marcus Mumford
457bd07c-0efc-4d59-9798-b941381cc17a,Vestron Vulture,"Vestron Vulture is the stage name of a Mexican-based electronic musician/producer from Monterrey, México. Read more on Last.fm",387924,5547174,Blood Club
9efff43b-3b29-4082-824e-bc82f646f93d,The Doors,"The Doors was an American rock band formed in Los Angeles in 1965, consisting of vocalist Jim Morrison, keyboardist Ray Manzarek, guitarist Robby Krieger, and drummer John Densmore. The band became known for its distinctive sound, Morrison’s lyrical style and vocal delivery, and the group’s association with the 1960s counterculture. They also attracted attention for Morrison’s stage behavior and various legal controversies.

The band took its name from the title of Aldous Huxley's book ""The Doors of Perception"" Read more on Last.fm",4700836,226961962,Jim Morrison
3ac6b6fc-05e9-456f-a7d8-6ddf69756d3f,Ana Tijoux,"Ana Tijoux (also known as Anita Tijoux, born Anamaría Merino Tijoux on June 12, 1977 in Lille, France) is a Chilean rapper and singer, who became famous in the late 90's as a female MC of hip-hop band Makiza and later as a solo artist. She moved to Santiago, Chile in 1993, where she's stayed.

In the 1990's Anita formed a hip-hop band Los Gemelos (The Twins) with a fellow rapper Zaturno (later became famous as a member of Tiro de Gracia). In 1997 she gained first major attention after singing in a Los Tetas' hit single ""La Medicina"". Read more on Last.fm",207237,2969874,Makiza
d23ac357-0c4c-4d24-9075-0fcc0656e24c,Fable,"There is more than one artist with this name:
1) British Singer/Songwriter Holly Cosgrove 
2) Artist from New Zealand 
3) Drum and Bass producer from Midlands, UK. Info from his soundcloud:
""Originally born and raised in the south-western parts of Sweden, the interest and creation of music effected me at the age of 15 when a friend introduced me to Propellerheads Reason. 
I started to create beats with deep rock influence from fathers vinyl collection Read more on Last.fm",54258,384194,Mike Foyle
