id_artist,artist,bio,listeners,playcount,similar_artist
9285e35e-275c-413f-aec5-a7172fb94577,The Mystery Lights,"Founded in California and based in Brooklyn, the Mystery Lights play psychedelia-infused garage rock with a deep reverence for the sounds of the '60s but with a dash of contemporary cleverness and plenty of spirit. Full of guitars simmering in fuzz and reverb, vocals that plead or taunt, melodies that are both driving and trippy, and an abundance of lysergic sound effects, the group made their recording debut with 2009's Teenage Catgirls & the Mystery Lightshow Read more on Last.fm",172155,1568802,The Spyrals
15a44b9b-6d5e-4ad7-b6ed-3c45fdf79ba0,Liam Gallagher,"William John Paul Gallagher (born 21 September 1972) is an English singer and songwriter. He is best known as the lead vocalist of the rock band  Oasis, which he co-founded in 1991. He later fronted the band Beady Eye from 2010 to 2014 before launching a solo career in 2017. Gallagher is regarded as one of the most recognisable figures in British rock music and is known for his distinctive vocal style and outspoken manner.

Gallagher joined a band initially known as the Rain. Read more on Last.fm",392135,12317359,Noel Gallagher's High Flying Birds
311c485b-abc5-4cfc-b6ba-aaeb6bd85726,Marlon,"There are four artists with this name:

1. Marlon (born August 24, 1977 in Cuba) is a Cuban singer, better known as the winner of the third season of Objetivo Fama, a Puerto Rican reality-show -singing talent contest broadcast by Univision Puerto Rico, and Telefutura network in the United States.

Marlon Fernández was born in La Lisa, Cuba in 1977 to José and Raquel Fernández. At the age of 14, he formed a five-piece band that would help him in his future career. Read more on Last.fm",36225,565538,Fran Perea
e49f69da-17d5-4c5c-bac0-dadcb0e588f5,Mark Knopfler,"Mark Freuder Knopfler, OBE (born 12 August 1949) is a British singer, guitarist, composer, songwriter, record producer, and film score composer. He was the lead guitarist, lead singer, and songwriter for the rock band Dire Straits, which he co-founded with his younger brother, David Knopfler, in 1977. He was born in Glasgow but raised near Newcastle upon Tyne, England.

Since Dire Straits disbanded in 1995, Knopfler has recorded and produced nine solo albums and, as with his previous band, produced many hit songs. Read more on Last.fm",830944,24486269,Dire Straits
0ba1966a-e471-4f98-85d7-8ac0c1f836f0,Aterciopelados,"One of the first contemporary successful rock bands in Colombia, Los Aterciopelados is among the Latin American countries' top groups. Formed in 1992 in Bogotá, Colombia, the band has fused its own sound by combining a rock-solid approach and electronics with a variety of Latin American musical traditions including mariachi, bolero, tropical and flamenco. 

Aterciopelados, whose name translates as ""The Velvety Ones,"" was formed by former members of Delia Y Los Aminoacidos -- Andrea Echeverri Read more on Last.fm",295839,4359658,Ekhymosis
112547af-5753-4464-865c-1618c5d471c2,Ginebras,"Ginebras is a Spanish indie rock musical band formed in 2018. Its members are four women: Magüi Berto (voice and guitar), Sandra Sabater (lead guitar), Raquel López (bass) and Juls Acosta (drums).

The group was formed in 2018 at the initiative of Magüi Berto and Sandra Sabater, who studied audiovisual communication at the Complutense University of Madrid and played the electric guitar.
Through an advertisement on Tinder, where they were looking for girls to play bass and guitar. Read more on Last.fm",21680,661644,Cariño
01809552-4f87-45b0-afff-2c6f0730a3be,Elvis Presley,"Elvis Aaron Presley (January 8, 1935 – August 16, 1977) was an American singer and actor. Regarded as one of the most significant cultural icons of the 20th century, he is often referred to as the ""King of Rock and Roll"" or simply ""the King"".

Presley was born in Tupelo, Mississippi, and relocated to Memphis, Tennessee, with his family when he was 13 years old. His music career began there in 1954, recording at Sun Records with producer Sam Phillips, who wanted to bring the sound of African American music to a wider audience. Read more on Last.fm",4458537,149963982,Jerry Lee Lewis
cf7560ef-7714-477e-b4cd-59de0a2d11fb,Imelda May,"Imelda Mary Higham (born Imelda Mary Clabby on 10 July 1974), professionally known as Imelda May, is an Irish musician and singer-songwriter. Born and raised in The Liberties area of  Dublin, May began her career in music at age sixteen - performing with a number of local bands and musicians - before forming her own band in 2002. She released her debut studio album, No Turning Back, in 2003 and relocated to London, United Kingdom, with husband and guitarist Darrel Higham after its release. Read more on Last.fm",227891,4433138,The Hillbilly Moon Explosion
0eee89dc-7d86-4a15-97be-011652c49288,Conor Oberst,"Conor Oberst is an American singer-songwriter born February 15, 1980 in Omaha, Nebraska. He began his recording career in 1993 at the age of 13 and has since produced an enormous amount of material. Conor was deeply influenced early on by singer-songwriters David Dondero and Simon Joyner.  His first two albums ""Water"" and ""Here's to Special Treatment"" were both released in 1994. Rolling Stone referred to him as ""rock's boy genius."" His project Bright Eyes, with Mike Mogis and Nate Walcott, produced several critically-acclaimed records. Read more on Last.fm",427605,11606626,Bright Eyes
40de1c05-2a3b-4fab-a7c6-82776c37edfa,Taxi,"There are several artists known as Taxi:

1. Taxi (Gibraltar) Born from the ashes of Gibraltar based Melon Diesel,Taxi was born in 2004 formed by Dylan Ferro(Vocals),Dani Fa (Guitars) and Danny Bugeja (Guitars). Having sold more than a quarter of a million copies in their musical career, Taxi are currently promoting their new album ""MIRANDO ATRAS"",a collection of their greatest hits including 2 new songs and a cover version of Gun..s ""Better Days"" due 9th September. Their album ""Aqui y Ahora""got a Latin Grammy nomination. See www.taxi.com.es Read more on Last.fm",100969,980657,Cargo
4ca783b7-5bf7-4348-b494-46680660050f,Stone Sour,"Stone Sour was an American rock band formed in Des Moines, Iowa, in 1992. The band performed for five years before disbanding in 1997. They reunited in 2000 and since 2015, the group has consisted of Corey Taylor (lead vocals, guitar), Josh Rand (guitar), Christian Martucci (guitar), Johny Chow (bass) and Roy Mayorga (drums). Longtime members Joel Ekman (drums, percussion) and Shawn Economaki (bass guitar) left the band in 2006 and 2011, respectively. Former lead guitarist Jim Root left in 2014. Read more on Last.fm",2053241,69243536,Corey Taylor
b141c415-4203-409c-8b82-96b834e3d38c,All Good Things,"There are more than one band that go by the name of  'All Good Things'. Presently two are mentioned below.

I. All Good Things is an Americana/Bluegrass Duo from Milwaukee, WI. The are: John Petty- vocals, guitar and banjo, and Gina Romantini- violin.


II. All Good Things

Band Members:
    Tim Aquilino, Chris Gallerizzo, John Mullaney
Artist Name:
    All Good Things
Home Page:
    http://www.reverbnation.com/agtband
Active Since:
    07/98
Genres:
    Rock / Blues / Country Rock Read more on Last.fm",130014,1885871,Smash Into Pieces
bcf3ad0b-4eae-4c8b-a292-9f4c573aa27a,Samantha Fish,"Samantha Fish (born 30 January 1989 in Kansas City, Missouri) is an American blues singer-songwriter and guitarist.

Fish, called a Blues prodigy at only 21, has been known to share the stage with several influential blues artists such as Tommy Castro, Tab Benoit, Shirley King, Watermelon Slim, Kenny Neal and Cedric Burnside. Her deceptively mature voice, is sultry and innocent at the same time, while her intense guitar gives her a sound that is a cross between Jonny Lang and Susan Tedeschi. Read more on Last.fm",66734,779209,Joanne Shaw Taylor
aca7a1ca-c19b-42f3-857f-52939c1bbb65,Dani Filth,"Dani Filth (born Daniel Lloyd Davey on July 25, 1973 in Hertford, England) is the lyricist, vocalist and founding member of the British extreme metal band Cradle of Filth.

He married his girlfriend of 14 years, Toni Filth, on October 31, 2005 in Ipswich, Suffolk, England, and the two share a daughter, Luna Scarlett (born February 8, 1999).

He lives in Suffolk, England and is currently working on co-writing a book titled ""The Gospel of Filth"" with Gavin Baddeley. Read more on Last.fm",578,2038,Glen Benton
5d12875c-a197-43b2-8f29-41dc0ad895c3,Lindsey Buckingham,"Lindsey Adams Buckingham (born October 3, 1949) is an American guitarist, singer, composer and producer, most notable for being the guitarist and male lead singer of Fleetwood Mac. As a member of Fleetwood Mac, he was inducted into the Rock and Roll Hall of Fame in 1998. In 2011, Buckingham was ranked 100th in Rolling Stone magazine's, 2011 list of ""The 100 Greatest Guitarists of All Time"". The magazine described him as ""one of the most under-valued visionaries in rock"". Read more on Last.fm",324194,3398657,Christine McVie
9595d3b7-3714-422e-a359-6f0cc5ccf653,Columbia Mills,Columbia Mills is an Irish indietronica duo based in Dublin. Read more on Last.fm,11991,88637,Director
8aa5b65a-5b3c-4029-92bf-47a544356934,Ozzy Osbourne,"Ozzy Osbourne (born John Michael Osbourne in Marston Green, Warwickshire, on 3 December 1948; died 22 July 2025) was an English singer, songwriter, and media personality remembered as the lead vocalist of the heavy metal band Black Sabbath, during which period he adopted the nickname ""Prince of Darkness"". On 5 July 2025, Osbourne performed his final show at the ""Back to the Beginning"" concert event. 

He was inducted into the Rock and Roll Hall of Fame as a member of Black Sabbath in 2006 and as a solo artist in 2024. Read more on Last.fm",3089059,94327385,Black Sabbath
ea99eec5-bd72-4b4f-86e4-54c5a34f7e10,The Heavy,"The Heavy is a soul-influenced indie rock band which formed in Bath, England in 2007. The band consists of Kelvin Swaby (vocals), Dan Taylor (guitar), Spencer Page (bass), Chris Ellul (drums) and formerly, Hannah Collins (keyboards). According to Songfacts, when The Heavy performed How Do You Like Me Now? on Late Night With David Letterman, they so impressed the host that he asked the band to play some more - the first time that's ever happened on the show. Read more on Last.fm",850168,14625165,The Black Keys
6af6e8c9-a075-4682-95c8-90f6578471e5,Arnau Griso,"Arnau Griso parece el nombre de un solo tío pero es una banda formada por Arnau Blanch y Eric Griso. Nos gusta decir que somos una banda porque es tan optimista como llamar orgía al sexo en pareja. Y nosotros somos muy optimistas.

En verano de 2011 colgamos nuestra primera canción a Youtube y 6 años más tarde ya habíamos subido la desbordante cifra de 5. Un no parar de hacer canciones. Lo que realmente era desproporcionado eran los números: 40 millones de streams en todas las plataformas digitales. Read more on Last.fm",17774,316596,Sinsinati
65b83862-32e4-444a-ad59-aa8f4866a0ad,Smash Into Pieces,"Smash Into Pieces is a Swedish rock band formed in 2008 in Örebro.

The band was formed in 2008 by members Benjamin Jennebo, Per Bergquist. Isak Snow, Viktor Vidlund and Chris Adam Hedman Sörbye. They released their first single, ""Fading"" in 2009, the song peaked number 33 in the Swedish singles chart.[1] In 2012 they signed a contract with Gain Music Entertainment which is a part of Sony Music Entertainment. A few months later, during the ""Bandit Rock Awards"" they receive the award for ""Band Revelation of the Year"". Read more on Last.fm",196987,7377208,Apoc
597067b8-ebd6-49eb-8a67-c7a31a692c4f,Night Moves,"Night Moves is an American band from Minneapolis, United States.

For such a patently American locale, the Twin Cities have lacked a remarkable group that evokes the American rock canon in a classic manner for a long time. Enter Night Moves. Formed in 2009 by guitarist and vocalist John Pelant, bassist Micky Alfano and multi-instrumentalist Mark Ritsema, Night Moves is a distinctly original concoction. Their honey-dipped sound seethes with a kind Read more on Last.fm",208999,2233383,Cotton Jones
4c98aa1b-34eb-4336-987f-5e50aa059c00,The Script,"The Script is a pop rock band which formed in 2001 in Dublin, Ireland. The band currently consists of Danny O'Donoghue (vocals), Glen Power (drums), Benjamin Seargent (bass) and Ben Weaver (guitar). Mark Sheehan was also a member of the band up until his death in 2023. Sheehan was the co-founder of the band along with O'Donoghue. 

After reaching number fifteen in the charts with their 2008 debut single ""We Cry,"" their second single ""The Man Who Can't Be Moved"" peaked at number two. Read more on Last.fm",2948373,74858270,OneRepublic
b4b5b5a7-feff-47d0-9458-83d0d135a692,Hayley Williams,"Hayley Williams (born December 27, 1988) is an American singer-songwriter. She is best known as the lead vocalist, primary songwriter, and keyboardist of the rock band Paramore. She is also one half of the indie rock duo  Power Snatch, alongside Daniel James.

Born and raised in Mississippi, Williams moved to Tennessee at the age of 15 when her parents divorced in 2002. In 2004, she formed Paramore alongside Josh Farro, Zac Farro, and Jeremy Davis. Read more on Last.fm",781475,50493349,Paramore
e00e45e4-d4bd-422e-80bc-1a935a62d38b,ALIS,"As of 2024, there are at least four artists by the name of Alis:

1. Pachi Delgado is the essence of pure music, and this is easy to explain but difficult to achieve. Having been a leader and voice of Alis Dee, jiennense worship band, and everything that happened to her, as the contract with EMI, Pachi decided to engage in production work from his studio in Baeza (Alis record) with countless groups such big names as Josele Santiago (doing preproduction on ""the swallows etc. Read more on Last.fm",16467,251430,Shkodra Elektronike
d092fbf7-131e-4b67-be05-e0a4e896e311,Joan Dausà, Read more on Last.fm,11180,253899,Els Catarres
49d236de-c68b-4907-b11a-056652638dad,Piti Fernández, Read more on Last.fm,7876,103580,Don Osvaldo
464e1be5-0d62-44d1-bda3-4abe28c44c56,VITO,"There are at least four different bands and artists called Vito.

1. Vito is Vito Dhaenens, a Belgian songwriter, musician and singer from Ghent. It's a it vague, actually: at first, Vito appeared to be a band name, but lately it's become more of a solo moniker, although Vito still has a backing band. Vito's music has been referred to as 'Belgicana', a mix of Patti Smith and Kurt Vile in the discotheque after closing time. Debut album (2019): Man With Feelings. Sophomore album: The Restless Kind (2022). Read more on Last.fm",29309,273880,Virginelle
b9472588-93f3-4922-a1a2-74082cdf9ce8,Panic! At The Disco,"Panic! at the Disco was an American pop rock band from Las Vegas, Nevada, formed in 2004 by childhood friends Ryan Ross, Spencer Smith, Brent Wilson, and Brendon Urie. Following several lineup changes, Panic! began operating as the solo project of frontman Urie from 2015 until the project's discontinuation in 2023.

Panic! at the Disco recorded their first demos while they were in high school. Shortly after, the band recorded and released their debut studio album, A Fever You Can't Sweat Out (2005). Read more on Last.fm",4359108,312924316,Fall Out Boy
7e3a670c-b4aa-4f27-8682-1b28c063aff2,Kasher Quon,"Marquon Fulton, known professionally as Kasher Quon, is a rapper from Detroit, Michigan. His rise to popularity in late 2019 followed his lively and hard-hitting contributions within the then-burgeoning scam rap genre, particularly alongside former collaborator Teejayx6.

As of May 2022, he no longer drinks lean. Read more on Last.fm",35326,692024,Teejayx6
4db1a745-6fd0-4801-9cce-99e88bf855e6,Graveyard,"There is more than one artist known as Graveyard:

1. Graveyard is a hard rock band from Gothenburg, Sweden. 

Joakim Nilsson, Rikard Edlund (both formerly of Norrsken), Axel Sjöberg, and Truls Mörck formed Graveyard in 2006. When Norrsken disbanded in 2000, guitarist Magnus Pelander went on to form doomy folk metal act Witchcraft and Nilsson and Edlund joined Albatros, a growly blues rock band whose lineup also included Sjöberg on drums. Initially they considered Albatros a hobby project Read more on Last.fm",258358,9417634,Witchcraft
88d17133-abbc-42db-9526-4e2c1db60336,beabadoobee,"Beatrice Kristi Ilejay Laus (born 3 June 2000), known professionally as Beabadoobee, is a Filipino-British singer-songwriter. Between 2018 and 2021, she released five extended plays (EPs) on the independent label Dirty Hit: ""Lice"" (2018), ""Patched Up"" (2018), ""Loveworm"" (2019), ""Space Cadet"" (2019), and ""Our Extended Play"" (2021). Her debut studio album, ""Fake It Flowers,"" was released in October 2020 and received critical acclaim. Her second studio album, ""Beatopia,"" was released on 15 July 2022 and included the single ""The Perfect Pair. Read more on Last.fm",2554484,309200514,Clairo
1dcee96e-7d8c-4ba1-ae62-bbb694033966,Pignoise,"Pignoise is a Spanish rock / pop punk band comprising three members: Álvaro on guitar and voice, Polo on drums, and Pablo on bass. Read more on Last.fm",75699,1429568,El Canto del Loco
afd55c72-d123-4237-9818-fa3ce634b3dd,Highly Suspect,"A rock music trio from Massachusetts that started in 2009 as a cover band. Since their formation they have played over 800 live shows, and have released five full length albums, their self-titled album Highly Suspect (2011), Mister Asylum (2015), The Boy Who Died Wolf (2016),  MCID (2019), The Midnight Demon Club (2022), and As Above, So Below (2024).

In addition to this, they've released three EPs: The Gang Lion EP (2010), The Worst Humans (2012), Black Ocean EP (2013). Read more on Last.fm",423577,10864336,Cleopatrick
c995a379-60b9-404b-bd97-a7e2de0751d3,Rob Zombie,"Rob Zombie was born as Robert Cummings in Haverhill, Massachusetts on January 12, 1965.  He was the former lead singer for the rock/metal group White Zombie, and later became a successful solo artist, disbanding the group after his first solo album, the 1998  release Hellbilly Deluxe, sold more in the first week than any of the band's albums ever did.  Remixes of some of its tracks were released on 1999's American Made Music To Strip By, followed up by the studio release The Sinister Urge in 2001.   Read more on Last.fm",2275303,67770737,White Zombie
e33e1ccf-a3b9-4449-a66a-0091e8f55a60,Tedeschi Trucks Band,"Tedeschi Trucks Band (formerly known as the Derek Trucks & Susan Tedeschi Band) is an American blues rock group based in Jacksonville, Florida. Formed in 2010, the band is led by husband-and-wife musicians Derek Trucks and Susan Tedeschi, and primarily features members from their solo groups. Their debut album, Revelator, won a Grammy Award for Best Blues Album.

The band was founded after both Derek Trucks and Susan Tedeschi put their solo bands on hiatus to form a new group that lets the married couple focus on making music together Read more on Last.fm",190140,3611426,The Derek Trucks Band
2c7e21ad-9b16-42df-9f9b-d583ce70a88a,Slightly Stoopid,"While it’s a rare commodity for a band to tour as consistently as Slightly Stoopid, the group’s diligent commitment to live music provides some insight into their loyal fan base and unique creative metamorphosis throughout their extensive existence. Though it's been a couple of years since the release of their last studio album, Top Of The World (August 14, 2012), the Ocean Beach, California-based group—led by co-founders and multi-instrumentalists Read more on Last.fm",848872,18900543,Pepper
5c3c8a55-d470-43eb-935d-91790632ed2c,Delaney Jane,"Delaney Jane (Full real name : Delaney Jane Barth) is a Canadian EDM singer and songwriter from Toronto. Going straight from attending a performing arts high school to touring with Shaun Frank, she made her first major impression on the dance scene with an appearance on Frank's poppy club tune ""This Could Be Love,"" released in late 2014. The pair followed it up in mid-2015 with the Beatport chart-topper ""Shades of Grey,"" a collaboration between Frank, Jane, and Oliver Heldens. Read more on Last.fm",53140,428203,Virginia to Vegas
8bfac288-ccc5-448d-9573-c33ea2aa5c30,Red Hot Chili Peppers,"Red Hot Chili Peppers is an American rock band formed in Los Angeles in 1982, consisting of Anthony Kiedis (vocals), Flea (bass), John Frusciante (guitar), and Chad Smith (drums). Their music blends elements of alternative rock, funk, punk rock, hard rock, hip hop, and psychedelic rock, and they have influenced genres such as funk metal, rap metal, rap rock, and nu metal. With over 120 million records sold worldwide, the Red Hot Chili Peppers are among the best-selling bands in history. Read more on Last.fm",7187992,552392959,John Frusciante
b33d21cc-13da-494d-aded-ef0d4fd37397,仮病,"Kebyo (仮病) is a Japanese visual kei band formed in Tokyo in 2016. The band initially focused on dark lyrical themes inspired by traditional Japanese folklore and wafuu aesthetics, later evolving toward menhera kei visuals and themes related to mental health and inner conflict. The name kebyo can be translated as “fake sick” or “feigned illness.”

After several lineup changes over the years, Kebyo entered a period of reduced activity following Read more on Last.fm",36134,1383719,gulu gulu
73e1c26f-d390-4e20-9a22-9c93acf58064,Rotten XIII, Read more on Last.fm,2568,102920,BRIGADE LOCO
d5adb20d-3d1c-4753-9edf-a99d700312c7,Morgan Delt,"Psychic Death Hole, the ultra-limited six-song cassette released in December 2012 introduced the world to Morgan Delt's self-produced, genre-bending flavor of brown acid-dosed flowerdelia. Equal parts 'Odyssey & Oracle' and ‘Parable of Arable Land’, Morgan Delt's self-titles début LP, Morgan Delt (January 2014), expands on those initial tracks and brings forth one a fully realized glimpse into the California native’s twisted brain.

Morgan Read more on Last.fm",137113,1426757,Mystic Braves
678d88b2-87b0-403b-b63d-5da7465aecc3,Led Zeppelin,"Led Zeppelin were an English rock band formed in London in 1968. The group consisted of Robert Plant on vocals, Jimmy Page on guitar, John Paul Jones on bass and keyboards, and John Bonham on drums. Known for a heavy, guitar-based sound that drew from blues and folk traditions, they are widely regarded as a major influence on the development of hard rock and heavy metal. They became one of the best-selling music artists in history and helped shape album-oriented rock and stadium rock. Read more on Last.fm",4897283,338249344,The Doors
1339fab0-3ad8-4b8e-afac-7b7ae34509c7,Thousand Foot Krutch,"Thousand Foot Krutch (often abbreviated TFK) is a Canadian Christian rock band from Peterborough, Ontario, Canada. They made their debut in 1995 when Trevor McNevan, Joel Bruyere, and Steve Augustine started putting a praise & worship spin on the nu-metal sound of the time. After building a buzz around Ontario with numerous shows and a strong demo titled That's What People Do, Thousand Foot Krutch signed with Diamante and issued their debut LP, Set It Off, in 2000. Read more on Last.fm",1166358,38200149,Nine Lashes
9b8d6e11-05a4-4688-9d96-ad746bfedc41,The Detroit Cobras,"The Detroit Cobras is an American garage rock band from Detroit, Michigan, formed in 1994.

The Detroit Cobras signed with Sympathy for the Record Industry and released their first full-length album, Mink Rat or Rabbit, in 1998. After a three-year gap, they released a second album, Life, Love and Leaving Their retro-garage rock formula proved popular in the UK and prompted the London-based Rough Trade Records to sign the band. They released an EP, Seven Easy Pieces, in 2003 and their third full-length album, Baby, in 2004. Read more on Last.fm",175436,2749850,The Dirtbombs
9753dd7c-63d4-4022-a0ec-fee4966c8cdd,Jorma Kaukonen,"Jorma Ludwik Kaukonen, Jr. (born December 23, 1940) is an American blues, folk, and rock guitarist, best known for his work with Jefferson Airplane and Hot Tuna.

Born in Washington, D.C., the son of Beatrice Love (née Levine) and Jorma Ludwig Kaukonen, Jorma Kaukonen had Finnish paternal grandparents and Russian Jewish ancestry on his mother's side. Kaukonen was a founding member of the popular psychedelic San Francisco-based band Jefferson Airplane, which scored two Top 10 radio hits in 1967 with ""Somebody to Love"" and ""White Rabbit."" Read more on Last.fm",52641,438038,John Hurlbut & Jorma Kaukonen
736e1cf9-09c6-47ac-9b98-5374e40fecf0,Walls,"There is more than one artist with this name:

1) Walls is an electronic duo from United Kingdom, made up of members Sam Willis (of ALLEZ-ALLEZ) and Alessio Natalizia (of BANJO OR FREAKOUT).

They have released ""Walls"" (2010) and ""Coracle"" through Kompakt Records.

2) WALLS is a hardcore band from Seattle/Portland: Pounding rhythms, dissonant riffs, and a terrifying vocalist all come together to create something really brutal and powerful, featuring three fourths of the final Cold Sweat line up Read more on Last.fm",86600,2618824,Robe.
4e8b94a4-081c-4093-b906-35f4bc0c0148,Las Pelotas,"Las Pelotas is an Argentinian rock band that originated from the separation of an older and pioneer band called Sumo. It is an alternative rock band that currently holds one of the top spots in popularity throughout Argentina.
Formed in 1988 in Hurlingham, Buenos Aires.

First line-up
Germán Daffunchio (guitar)
Alejandro Sokol (main vocals)
Alberto ""Superman"" Troglio (drums)
Willy Robles (bass)

Second line-up
Germán Daffunchio (guitar and backing vocals) Read more on Last.fm",100654,1965342,Divididos
b6d756a2-bb87-4c7f-9c26-e12ae0e56b8d,El Barrio, Read more on Last.fm,50427,1044692,Niña Pastori
