id_artist,artist,bio,listeners,playcount,similar_artist
e662ea36-81bf-4840-a143-cbbf8b2a74eb,ECKO,"Ignacio Matías Spallatti, better known as Ecko, was born on June 7, 1999 in La Matanza, Buenos Aires province.

He was dabbling in freestyle, trap, rap and reggaeton, until giving his first shows around the country.

He attended rap battles, winning the best competitions and earning 3rd national place in the Red Bull Battle of Roosters. Meanwhile he recorded some songs, among them ""Dealer de Skilles"", ""Disputa"", ""Cash"", and ""Legend"".

On December 14, 2017, “Dorado” was released, a single that positions it as a reference in the genre. Read more on Last.fm",54292,690406,Callejero Fino
ed8fe06e-8aea-48bb-9ca6-50e6ddda274b,La Suprema Corte, Read more on Last.fm,25421,194279,Grupo Galé
87a75fc3-59e7-4598-925c-8e230bce5db9,Anuel AA,"Emmanuel Gazmey Santiago, known professionally as Anuel AA, is a Puerto Rican rapper and singer, a pioneer of the Latin trap movement. Gazmey's music addresses topics such as street life, violence, sex, and drugs. He is seen as a controversial figure in the Latin music scene for his legal troubles and feuds with fellow Puerto Rican rappers Cosculluela and Ivy Queen and with American rapper 6ix9ine.  His music often contains samples and interpolations of songs that were popular during his youth. Read more on Last.fm",604997,33093355,Bryant Myers
ffc2a752-2025-4c49-9c31-0e06806d187f,DeeWunn, Read more on Last.fm,35358,191452,J Capri
197b70c7-8910-4030-ad03-632d82aa40e3,Rauw Alejandro,"Raúl Alejandro Ocasio Ruiz, known professionally as Rauw Alejandro, is a Puerto Rican singer and rapper. Referred to as the ""King of Modern Reggaeton"", he belongs to ""the new generation"" of Puerto Rican urban musicians. His debut studio album, Afrodisíaco, was released in November 2020. His second studio album, Vice Versa, released in June 2021, featured the lead single ""Todo de Ti"". He has won one Latin Grammy Award from four nominations.

Rauw Alejandro's music style includes Latin R&B, reggaetón, rhythmic pop and ballads. Read more on Last.fm",1077355,88455108,JHAYCO
4f4b6911-eba2-4b65-988e-0efbfdce8ed5,Sammy,"There is more than one artist with this name:

1)  This rock band was formed by Mick Underwood (previously of Episode Six, The Herd and Quatermass and later of Raw Glory) in 1972. There's lots of experience in this line-up. Keith Gemmell had been in Audience and was later in The Roy Young Band and Stackridge. Geoff Sharkey was in Ginhouse. Mike Hodgkinson and Paul Simmons were also members of The Roy Young Band and Hodgkinson had played with Billy J. Kramer. Their album was produced by Ian Gillan (of Deep Purple) and Louie Austin. Read more on Last.fm",42273,558959,Sebadoh
9d418f51-8eea-45c3-abee-528eeeb18ee4,BIA,"There are multiple artists that perform under the name Bia:

1. BIA is the short form of the electronic/industrial trio, Baby Im Auto. BIA were founded in 1980s Birmingham. They reformed in 2016 and recruited a new singer in 2025.

2. Bia (real name: Bianca Landrau) is an American rapper, singer, songwriter, and model who debuted on the Oxygen reality television show Sisterhood of Hip Hop. She signed to Pharrell's I Am Other record label, in partnership with RCA Records in 2014. Read more on Last.fm",540837,6741777,Nicki Minaj
faa2f0f5-14bf-46fd-85a1-486263bb64bb,Lary Over, Read more on Last.fm,76994,901651,Brytiago
d039b264-976d-46be-88d5-722edc4c51f8,Haze,"There are several artists named Haze:
1. Korean female rapper ""Heize"" (Don't make money) for whatever reason listed under ""Haze""
2. Czech HardCore/experimental band
3. House project by Sandy Rivera
4. Rapper from Sevilla
5. German psychedelic and progressive rock band
6. British progressive rock group
7. English rock band
8. English rapper
9. Hungarian DJ
10. Dutch Hardstyle DJ
11. Croatian Thrash/Black Metal band
12. Dutch rapper
13. Japanese indie rock band Read more on Last.fm",166011,2596440,八十八ヶ所巡礼
b414ddbf-2ffd-4a60-8749-124917688877,Santa Fe Klan,"Ángel Jair Quezada Jasso, known professionally as Santa Fe Klan, is a Mexican singer-songwriter and rapper. He featured on several songs which were highly certified by AMPROFON in Mexico, including 4× Platinum for ""Por Mi México"" by Lefty SM and 3× Platinum for ""El Catrín"" by Gera MX. He was ranked 31st on the Rolling Stone magazine's list of the ""50 greatest rappers in the history of Spanish rap,"" published in 2024 Read more on Last.fm",111627,3207259,Lefty SM
0b1aea37-1b1a-4c1f-bd59-23443ba90741,Khaled,"Khaled Hadj Ibrahim (Arabic: خالد حاج إبراهيم); born 29 February 1960), better known by his mononym Khaled (Arabic: خالد), is an Algerian raï singer, musician and songwriter born in Oran. He began recording in his early teens under the name Cheb Khaled (الشاب خالد, Arabic for ""Young"" Khaled, with ""Cheb"" as a common title for male Raï singers).
          Khaled is one of the most important musicians in the history of Raï music in his native Algeria and is one the world's best-known Arab singers. Read more on Last.fm",365662,3712252,Cheb Mami
43ad227f-40f6-48df-8ef5-83e54080fbd3,Spiff TV, Read more on Last.fm,18751,99870,Benny Benni
28912cbb-962a-4447-b91b-e0f437ad29ac,El Chacal, Read more on Last.fm,20496,155728,El Micha
46d3689c-23e6-46f7-8ad6-c12f13ac9dea,C. Tangana,"Antón Álvarez Alfaro (born July 16, 1990), known professionally as C. Tangana, is a Spanish rapper and songwriter.He began his musical career while in high school, rapping under the pseudonym Crema and releasing a seven-track EP titled Él Es Crema (2006). He gained recognition in Spain as a member of the band Agorazein. In 2016, Tangana began performing as a solo act under the stage name C. Tangana.

After releasing a number of singles in 2016 Read more on Last.fm",475982,28948849,Cruz Cafuné
71b9b37a-fee0-4809-9c49-8e34709c7add,Pepe Quintana, Read more on Last.fm,55749,573648,Juhn
01b8b5bf-06cb-45da-85fb-61ada72fcd69,Camila Cabello,"Karla Camila Cabello Estrabao (born March 3, 1997), known by her stage name Camila Cabello, is a Cuban-Mexican-American singer and songwriter. She is a Latin-influenced pop performer who first came to prominence as a founding member of the girl group Fifth Harmony. Born in Cojimar, Cuba, Cabello moved to Miami, Florida at the age of six. Growing up in a Spanish-speaking environment (born to a Cuban mother and Mexican father), she fostered her love of music by listening to Celia Cruz and Alejandro Fernández. Read more on Last.fm",2366557,127179302,Fifth Harmony
cabbb345-e61c-4e80-a0a8-a3beb2823851,Lunay,"Lunay is a Puerto Rican reggaeton artist whose charting collaborations with artists such as Daddy Yankee, Anuel AA, Bad Bunny, and Zion & Lennox resulted in him scoring his own recording contract. 

Born in Puerto Rico in 2000, Lunay was far more interested in soccer than music as a young teen, but he caught the bug at 15. A year later, he was creating freestyle raps and uploading them to his Facebook and SoundCloud pages. Several of his audio clips went viral and caught the attention of producers Chris Jedi and Gaby Music Read more on Last.fm",335539,5197508,Ozuna
0cd6af55-5d78-4aee-a64c-71522ba031b7,Moncho Chavea, Read more on Last.fm,24446,240301,El Ougyy
1d47b224-2cd9-4852-8e55-b9ec635e0c43,Cazzu,"Julieta Cazzucheli nació en 1994 en Jujuy (Argentina), rodeada siempre de un ambiente bastante folklórico. Fue en ese ambiente dónde comenzó a tener sus primeros contactos con la música. Estuvo en varios grupos de cumbia y lleva haciendo música desde hace catorce años.

Cazzu es una artista de música urbana que se caracteriza por haber sido siempre muy voluble. Ha trabajado muchos estilos durante toda su carrera, pero encontró en el trap y el reguetón su verdadero lenguaje. Read more on Last.fm",201927,5636973,Maria Becerra
8c1ca06b-b983-4614-8e57-9d0839b16017,Kevin Kaarl,"Kevin Kaarl es un joven cantautor de tintes nostálgicos y norteños, cuyo talento se ha ido abriendo camino en el mundo de la música con sus canciones de folk campirano que ha compuesto a lo largo de todo su proyecto en el que está acompañado por su hermano gemelo, Bryan Kaarl, quien toca la trompeta y hace segunda voz. Read more on Last.fm",276462,12610749,Ed Maverick
04cff564-a2e3-4560-8e7e-bc2539e7b46c,Reik,"Reik is a Mexican band from Mexicali, Baja California, Mexico. Formed by Jesús Alberto Navarro Rosas (Lead Vocals), Julio Ramírez Eguía (Guitar, Backing Vocals), and Gilberto Marín Espinoza ""Bibi"" (Backing Guitar, Backing Vocals).

In 2003, Jesús Navarro and Julio Ramirez started their then-nascent musical project, tentatively called ""Reik"". It was then they recorded their first demos, which were released through the Mexican underground club scene. Read more on Last.fm",613682,14190687,Camila
aa114151-4a17-42b0-8e20-37b434627479,DJ Snake,"William Grigahcine, better known by his stage name DJ Snake, is a franco-algerian DJ, rapper and producer mixing hip hop and electronic music.

He is a Grammy-nominated producer and artist who debuted into the international scene with singles ""Bird Machine"" and ""Turn Down for What"" in 2013. ""Bird Machine"" is a collaboration with fellow French act Alesia. The single was picked up by Mad Decent, a Los Angeles-based record label run by Diplo, and released in February 2013. Read more on Last.fm",2555380,47769470,Jack Ü
73577e2a-bfb4-4731-b034-073869f4ed90,Young Izak, Read more on Last.fm,604,3546,Los de la Nazza
43a86a8a-3659-4911-9c36-cbcf0cbcd5b5,Teejayx6,"Dallas Antoino-Karine Asberry (born August 28, 2001), known professionally as Teejayx6, is an American rapper from Detroit, Michigan, known for his breakout single “Dark Web,” which first gained popularity through internet memes. 

Teejay is best known for being the founder of the ""Scam Rap"" subgenre. 

Teejayx6 is also known for his beef with rival scam rapper, Punchmade Dev. This beef originated in 2020 on an Instagram Live. In early 2022, Punchmade Dev uploaded a video of him pressing Teejayx6 in a mall which went viral on social media. Read more on Last.fm",89742,1690022,Kasher Quon
28a40ac6-fb01-42e1-b686-dea48171bbe2,Jhonny Rivera, Read more on Last.fm,13587,143381,El Charrito Negro
9d9ccc30-ac53-4ae0-80fc-e69d1ee12a56,Obie Wanshot, Read more on Last.fm,18565,282279,Marcianos Crew
86c5b0ae-81a7-4c88-8a2f-df24b8beb55a,La Mafia del Amor, Read more on Last.fm,47588,2997055,Yung Beef
9dae4917-e46c-4a60-baa6-efb6a4a64a94,Rafa Pabön, Read more on Last.fm,25056,151247,Omy de Oro
5f2cb99a-7e59-429f-a44d-3a880edccfb1,Aventura,"From their roots as a Bronx-based boy band fusing bachata with hip-hop, R&B, and pop, Aventura have becme one of the most influential Latin groups of all time. Their primary signature comprises inimitable, elegant, four-part harmonies, earworm melodic hooks, and rhythmic imagination. Beginning with 2005's ""Ella y Yo"" (feat. Don Omar) they placed numerous singles inside the Top Ten, including the chart-toppers ""Por un Segundo"" and ""Dile al Amor."" Further Read more on Last.fm",1007863,24240152,Romeo Santos
7d0805f4-60db-413d-81f1-eb4adac6ae60,Chris Viz, Read more on Last.fm,20106,139310,bandaga
f4d7f8aa-8f38-41cd-bc57-e214cfe2982f,Dayme y El High, Read more on Last.fm,37160,259558,RONALD EL KILLA
ccdb6a3f-e443-4dc7-a0c5-5dc9e89948ec,Sticky M.A.,"Rapero español perteneciente al colectivo Agorazein junto con otros artistas como C. Tangana, Jerv o Fabianni. Antes conocido como Manto, cambió su nombre en la mixtape Chill Trill en 2014. Read more on Last.fm",54509,5197951,Yung Beef
89fe777e-8d33-411d-9fe9-027f67c1e8f1,Bryant Myers,"Bryan Robert Rohena Pérez, known professionally as Bryant Myers, is a Puerto Rican Latin trap and reggaeton singer and songwriter. Rohena was born in Loma Alta, Puerto Rico. He began sampling and making his own songs in 2013 and launched them on social media via his SoundCloud, Instagram and YouTube accounts. Read more on Last.fm",196765,7102439,Anuel AA
f3116d70-a23c-4dae-963c-a6332ad7a26f,Zion,"There are at least five artists named Zion.

1. ZION (ザイオン) is a Japanese alternative rock band from Tokachi, Hokkaido.

Vocals & Guitar - Mitsumura Tatsuya (光村龍哉; ex NICO touches the Walls)
Guitar - Kushino Keisuke (櫛野啓介; ex jealkb as sapoto)
Guitar - Yoshizawa Sachio (吉澤幸男; GAGAKIRIZE, 平方根レジェンド, Loloet)
Drums - Naruhashi Taichi (鳴橋大地)
Bass - Sato Shinnosuke (佐藤慎之介)

Formed in Tokyo in 2020. Read more on Last.fm",325551,3406922,Wisin & Yandel
c458e9dc-e0d5-45ea-9e83-f9d0395f030d,Nicky Jam,"
Nick Rivera Caminero better known as Nicky Jam was born to a Puerto Rican father and a Dominican mother in 1980 in Boston Massachussets which he live in until he was six and moved to 
Barrio Obrero, P.R. He is a reggaeton artist known for hits like:
""Me Voy Pa'l Party"" ""Chambonea"" 
""No Soy Tu Marido"" ""I'm Not Your Husband"" which is a remix in spanglish of ""No Soy Tu Marido""
 Read more on Last.fm",1045955,15409330,Ozuna
aca765c2-f327-4e64-b521-4ea248401ab8,Lalo Ebratt,"Eduardo Mario Ebratt Troncoso (born February 3, 1993, in Santa Marta, Colombia), better known by his stage name Lalo Ebratt, is a Colombian reggaeton singer who first came to public attention as a member of Trapical Minds, a latin hip-hop project put together by Colombian label RedSnapperMusic that also features singers Yera and Skinny Happy, before launching a solo career.

He is best known for his viral hit single ""Mocca"", released on April 27, 2018. Read more on Last.fm",78117,677054,The Rudeboyz
0d37f1cd-ee7f-4b5d-a565-11c105c55898,Baby Angel, Read more on Last.fm,765,3767,milkcartonangel
1dcee96e-7d8c-4ba1-ae62-bbb694033966,Pignoise,"Pignoise is a Spanish rock / pop punk band comprising three members: Álvaro on guitar and voice, Polo on drums, and Pablo on bass. Read more on Last.fm",75721,1429970,El Canto del Loco
4cea5aae-7b0e-4167-a187-e97407828a57,Alex Rose,"Alex Rose. Alexis Guzmán Artista y Compositor de "" Oidos Fresh Company"". Read more on Last.fm",165496,3033787,Brytiago
f1642d37-bbe2-4aff-a75e-86845ff49fa4,Luigi 21 Plus,"Hiram David Santos Rojas (San Juan, Puerto Rico, 27 de abril de 1977), conocido como Lui-G 21 Plus o en sus inicios solo como Lui-G, es un cantante de reggaeton puertorriqueño.

Hiram Santos nació en Cupey Bajo, Puerto Rico. Se empezó a interesar por la música a los 20 años y se muda a Lynn, Massachusetts, donde descubrió su pasión por improvisar y escribir canciones para el género de música que siguió desde sus comienzos como fanático. Read more on Last.fm",54472,803165,Ñengo Flow
91b214df-43b3-4910-a76e-29c9a51d4c95,Ptazeta, Read more on Last.fm,69928,832177,Lola Indigo
980422f0-0974-4516-908e-73ab42108a9c,Grupo Extra, Read more on Last.fm,41813,433005,Dani J
4db5a9a8-42bc-4c9e-812b-067cbab04db7,Jon Z,"Jonathan Resto, también conocido como Jon Z, nació el 20 de mayo de 1991 en San Juan, Puerto Rico. ... En realidad, Jon Z eligió su nombre artístico como un homenaje a su madre, cuyo nombre es Nancy. ""Cy"" en español sueña similar a la letra ""Z"" en inglés. Su primer álbum, ""The Game Is About to Change"", fue lanzado en 2015. Read more on Last.fm",119290,2179637,Ele A El Dominio
a992aada-7108-455d-9747-0b7b6a089e8d,Joaquín Sabina,"Joaquín Ramón Martínez Sabina (Úbeda, Jaén, Spain, 12 February 1949), known artistically as Joaquín Sabina, is a singer - songwriter, and poet. He has released fourteen studio albums, two live albums, and three compilation albums. He has collaborated and composed songs for Ana Belén and Miguel Ríos amongst others.

Joaquín Sabina, is the second son of Adela Sabina del Campo and Jerónimo Martinez Gallego, which was a policeman. He attended Read more on Last.fm",235711,7624923,Luis Eduardo Aute
14d78134-bb77-4c1e-8c9b-b74284abf1cc,Belinda,"Belinda Peregrín Schüll, known by artistic name Belinda (born August 15, 1989 in Madrid, Spain), is a Latin Grammy Award nominated Spanish-Mexican singer, songwriter, dancer and actress, who debuted in 2003 with the self-titled album, Belinda, under Sony BMG and RCA Records. Her international self-titled album Belinda as released in Mexico City, Mexico by BMG and RCA Records on August 5, 2003 and became a great a success in many different countries including Mexico, selling 2.5 million copies worldwide.  Read more on Last.fm",482287,11184902,Paulina Rubio
25be91ac-7d7c-441f-a7d2-98e35d642e4c,NATTI NATASHA,"Natalia Alexandra Gutiérrez, known by her stage name Natti Natasha, is a Dominican reggaeton singer, songwriter, and actress. Hailing from Santiago de los Caballeros, Dominican Republic, Natasha grew up surrounded by endless musical influences and enrolled in Santiago’s School of Fine Arts at the age of seven where she developed her singing abilities, describing her time at the school as “one of the best of her life.” Her studio experience would begin as a teenager when she would record songs as a hobby and later alongside friends. Read more on Last.fm",372098,5193595,Becky G
1266823d-bd9d-4e1b-9ec2-601180e057b3,Tempo,"There are atl least two artists/bands named tempo, a Reggaetón-artist from Puerto Rico, and a German Punk Band from Berlin (1978-1982).

1. David Sánchez Badillo (nacido el 25 de septiembre de 1979 en Ponce, Puerto Rico) mejor conocido como Tempo, es un cantante de rap y reggaeton. Es uno de los artistas más influyentes del genero reggaetón y es considerado para muchos el rey del rap latino.

David Sánchez Badillo es uno de los raperos más activos en producciones musicales dentro del género del “rap”. Read more on Last.fm",105752,582489,Vico C
2b9967c7-3246-4658-a561-ded5408dd9af,Los Lobos,"Los Lobos are a Mexican-American  rock band from East Los Angeles, California, USA, heavily influenced by rock and roll, Tex-Mex, country music, folk, blues, and traditional Spanish / Mexican music such as boleros and norteño.

Vocalist/guitarist David Hidalgo and drummer Louie Pérez met at Garfield High School in East Los Angeles, and bonded over their mutual affinity for obscure musical acts such as Fairport Convention, Randy Newman and Ry Cooder. Read more on Last.fm",703803,6082858,John Hiatt
accd01a1-8ad6-455e-ad13-27c09e36b4c8,Chema Rivas, Read more on Last.fm,27776,264510,Fabbio
2f522f5c-111c-4ce8-8bd0-d82e97c227ad,Daddy Yankee,"Ramón ""Raymond"" Luis Ayala Rodríguez (born February 3, 1976), known artistically as Daddy Yankee, is a Latin Grammy Award winning Puerto Rican reggaeton recording artist. Ayala was born in Río Piedras, the largest district of San Juan, Puerto Rico, where he became interested in music at a young age. In his youth he was interested in baseball, and aspired to become a Major League Baseball player. He was unable to continue this sport when he got shot in the leg by being mistaken for his friend by a unknown man Read more on Last.fm",2201168,50381375,Don Omar
93ba42f8-10c5-4865-9ca1-e7e7a5c9f389,Kurt Hugo Schneider,"Kurt Hugo Schneider (born September 7, 1988) is an American video editor, producer, musician, singer and songwriter, whose primary medium is YouTube music videos. He produces music videos for various YouTube musicians, such as Sam Tsui, including the musical medley videos in which Tsui sings as a one-man choir, and Avicii's ""Waiting For Love"".

Schneider was born in Baltimore, Maryland to Laurie S. Auth, a visual artist, and Michael Schneider, a mathematician. Read more on Last.fm",235669,2670896,Sam Tsui
37705ca5-fb95-4f03-be56-7259973c77e7,Juanka, Read more on Last.fm,18640,171757,Darkiel
fbf55b2c-d79f-4fdf-bcdc-9df32f2dd1dc,Yai y Toly, Read more on Last.fm,61,159,TYS Musica
b785fec3-4329-48ee-86ab-5df83859bf67,Pedro Capó,"Pedro Capó (artistically also Capó) is a singer-songwrite from San Juan, Puerto Rico that debuted in 2007. He is the grandson of singer Bobby Capó.

Pedro Capó picked up the guitar at an early age and quickly demonstrated great virtue with the strings, even becoming the main voice of the group Marka Registrada.

Currently Pedro resides in New York City. Where he has starred in musical productions including: Apollo Theatre’s production of “The Read more on Last.fm",248701,2058275,Pablo Alborán
90f83751-ee85-48c4-b401-6396ee13fb9b,Paloma Mami,"Paloma Mami is a Chilean-American singer, songwriter and social media personality who became popular in 2018.  

According to her website, ""Leading up to the release of “No Te Enamores”, Paloma’s first release since signing to Sony Music Latin, the buzz around New York/Chilean singer-songwriter, Paloma Mami, continues to grow due to the viral success of her independently produced single and video “Not Steady.” Since its release in June 2018 Read more on Last.fm",191899,5797086,Princesa Alba
b8ba2ae6-a233-4b9c-bce3-ea7a7803c946,Rocío Dúrcal,"Rocío Dúrcal (October 4, 1944 - March 25, 2006), María de los Ángeles de Las Heras Ortiz, was a Spanish singer and actress. Her birth and death both occurred in Madrid, Spain. She was affectionally known as ""the most Mexican of Spaniards"" by her adoring Mexican fans.

She was discovered in singing contests at the age of 15 and offered a role at 17 in Canción de Juventud. After acting in several films she married Filipino-Spanish singer Antonio Morales (a. Read more on Last.fm",320436,4953856,Ana Gabriel
d08d514d-764b-4c82-bd5b-bb3f63e450ba,Dubbel Dutch,"Austin, TX, selector Dubbel Dutch is impervious to the crutches of genres, though a student of many of them. An accomplished producer of cosmic tone poems and club anthems from the abyss, many claim his now classic Throwback 12” on Palms Out Sounds saved their lives–or at least taught them a lesson in modern retrofitting. A chemistry of pre-hispanic shaman cries, YouTube videos of American microcosms, and 90s UK rave flyers make up his aesthetic, one which is not often associated with the Lone Star State. Read more on Last.fm",13734,76099,Jamie Grind
3d269828-8624-4fe5-a2ad-0a6aaa6f4704,Ir Sais,"Irgwin Placido Sluis (Nort di Saliña, 29 september 1988), beter bekend als Ir-Sais, is een Bonairiaanse zanger.

Irgwin Sluis werd geboren in Nort di Saliña en groeide op in de wijk Tera Corá. Hij heeft een Bonaireaanse vader en een moeder afkomstig van de Dominicaanse Republiek.[1] Toen hij 1 jaar oud was overleed zijn vader. Hierdoor is hij alleen door zijn moeder opgevoed. Sluis kwam op zijn zevende in contact met de muziek, welke zijn interesse begon te wekken. Read more on Last.fm",134526,1117097,Darell
45f48079-12ad-4da7-b309-ed79afa6d06f,Sam Sage, Read more on Last.fm,317,3341,CioMadeTheTrack
7e2012a4-2752-46c1-90b8-f48f3fa43412,Kaydy Cain,"Daniel Gómez Carrero (Dani Gómez; born 12 February 1990), known professionally as Kaydy Cain, is a Spanish rapper and former member of the music group Pxxr Gvng (pronounced as poor gang; later known as Los Santos). He is recognised for his original style and his contributions to the explosion of the genre trap in Spain.

Dani Gómez began his artistic journey in the 2010s as a member of the trap group Pxxr Gvng, with which he was able to turn his life around thanks to the popularity that hip hop began to enjoy in Spain Read more on Last.fm",93010,4011683,Yung Beef
6a391cef-d34c-420f-92ed-f16c4cfe206f,Kika Edgar,"Kika Edgar (born Sandra Ericka Edgar Garza) on January 9, 1985 in Tampico, Tamaulipas, is a Mexican actress and singer. Starting her career primarily in theater and musicals, she has become well-known in Mexico, starring in telenovelas such as Amor Real and Contra Viento y Marea. It wasn't until 2006 when she started her singing career with help of the fame she gained for her singing in the Mexican reality show Cantando por un Sueño. Since then, Kika Edgar has released two solo albums Read more on Last.fm",6719,97039,Myriam
f043a667-d0cc-41ec-b242-22068c5cd736,Joey Montana,"Joey Montana is one of the hottest newe stars of Latin music. At 23 years of age, he has broken ground in Central and South America, Mexico, the United States and Europe. Armed with his lyrical abilities and explosive personality, he is looking to make a name for himself in the ever so popular and growing urban/Latino market, leaving behind his former group of ""La Factoria"". 

His real name is Edgardo Antonio Miranda Beiro, and he was born in Panama City, Panama; on May 3rd, 1982. Read more on Last.fm",157060,1222453,Chino & Nacho
6bfd8414-f22f-47ae-b1a2-0c84d8252ec6,Marciano Cantero, Read more on Last.fm,2555,13187,Raul Porchetto
149c65b2-93e3-4009-84fb-5643f6d1094e,Pusho, Read more on Last.fm,20947,142716,Benny Benni
e830b6c6-1e0c-478a-9cb0-551706180cb5,Villanosam,"Winston Antonio Aponte Acta, (born, February 20, 1979) better known by his stage name Villanosam or ToñoStone, is a Dominican Hip-hop Rap artist, composer and producer.  He was born and raised in San Pedro Macoris, Dominican Republic and is the son of Winston Bruno Aponte Agesta and Marina Antonia Acta De Aponte.  

In 1989, when Villanosam was merely 10 years old he started to listen to Rap music as it was evolving on the music scene in the United States. Read more on Last.fm",8027,40875,Lapiz Conciente
c6ea4544-8805-4d98-b7e7-af77a83a8932,El Vega, Read more on Last.fm,33021,253455,Comando Tiburon
5bae7081-64ef-4473-825a-38d310deb14c,Will Smith,"Willard Carroll Smith II (born September 25, 1968) is an American actor, rapper, and film producer. He has received multiple accolades, including an Academy Award, a Golden Globe Award, a BAFTA Award, and four Grammy Awards. As of 2025, his films have grossed over $9.5 billion globally, making him one of Hollywood's most bankable stars.

Smith first gained recognition as part of a hip hop duo with DJ Jazzy Jeff, with whom he released five studio albums which contained five Billboard Hot 100-top 20 singles—""Parents Just Don't Understand"" Read more on Last.fm",1920670,20191667,DJ Jazzy Jeff & The Fresh Prince
