id_artist,artist,bio,listeners,playcount,similar_artist
34a034a5-cc93-4c92-9c01-c0cfd27f823f,Soto Asa,"Álvaro Soto (Ceuta, España,1 de abril de 1993), más conocido como Soto Asa, es un cantante y compositor de música urbana y reggaetón. Un símbolo que le representa es el 999. Esto se debe a que es el número del diablo (666) invertido. Tiene la teoría de que se puede ser malo pero inteligente, hay que darle la vuelta a la maldad, ya que no solo destruye.​ El ceutí es un músico que huye de etiquetas, no firma con publicidad ni moda para sacarse beneficio, ni da titulares que llamen mucho la atención para conseguir audiencia.  Read more on Last.fm",70015,4006465,La Mafia del Amor
db607377-aace-4a32-a439-373b7236df7e,Trueno,"Mateo Palacios Corazzina, better known as Trueno, is an Argentine rapper and freestyler, originally from the La Boca neighborhood in Buenos Aires. He is known for his outstanding participation in rap battles, winning contests such as FMS Argentina and Red Bull Batalla De Los Gallos in 2019.

His debut album, Atrevido was released on July 23, 2020 through NEUEN and distributed by Sony Music Latin. The album features the collaborations of artists such as Alemán, Wos, Nicki Nicole and Bizarrap. Read more on Last.fm",348971,18781930,Milo j
9fc27a6f-fbcd-45a6-ae14-84d298c2c994,Unorthodocks, Read more on Last.fm,535,2126,Bane Capital
dde4b4b3-55fb-4038-8656-f39967f7cb04,El Combo Perfecto, Read more on Last.fm,4152,25877,La Mafia del Amor x El Combo Perfecto
1bc6816a-d056-4113-9b0a-6c52e5c31a3c,Santana the Golden Boy, Read more on Last.fm,8700,78966,Tony Brouzee
f1d7817b-80f4-48c3-a4d0-e324015c7e96,Famous,"There is more than one artist of this name.

1. famous was an experimental dance-punk band fronted by singer Jack Merrett that existed from 2016 to 2025. 
 
2. San Antonio, Texas Rapper Signed To Chamillitary Ent. Formerly Of 3rd Degree (Famous, Mark G, Liveola & Kyle Lee).

3. Toronto emcee rapper FAMOUS.

4. Australian rock band.
        Although starting later than most of the other Australian post-punk bands, their members included many people who had been in earlier bands plus the next wave of fan-musicians from Newcastle NSW. Read more on Last.fm",55541,681250,Do Nothing
a93e2bd1-6e89-48a8-bf29-d8a32bb416cb,Yiyo Sarante, Read more on Last.fm,58810,599665,Frank Reyes
7d6d748f-13fc-4f9c-adc8-087d34c4bdef,Mala Rodríguez,"Artist page: La Mala Rodriguez

María Rodríguez, also known as La Mala, La Mala María, or Mala Rodríguez, is a Spanish hip hop singer. She was born in Jerez de la Frontera,(Cádiz), 13 February 1979. She moved to Seville when she was 4 and to Madrid when she was 19.

Her hip-hop songs are greatly influenced by flamenco music. Some of her lyrics talk about feminism and the problems of the outcasts of society, but in general they are rather abstract. Read more on Last.fm",115799,1803207,Ana Tijoux
b69b9854-f568-4a50-b076-309c459946a8,Austin Mahone,"Austin Carter Mahone (born April 4, 1996) is an American singer and songwriter. Austin Mahone may have discovered music the old-fashioned way, but his rise to stardom has been undeniably cutting-edge. Begging his mom for a drum set at 6 years-old, he caught the proverbial ""bug"" after roaming around a local La Vernia, TX music store. Luckily, the drums ended up under the Christmas tree that year. Fast forward to 2010, Mahone started uploading covers of everyone from Drake and Justin Bieber to Ne-Yo and Bruno Mars to his YouTube page Read more on Last.fm",501724,10802960,Abraham Mateo
7b8e1188-9ca4-4aa5-8393-172de6fa04de,Celia Cruz,"Celia Cruz (born as Úrsula Hilaria Celia de la Caridad Cruz Alfonso in La Habana, Cuba on 21 October 1925 – died 16 July 2003) was a Cuban-American and was one of the most successful salsa performers of the 20th century, having earned twenty-three gold albums. She was renowned internationally as the ""Queen of Salsa"" as well as ""La Guarachera de Cuba.

In 1950, Cruz made her first major breakthrough, after the lead singer of the La Sonora Matancera, a renowned Cuban orchestra, left the group and Cruz was called to fill in. Read more on Last.fm",571228,4879777,Marc Anthony
7f464f95-2410-4040-a88e-1dbe96f17fcd,Christian Nodal,"Christian Nodal (born January 11, 1999, Caborca, Sonora) is a Mexican singer and songwriter known for his contributions to the regional Mexican music scene. From a young age, Nodal displayed a natural affinity for music, owing to his familial background of musicians and singers. His early musical journey began at the tender age of 4 when he discovered his passion for singing. By the age of 9, he had already ventured into playing the trumpet, demonstrating his burgeoning talent. Read more on Last.fm",280388,9179760,Pepe Aguilar
d2b3524f-67e8-45ef-bfc1-693cac525135,Farruko,"Farruko is a reggaeton and Latin pop singer from Puerto Rico. His given name is Carlos Efren Reyes, and he was born in Bayamon, Puerto Rico in 1991. At the age of 16, he began to post his songs under his stage name to MySpace. His first single, ""Sexo Fuera del Planeta,"" gained thousands of followers, and from there he explored the potential of other social media networks. Due to his massive success on the Internet, he came to the attention of Puerto Rican radio and music industry executives, who enlisted his vocal talents for other artists. Read more on Last.fm",800611,10869579,Nicky Jam
faf4cefb-036c-4c88-b93a-5b03dd0a0e6b,Demi Lovato,"Demetria Devonne Lovato, known professionally as Demi Lovato, is an American singer, songwriter, and actress. After appearing on the children's television series Barney & Friends (2002–2004), Lovato rose to prominence for playing Mitchie Torres in the musical television film Camp Rock (2008) and its sequel Camp Rock 2: The Final Jam (2010). The former film's soundtrack contained ""This Is Me,"" Lovato's debut single and duet with Joe Jonas, which peaked at number nine on the Billboard Hot 100. Read more on Last.fm",3335891,196763910,Demi Lovato & Joe Jonas
85b0112b-50ce-4b3e-8857-6ca7ea3f3584,Keko Musik, Read more on Last.fm,894,2934,NAYHLO
716c711c-b9cc-4b83-bfd9-dc14bdc1e770,KEVVO,"Kevin Manuel Rivera Allende, conocido profesionalmente como Kevvo, es un cantante puertorriqueño Reggaeton y Trap Latino​ que llegó a la fama con su canción 105F, que incluía un remix con múltiples artistas notables de reggaeton como Ñengo Flow, Myke Towers, Darell, Chencho de Plan B, Arcángel, Farruko y Brytiago.​ Read more on Last.fm",61638,604300,Miky Woodz
40de1c05-2a3b-4fab-a7c6-82776c37edfa,Taxi,"There are several artists known as Taxi:

1. Taxi (Gibraltar) Born from the ashes of Gibraltar based Melon Diesel,Taxi was born in 2004 formed by Dylan Ferro(Vocals),Dani Fa (Guitars) and Danny Bugeja (Guitars). Having sold more than a quarter of a million copies in their musical career, Taxi are currently promoting their new album ""MIRANDO ATRAS"",a collection of their greatest hits including 2 new songs and a cover version of Gun..s ""Better Days"" due 9th September. Their album ""Aqui y Ahora""got a Latin Grammy nomination. See www.taxi.com.es Read more on Last.fm",100988,980943,Cargo
289b0796-7b37-438e-bec8-c0590961c4cc,Kendo Kaponi, Read more on Last.fm,25561,378256,Cosculluela
9ded7dc2-70e1-4cdc-9845-27ad38c9e5fc,Lenny Tavárez,"Julio Manuel González Tavárez (Puerto Rico, 19 de mayo de 1987), más conocido por su nombre artístico como Lenny Tavárez es un cantante puertorriqueño de reggaeton y trap latino. Anteriormente fue parte del dúo musical Dyland & Lenny. Read more on Last.fm",117429,1424583,Justin Quiles
72adb13a-800e-44b5-9aef-5c7d8cb6a2d7,Mr Eazi,"Oluwatosin Ajibade (born 19 July 1991), better known by his stage name Mr Eazi, is a Nigerian singer, songwriter, and entrepreneur. He is the pioneer of Banku music, a fusion sound he describes as a mixture of Ghanaian highlife and Nigerian chord progressions and patterns. Mr Eazi relocated to Kumasi in 2008 and enrolled at KNUST, where he began booking artists to perform at college parties. He showed interest in music after recording a guest verse on ""My Life"", a song that gained traction and became a popular record at KNUST. Read more on Last.fm",149127,1583548,Patoranking
74adca15-9799-4c89-8984-e7d107a1b6bb,Homer El Mero Mero,"Lucas Darío Giménez (Born in June 5, 1990) better known by ""Homer El Mero Mero"", is an Argentine singer, rapper and occasional actor, recognized for his collaboration with the band Bardero$ together with C.R.O and for his solo career, in genres like rap, RKT and boom bap. He is part of the artist collective known as MDBCrew, along with C.R.O, Franky Style, Lil Troca and Chulu.

Homer el Mero Mero, is one of the most respected rappers in the scene. Read more on Last.fm",38803,1267266,Bardero$
fed552ea-ae0a-4841-936f-47fc430d37a3,DJ Pablito, Read more on Last.fm,49669,260804,Pipe Calderón
12233494-e5d7-427f-8cea-0fc6893fc1d1,Chimbala, Read more on Last.fm,93739,858096,Bulin 47
2a34ac3d-8769-4f78-bedd-f8bdc52b265a,Messiah,"There are several artists named Messiah.
1) Messiah is a Swiss death/thrash metal band, formed in 1984.
3) Messiah is a Lithuanian hip-hop band. Ream more at MC Messiah.
4) Messiah was a death/thrash metal band from Argentina.
5) Messiah was a rapper from the 1990s.
6) Messiah was an American power/epic heavy metal band during the 80's.
7) Messiah was a punk band from New Delhi, India. Formed in late 90s, they released an album called ""The Antidote"" . Read more on Last.fm",64968,788582,Protector
b7f74c63-65e2-43af-8b51-4dc5db6b95dd,Pipe Bueno, Read more on Last.fm,29856,324008,Jessi Uribe
006a6ff6-00e8-4a02-b452-ea9304d74023,Nacho,"There are two artists with the name nacho.

1. Nacho, a breakcore producer, known for a distinctive blend of emotionally charged, glitchy, and atmospheric compositions. They typically incorporate elements of IDM, ambient, and hyperpop. The artist's identity remains largely anonymous, with limited public information available.

2. Nacho, full name Miguel Ignacio Mendoza Donatti, was born on August 22, 1983, in Lechería, Venezuela. Nacho's music is known for its catchy melodies, rhythmic beats, and romantic themes. Read more on Last.fm",148889,1265973,YEM
575ca0a7-c35a-4bd3-bbfc-044007922216,Beéle,"Brandon De Jesús López Orozco, mejor conocido como Beéle, es un cantante y autor enfocado en sonidos del caribe y el mundo urbano. Nacido en Barranquilla, Colombia, el cantante de 17 años empezó su carrera a los 13 años.

En el 2019, fue firmado por DJ Luian y Mambo Kingz: Hear This Music, con el tema “Loco” como su debut. Beéle ha colaborado con otros artistas, como Montano, Totoy, Farruko, Natti Natasha, Manuel Turizo, entre otros. Read more on Last.fm",216270,4974646,Kapo
9971d582-1582-4b48-850a-2dfe793a5d30,Chino & Nacho,"Chino & Nacho is a Venezuelan pop duo, consisting of Jesús Alberto Miranda Perez (Chino - born November 15, 1984) and Miguel Ignacio Mendoza (Nacho - born August 22, 1983). In 2010, the group won the Latin Grammy Award under the category of Best Urban Music Album for their album, Mi Niña Bonita.

Before making a duo, Chino and Nacho were both part of a boy band Calle Ciega. That was where they started their musical career, and released five albums, and had their hit single, Mi Cachorrita. Read more on Last.fm",241618,2472748,Joey Montana
b1caae3b-3f57-419f-9df9-e250a94275d6,Piso 21,"Juan David Castaño (el llanero), David Escobar (Dim), Juan David Huertas (El profe) y Pablo Mejía (Pablito), son los integrantes del grupo que ahora suena en las emisoras de la ciudad de medellin, Piso 21.

El mayor tiene solo 26 años y el menor 21. Son jóvenes, sí, pero ya son conscientes de su éxito y más que un grupo, ellos se consideran una familia, pues lo más importante, antes de cantar, es la unión y la lealtad a su amistad.

Todo Read more on Last.fm",323144,5981033,Manuel Turizo
f8864de3-7a98-4858-8a8a-5df466394914,TIMBALIVE,"BIOGRAPHY:

 The Timbalive proyect burst into the music scene in Miami in August 2008, created by Leo Garcia (Director, Timbals, Vocals), offering the best of Cuban Music with a mix of different rhytms from around the world and sophinsticated production techniques, offering a spectacular live show.
Timbalive is a group of Miami, and all membersare highly trained musicians from music schools in Cuba, some of them have played with the better known around the world as Amaury Gutierrez Read more on Last.fm",14967,175674,El Niño y la Verdad
3d291f48-a8be-4113-baad-c73618a7897d,Yandel,"Yandel is half of the superstar reggaeton duo Wisin & Yandel, who enjoyed mainstream breakthrough success with Pa'l Mundo (2005). Born Llandel Veguilla Malavé on January 14, 1977, in Cayey, Puerto Rico, he and Wisin began performing as a duo in the late '90s (Yandel then billing himself as ""Llandel"") and made their album debut in 2000 with Los Reyes del Nuevo Milenio. They later made the jump to a major label in 2003 with Mi Vida... My Life, their first for Universal subsidiary Machete Music. Read more on Last.fm",482050,8972275,Wisin
2743f353-a948-4e06-a179-9db1ae7ed20e,Dasoul, Read more on Last.fm,45962,324175,DCS
3fd3e291-2fcd-488e-bf79-7a778139eca0,Cali Flow Latino, Read more on Last.fm,16182,95407,Anddy Caicedo
dac97765-2bea-4fb5-bcca-515dc695d389,Demaro Small, Read more on Last.fm,68,165,Lowlight
ab1d4693-41dd-44ed-9e9c-da2ff76f1a3a,Maikel Delacalle, Read more on Last.fm,85898,1093520,Rels B
3c540922-e986-4f7f-87c9-8fe34ec72bb9,Espinoza Paz,"Isidro Chávez Espinoza (29 de octubre de 1982, Angostura, Sinaloa, México), más conocido como Espinoza Paz, es un músico y compositor mexicano de Musica Norteña y Banda. Aproximadamente a los 11 años escribió su primera canción, cuando se enamoró de una compañera de su escuela. A los 13 años ya contaba con alrededor de 20 canciones.

Con una carrera en un plan totalmente ascendente, Isidro Chávez, mejor conocido en el mundo de la música Read more on Last.fm",119457,1719133,Calibre 50
955421b1-2e00-4cac-9b3a-559368fced16,La Insuperable, Read more on Last.fm,11656,83754,La Perversa
abb91078-f7db-41f2-8f07-7f37bb739143,Jorge Drexler,"Jorge Drexler (n. Montevideo; September 21, 1964), is a critically acclaimed Uruguayan singer/songwriter who resides in Spain, began his recording career in the early 90's but didn't experience mainstream breakthrough success until his seventh album, Eco (2004), and its Oscar-winning song ''Al Otro Lado Del Río''.

He comes from a Jewish family that fled persecution in Germany. He studied to become an otolaryngologyst (i.e., ear, throat, and nose doctor) like his parents but ultimately chose to pursue his passion for music.  Read more on Last.fm",320944,12178337,Silvio Rodríguez
403e0502-3157-4047-a12b-76f5879c8150,Leka el Poeta, Read more on Last.fm,30714,130492,Latin Fresh
35f866dc-c061-48ba-8157-cf2e0eac4857,Enrique Iglesias,"Enrique Miguel Iglesias Preysler (born 8 May 1975) is a Spanish singer and songwriter. He started his recording career in the mid-1990s on the Mexican label Fonovisa and became the bestselling Spanish-language act of the decade. By the turn of the millennium, he made a successful crossover into the mainstream English-language market. He signed a multi-album deal with Universal Music Group for US$68 million with Universal Music Latino to release his Spanish albums and Interscope Records to release English albums. Read more on Last.fm",2672777,53365157,Ricky Martin
8003cec5-016c-490e-9b01-0b422efa48b1,Luciana,"There are more artists with the name Luciana. 

1. Luciana Caporaso (born 3rd of June, 1977 in London) is an upcoming new sound and style icon of Italian and British descent. Before she shot to underground fame as featured on a number 2 track ""Yeah Yeah"" with Bodyrox she was in pop/rock band Shooter who scored a track called ""Life's A Bitch"" on the Dawson's Creek soundtrack in 1999, previously featured on 4 songs on crush's self-titled album in 1997 and a solo album entitled One More River prior to that, in 1994. Read more on Last.fm",40712,313789,Richard Vission
060dd777-3437-4dd1-8805-797ba8c056ef,D' La Crem, Read more on Last.fm,10808,88720,Pedro Calderon
7f35712b-e075-47b0-aa00-cbbb4cce655d,Jone Quest, Read more on Last.fm,547,2720,Juanka
6d744917-187a-450f-a683-e2caa21591a5,Alex Goot,"Alex Goot (sometimes known just as 'Goot') is a one man pop rock / power pop and acoustic band from Poughkeepsie, New York. He provides the vocals, drums, guitars, keyboards & programming for all his songs, some of which are his own written work and others are covers of classic and modern pop songs.

He began recording music in 2004 at the age of 16 and since then has gained popularity from his profiles on websites such as Purevolume and Myspace, Read more on Last.fm",136186,2410036,Tyler Ward
48262e82-db9f-4a92-b650-dfef979b73ec,Future,"Nayvadius DeMun Cash (born Nayvadius DeMun Wilburn), better known by his stage name Future, is an American rapper, singer, songwriter, and record producer from the Kirkwood neighborhood of Atlanta, Georgia.

After releasing a series of moderately successful mixtapes between 2010 and 2011, Future signed a major label deal with Epic Records and fellow American rapper Rocko's A1 Recordings, which helped launch his label imprint Freebandz. Future subsequently began working on his debut studio album Read more on Last.fm",3172722,450045527,Young Thug
82e795bc-da91-4cae-ba16-cb2815c1afbb,Los 4, Read more on Last.fm,24858,394755,El Kimiko Y Yordy
ac1feb26-e1f9-4a8c-9831-40e6b56c8a2a,Xriz, Read more on Last.fm,29094,201748,Henry Mendez
bbad030f-bf55-4fc2-a643-248708e72f22,Carlos Baute,"Carlos Roberto Baute Jiménez (born March 8, 1974; Caracas, Venezuela), best known as Carlos Baute, is a Venezuelan singer and television host. His music is mostly in the Latin pop genre, with some ballads and Bachata.

He is the son of Alfonso Baute and Clara Jiménez and he is of Spanish (his father is from Tenerife and his maternal great-grandparents are from Galicia), Cuban (his maternal grandmother) and Venezuelan descent. At age 13, he started a band called ""Los Chamos"" and released an album entitled ""Con un poco de Amor"". Read more on Last.fm",284287,2587594,David Bisbal
fab6c2bc-87f7-4088-9301-6bd6164e9c3c,Morad,"1) Morad is the stage name of a Catalan rapper of Moroccan descent who was born on March 5, 1999 in L’Hospitalet de Llobregat and who makes drill-style music with an urban and young theme.

2) Morad is french MC hailing from bezbar. He is a member of the french hip hop supergroup; Scred Connexion.

3) Morad is a young lad (27) from Northampton, England who currently resides in Sydney, Australia.  His sound is best described as 'Raw, uplifting acoustica for lost souls'. Read more on Last.fm",200413,8884616,Baby Gang
af041b12-ae65-4632-9fd4-e3a9d6ddf6de,LOWLIGHT,"There are multiple artists with this name.

1. A rock band from New Jersey whose debut album ""Where Do We Go From Here"" released in August 2016. https://www.facebook.com/lowlightnj/

2. A group formed in late 2012 by Matt Miller and Stephen Green, incorporating elements of shoegaze, new wave, goth rock and post punk. https://www.facebook.com/lowlightSA

3. A duo of spanish producers that have worked with some of the most important urban artists in Spain,
 such as Yung Beef and Bad Gyal. Read more on Last.fm",13454,115542,Un Titico
afbdfac9-2955-4404-ae22-c08bf1c1b51e,Don Omar,"William Omar Landrón (born February 10, 1978 in Puerto Rico), better known as Don Omar, is a reggaeton singer. He is one of the most well known reggaeton artists in Latin America. His cross over success in the U.S. has given him more exposure to English speaking Reggaeton fans, making him one of the more recognizable faces of Reggaeton along with Daddy Yankee and Tego Calderón. Don Omar's popularity is currently rising and he recently appeared on MTV. Read more on Last.fm",1781081,33348626,Daddy Yankee
2df9cb59-5cbb-42d2-bde4-34a3d391a7ea,Darkiel, Read more on Last.fm,24279,981413,Juanka
8248c905-689d-4e36-9def-7c515c5ef5eb,Ñejo,"Originally from Ponce, Puerto Rico. Usually heard alongside Dalmata as a puerto rican duo. Recently released ""Broke and Famous.""


more  information 

Ñejo & Dálmata, also known as Ñejo y Dálmata, are a reggaeton duo from Ponce, Puerto Rico. They had worked together in collaborations with other reggaeton artists before they released their album Broke & Famous in 2007. Some of Ñejo's and some of Dálmata's songs have reached the Billboard 200 in 2006 and 2007. Read more on Last.fm",117497,1232958,Kevin Roldan
8b0f05ce-354e-4121-9e0b-8b4732ea844f,Juanes,"Juan Esteban Aristizábal Vásquez (born August 9, 1972), best known as Juanes, is a rock musician from Medellín, Colombia. When he was younger, his father started calling him Juanes, rather than Juan, a contraction of his two first names Juan and Esteban. As his friends grew to know him by this name, he chose to keep it for his musical career, which started when he, Andrés García, Fernando ""Toby"" Tobón and José David Lopera, formed the rock band Ekhymosis in 1988. Read more on Last.fm",1193771,21517548,Bacilos
c842457c-8087-433d-a895-ec58e7f14ca0,Voltio,"Voltio is Reggaeton artist from Puerto Rico. His real name is Julio Ramos, he is currently signed to White Lion Records Label along with reggaeton fellow artists Zion Y Lennox, Tego Calderon,Tony ""Lenta"",""Pirulo"" & Calle 13. He is known for hits like ""Bumper"" ""Julito Maraña"" & his most recently ""Chulin Culin Chunfly"" of his new album ""Voltio"" which did really good on billboard's charts. Read more on Last.fm",95160,557368,Tego Calderón
46a153df-a143-403b-948c-0131cb1a1067,La Sonora Dinamita,"La Sonora Dinamita is a Colombian cumbia group. As one of the first cumbia groups to reach international success, it is credited with helping to popularize the genre throughout Latin America.

The original orchestra was formed in 1960 in Cartagena de Indias under the direction of bandleader Lucho Argaín. It disbanded in 1963, but was re-formed in 1975 under the direction of Julio Ernesto Estrada ""Fruko"" Rincón, the artistic director of the Discos Fuentes record label[1]. Read more on Last.fm",235473,2176830,Los Ángeles Azules
4e57ce22-bfe9-4653-b781-2fb8c261fac2,Yaga & Mackie,"Yaga & Mackie are members of the first generation of Puerto Ricans brought up on Reggaeton to an international level. Born in the late 80’s, artists of their generation began proving themselves to be serious competition for their Reggaeton forefathers. Steeped in the music from childhood, Yaga & Mackie became known for their willingness to experiment and explore ideas off the beaten path. Yaga (Javier Martinez) and Mackie (Luis Pizarro) met one another in 2000, and decided to team up shortly thereafter. Read more on Last.fm",130233,1127596,Trebol Clan
918e77fc-f42b-4fa2-a8c0-4e7720e4e724,Chris Jedi, Read more on Last.fm,178736,2526325,Dei V
fc63d806-ca89-4ea3-a404-ee6de695743f,Shaggy,"Shaggy is the name of, at least, two artists.
1, Shaggy (born October 22, 1969, in Kingston, Jamaica as Orville Richard Burrell), is a Jamaican reggae artist who takes his nickname from his shaggy hair. He is especially notable for his distinctive sub-baritone voice.

His family immigrated to the United States and they settled in the neighborhood of Flatbush, Brooklyn, located in New York City, New York, USA.

In 1988, he joined the United States Marine Corps and served during Operation Desert Storm during the Persian Gulf War. Read more on Last.fm",2146319,21191169,Sean Paul
f2651b63-a44d-4d1d-ba64-d981d971ecd1,Ozuna,"Juan Carlos Ozuna Rosado (born March 13, 1992), known simply by his surname Ozuna , is a Puerto Rican Latin trap and reggaeton singer who is regarded as the "" New King of Reggaeton"". He has released two successful albums Odisea (2017) and Aura (2018), and since the beginning of his career, he has sold around 15 million records, making him one of the best-selling Latin music artists of all time. He made his acting debut in the film Que León. Read more on Last.fm",916694,27417808,Nicky Jam
3b919a33-bd3b-4443-bd8e-7ab43c221f0b,Chris Wandell, Read more on Last.fm,10776,47741,Sou El Flotador
d1689304-23ac-4eae-a147-bd2e4100581a,Prince Royce,"Geoffrey Royce Rojas was born and raised in the Bronx, New York. His parents are both from the land of bachata, The Dominican Republic. His parents got divorced, so it was just him, his mom, and siblings. Geoffrey loved singing, so one day he asked permission to remake the song ""Stand By Me"". After that song the record company signed him, and he makes many songs. His two popular songs are ""Stand By Me"" and ""Corazon Sin Cara"". He has won two Latin Grammy Awards! Read more on Last.fm",734958,14110184,Romeo Santos
e5fdb46c-eb73-4820-94ba-5dd5b35948cf,Justin Quiles,"Justin Rafael Quiles Rivera mejor conocido en el ambito musical como J Quiles naciò en Marzo 29 del 1990 en la ciudad de Bridgeport Conneticut. J Quiles es un artista independiente el cual hasta el dia de hoy ha logrado ganarse el apoyo y amor de su fanaticada gracias a su talento natural. Ha logrado hacer canciones con artistas como Juno, Guelo Star, Divino el cual lo apadrino musicalmente hablando entre otros. Agradecido tambien con la ayuda de Read more on Last.fm",266128,4214780,Sech
76325ce0-5871-4176-a2bd-c19875ded9ea,JC Reyes, Read more on Last.fm,102482,3746741,Beny Jr
2d049e0f-9069-474f-a7fd-3c48f7a92b68,Shelow Shaq, Read more on Last.fm,44500,286678,Rochy RD
c6ddbfc9-5f73-44a1-9969-f75484a00ea4,Omar Montes,"Omar Ismael Montes Moreno es un cantante y personaje mediático español que se dio a conocer por sus apariciones en reality shows como Mujeres y hombres y viceversa, Gran Hermano VIP y Supervivientes, así como por su relación con Isa Pantoja, hija de Isabel Pantoja.​ Read more on Last.fm",113806,1919641,Rvfv
