id_artist,artist,bio,listeners,playcount,similar_artist
c1a3132a-c23e-4283-8f9a-4080dc52a177,Rels B,"Daniel Heredia Vidal, conocido profesionalmente como Rels B, es un rapero, compositor y productor musical español. Se le considera uno de los grandes valores de la nueva ola del hip hop español. Read more on Last.fm",397075,26845152,Cruz Cafuné
c3da3346-2643-48a7-93cd-011f6834b3d7,Sean Paul,"Sean Paul Ryan Francis Henriques OD (born 9 January 1973) is a Jamaican dancehall singer and rapper. He released his first album, ""Stage One"", in 2000 and achieved international recognition with his second album, ""Dutty Rock"", in 2002. The album's single ""Get Busy"" reached number one on the US Billboard Hot 100 chart, as did ""Temperature"" from his third album, ""The Trinity"" (2005).

Paul is sometimes referred to by the nickname ""Chanderpaul"", derived from the similarity between his first two names and those of cricketer Shivnarine Chanderpaul. Read more on Last.fm",3141707,48481546,Kevin Lyttle
e5a1e5fa-fd7e-4e10-aa84-f51cbdb1e3fd,Bardero$,"C.R.O también pertenece al dúo BARDERO$ junto a HOMER EL MERO MERO, otro reconocido rapero de la escena.

En 2014, C.R.O y HOMER deciden formar BARDERO$, proyecto con el cual desembarcan en Buenos Aires.

Luego de dos años de intenso trabajo, varios discos publicados e incontables shows alrededor del país y países limítrofes, BARDERO$ logra proyectarse como una de las grandes promesas de la escena urbana hispanoparlante. Durante los próximos meses, C. Read more on Last.fm",59982,3827063,Homer El Mero Mero
f9649c22-eb0d-4d4a-9c87-0364c59b99a5,Kiubbah Malon, Read more on Last.fm,5566,29921,Drizzy MC
a1d58646-c58c-43c0-885b-0bd02182f48f,DICC, Read more on Last.fm,6216,44554,Juanih South
cdfa25d4-b9fa-4e99-a163-18fddf7d514f,Descemer Bueno,"Descemer Bueno (b. 1971, Habana Vieja) is a Cuban singer, composer, and producer. His first professional gigs were playing bass with Santiago Feliu, one of Cuba’s greatest troubadours.

Bueno studied music in Cuba and became a music teacher before forming his jazz combo band Estado de Animo in 1990, which also included guitarist Elmer Ferrer and trumpeter Roberto Carcasés. His band encountered some success during the 90’s touring in Spain, Bolivia, Uruguay, Germany, and Argentina. Read more on Last.fm",22895,136939,Kelvis Ochoa
c0c401e0-eb84-4266-9ccb-9160988e7a8e,Offset,"Kiari Kendrell Cephus (born December 14, 1991), known professionally as Offset, is an American rapper. He is best known for being a member of the Lawrenceville, Georgia-based hip-hop trio Migos. Formed with fellow rappers Quavo and Takeoff in 2008, the group released four commercially successful studio albums—Yung Rich Nation (2015), Culture (2017), Culture II (2018) and Culture III (2021)—before disbanding in 2023.

As a solo act, he first released Read more on Last.fm",1449319,45016643,Quavo
44869536-0262-4f22-9c23-b4821c13cd97,Duki,"Mauro Ezequiel Lombardo Quiroga, conocido artísticamente como Duki, es uno de los artistas más influyentes y populares en la escena del trap y la música urbana en Argentina y América Latina. Nació el 24 de junio de 1996 en Almagro, Buenos Aires.

Inicios en la música

Duki empezó a ganar notoriedad en la escena del freestyle argentino, particularmente en la competencia ""El Quinto Escalón"", junto a otros artistas emergentes como Ysy A y Neo Pistea. Read more on Last.fm",292253,41780596,Ysy A
d95a4680-1337-4132-b0bf-7750e1098eca,Mark B.,"Hailing from San Ramon, Mark B. has a unique and unusual sound that catches the ear everytime. Somewhere between Acoustic, Punk, Folk and Emo his music can not be placed within one genre. It would be expected his sound would be unorganized and all over the place, yet somehow its always recognizable. You may not find any music by him at your local record store but his stuff can be found online in various places (including Itunes).

Mark B. is currently with Agent Records.   


-Matthew Taylor  Read more on Last.fm",45862,220651,Kelmitt
ce1d66d7-a512-45aa-8db8-b018e565b657,Lenuel, Read more on Last.fm,4046,26823,Sinfonico
0f00e1ec-9702-45d8-82bd-1641268a968a,Mora,"There are at least two artists with the name Mora, one being a Puerto Rican singer and the other being a Slovenian metal band.

1) Mora is a Puerto Rican singer and producer.

2) MORA had their first appearance in the metal world on November 23rd 2007, when they introduced themselves for the first time to their home crowd after just a few weeks of practice. Then with Jupoll (Vocals, Guitar), Nazgul (Guitar), Scavenger (Bass, Back Vocals) and Zli (Drums). Read more on Last.fm",439952,38970218,JHAYCO
ce09ea31-3d4a-4487-a797-e315175457a0,Tyga,"Micheal Ray Stevenson (born November 19, 1989 in Compton, California), better known by his stage name Tyga, is an American hip hop artist signed to Lil Wayne's Young Money Entertainment and Decaydance. He is of Vietnamese and Jamaican descent.  He is the cousin of Travis McCoy, lead vocalist of the group Gym Class Heroes. 

In 2006 he released his first mixtape, Young on Probation, and released his debut studio album, No Introduction, in 2008. He has since released a further mixtapes Read more on Last.fm",2731777,37966390,Kid Ink
436eb956-2a52-4bdf-aa79-4d73d952b2da,León Larregui,"León Rubén Larregui Marín (born December 1, 1973, in Cuernavaca, Morelos, Mexico) is a singer, songwriter, and producer, best known as the lead vocalist of the Mexican band Zoé.

As a solo artist, he has recorded three albums: in 2012, he released his album ""Solstis,"" and four years later, in 2016, he released the album ""Voluma."" A year after releasing his album ""Voluma,"" he would reunite with the band Zoé to create the album ""Aztlán"" and release it in 2018. Read more on Last.fm",271320,8230934,Zoé
e84512e4-ae78-4b45-9019-1d9b5ac4e470,Alexio, Read more on Last.fm,45674,297128,Farina
5ea54f2c-6fd7-432d-982d-447fda22bfae,Sammy Baby, Read more on Last.fm,255,473,Laura Mb
f07ab896-8d82-4887-8733-05537ad865eb,Kosa,"Raw Black Metal one man band from Ukraine with misanthropic and antichristian ideology. 

Kosa is a not a side project of Lutomysl. According to the label's (Propaganda) statement Kosa member (Vjacheslav Novitskiy) didn't have and doesn't have any other bands or projects.

 Read more on Last.fm",26970,522810,U108
14a22136-672e-4512-8659-5cf92ce88234,Los Flechazos, Read more on Last.fm,16788,191660,Cooper
990147b9-dce2-4c94-ada5-4e091b91a3c3,Pipo Beatz, Read more on Last.fm,19838,322462,El Bugg
96cdde8f-dc74-4d2d-a22e-465225847900,Elisabeth Roma, Read more on Last.fm,85,1518,Vesna Caceres
daf84e36-f78e-4c94-a032-6aed138c0d34,Plan B,"There are several artists and bands with this name:

1) Plan B (real name Ben Drew, b. 1983) is a rapper from Forest Gate, London. From the age of 11 he attended Anglo European School in Ingatestone Essex, before transfering to Tom Hood, an inner-city comprehensive. He has described his character, in these school days, as ""a bit of a cunt"". He is signed to 679 Recordings, home to UK rap act The Streets. His unique sound is characterised by his use of acoustic beats and lyrics involving drugs, rape, murder and underage sex. Read more on Last.fm",1282047,30148699,Don Omar
68434200-f00a-485e-9e2c-c13ce0cbb99f,Wolfine,"Andrés Felipe Zapata Gaviria, who performs under the name Wolfine, is a Colombian singer and composer. Beginning in the 1990s, he has recorded with international artists such as Ñengo Flow, Julio Voltio, Kafu Banton, King Chesta, Thirstin Howl, among others.

After several years away from music, Wolfine returned in 2017 with ""Bella"", a hit single that became a viral success globally, gaining over 300 million streams on Spotify and 790 million views on YouTube, making it his most commercially successful song throughout his career. Read more on Last.fm",163071,1440605,Dalmata
d62adf19-169e-4878-8b04-b8b4a7023802,Towy, Read more on Last.fm,462,1964,Juanka
a9527635-2eab-4232-8e5d-0a874059dac6,El Yman, Read more on Last.fm,3608,30803,El Perla
d606b860-cc03-4959-a3fd-3a24bccf2560,Anitta,"Larissa de Macedo Machado, known professionally as Anitta, is a Brazilian singer, songwriter, dancer, businesswoman, and TV presenter. She rose to national fame with the release of her single ""Show das Poderosas"" in 2013.

After achieving commercial success with her debut single ""Meiga e Abusada"" in 2012, she signed a recording contract with Warner Music Brazil in January 2013. In July of the same year, she released her self-titled debut album which produced four successful singles and was certified platinum in Brazil. Read more on Last.fm",1190373,153163994,Luísa Sonza
28da619b-b2ac-4914-bc76-380d5c64c923,Jacob Forever, Read more on Last.fm,56546,390347,Gente de Zona
0358ba98-0189-46be-b322-1f970df39dfd,O'Neill, Read more on Last.fm,3226,16137,Mr. Quark
38b511a2-76fa-4a1e-9b7a-e2a6efa6399b,Jarabe De Palo,"Jarabe de Palo (literally ""Wooden Stick Syrup"" or, after the Spanish expression ""dar un jarabe de palo"", i.e. a ""hell of a beating""), was a Spanish rock band founded in 1996. The group was led by singer, songwriter, and guitarist Pau Donés, whose death in 2020 caused the band to break up.

Pau Donés, born and raised in Barcelona, worked for various groups before being able to take on his current project, Jarabe de Palo. He began at age 15 with his brother Marc, with whom he formed a group known as J. Read more on Last.fm",579098,9683072,Estopa
fc17992b-d3c2-423e-9c7e-f479c1c4d8a8,Benny Benni, Read more on Last.fm,22967,210679,Sou El Flotador
5bdeb32d-56a5-4b6d-a768-264101fa0a0a,J Balvin,"José Álvaro Osorio Balvin (born May 7, 1985), known professionally as J Balvin, is a Colombian reggaeton singer. Balvin was born in Medellín, Colombia, where he became interested in music at a young age. At age 17, he moved to the United States and learned English, which influenced the music he would make later. He then returned to Medellín and gained local popularity by performing at various clubs around the city.

Though his music is primarily reggaeton Read more on Last.fm",1806400,62966181,Maluma
3deeb747-c228-4d33-9892-f0aa081783c3,Wisin & Yandel,"Wisin & Yandel is a Puerto Rican reggaeton duo, consisting of Llandel Veguilla Malavé Salazar (Yandel) and Juan Luis Morera Luna (Wisin). They started their career in 1995 and have been together ever since, winning several awards during that time.

Their biggest hits are ""Rakata"", ""Llamé Pa' Verte (Bailando Sexy)"", ""Pam Pam"", ""Sexy Movimiento"", ""Pegao"",""Síguelo"", ""Abusadora"", and ""Gracias a Tí"". Wisin & Yandel have collaborated with internationally known artists such as R. Read more on Last.fm",856189,19765868,Don Omar
e546fbc2-b7b6-4427-a0be-25cfb6c87e93,Don Patricio,"Patricio Martín Díaz, de nombre artístico Don Patricio, es un rapero español. Read more on Last.fm",99095,1379074,C. Tangana
3033c32e-52dc-4500-8d9b-5aa9b12fc2d3,Lalo Rodriguez,"His love of music began when he sang in the traditional patron saint festivals in Puerto Rico, and on television and radio when he was nine years old. The first recording of his professional career came seven years later. 

According to the artist, the story behind this transition was unforgettable: “Between the age of 12 to about 15 and a half, more or less, I sang with a salsa band called Tempo Moderno. In 1973 we shared the stage with the orchestra of Eddie Palmieri. Read more on Last.fm",162493,1048271,Eddie Santiago
85231e9b-f3f4-498d-ae41-665edc36ef01,Daviles de Novelda, Read more on Last.fm,22675,229438,Luis Cortés
3baa0353-0d29-488f-9c33-d291bfc36059,Dylan Fuentes, Read more on Last.fm,12955,64795,Lalo Ebratt
2373943f-9c75-46cd-a651-dbdd9867565a,Osquel, Read more on Last.fm,1983,11304,Baby Johnny
812847f3-ee1b-4c04-9b2a-cf2ff6cfce69,Nego do Borel, Read more on Last.fm,148651,1433313,Zaac
965c6053-0bfb-42c1-97e7-84b34218ac53,Super Yei, Read more on Last.fm,132473,1651607,Brytiago
ab966c0f-e526-46ae-b492-82c27b87f81f,Mon Laferte,"Norma Monserrat Bustamante Laferte (born 2 May 1983) better known as Mon Laferte, is a Chilean-Mexican musician, singer, composer, and painter. Her musical style is diverse, spanning different genres such as pop, rock, bolero, cumbia, and salsa, showcasing her versatility and creativity. Throughout the 2010s, she gained widespread recognition for her melodramatic style and ""captivating stage persona"".

With over 1.5 million digital records sold in Latin America between albums and singles Read more on Last.fm",460649,23792857,Natalia Lafourcade
315fc6d3-4e92-42bd-95b0-49557473adad,Eddie Santiago,"Eddie Santiago (born August 18, 1955) is a salsa singer from Puerto Rico. At a young age, Eddie demonstrated great love and talent for salsa music. He performed with several groups, including Generación 2000, Orquesta La Potente, Orquesta Opus, and the Orquesta Saragüey.

Santiago's career took off in 1986 in Puerto Rico and Latin America as a soloist, formimg his own band, and recording songs including: ""Tú me quemas"" (You Burn Me), ""Qué Locura Enamorarme de Ti"" (What Madness To Fall in Love With You) Read more on Last.fm",272079,3055877,Willie Gonzalez
da286874-6e1e-4ca1-bcc9-c275827ac926,Juhn, Read more on Last.fm,55122,649206,Noriel
f322fdaf-77da-4523-94b6-95661c572da7,Joycee, Read more on Last.fm,203,2528,Demphra
bb2ff405-89f1-4381-b4e5-7eac5bebf3eb,Micro TDH,"Fernando Daniel Morillo Rivas, conocido artísticamente como Micro TDH, ​ es un cantante, rapero y trapero venezolano.​ Fue galardonado en los Premios Union Rock Show como «Mejor artista revelación» en 2016.​ Conocido por sencillos como «Cafuné», «Bésame sin sentir», «Aquí estoy», entre otros .​ Read more on Last.fm",125031,2894362,Neutro Shorty
b97a82d1-cabd-4336-8476-b4e89ec1f1c7,KREAM,"
Made up of two brothers from Bergen, Norway, KREAM is a project focused on energetic dance music with an emphasis on classical songwriting. Daniel and Markus Slettebakken began producing at a young age, each developing into their own role in the process. The duo has already seen several remixes reach streams in the multi-millions, racking up 40+ million plays on SoundCloud alone. The pair quickly found a home at Big Beat/Atlantic this year, where they've been releasing numerous originals including ""Love You More Read more on Last.fm",314439,3809499,Hayla
cfa35dcb-5b1b-4ffc-ae7d-f1edaf87a8a8,Joel Santos, Read more on Last.fm,8344,62468,Dustin Richie
1f4c0c5a-be94-43e2-ab01-1aa623daa530,Bebe,"Bebe is the name used by at least 8 artists:

[1] María Nieves Rebolledo Vila (b. 9 May 1978 in Extremadura, Spain), a singer and actress whose parents were members of the folk group Surberina. Her Spanish breakthrough came with her album Pafuera Telarañas.  She won the Best New Artist award, at the 2005 Latin Grammy Awards, and was nominated for five awards in total.
Y.  is the second studio album released by Spanish singer-songwriter Bebe. Released on June 29 Read more on Last.fm",343489,5488980,Amaral
905d9c0c-0632-4fab-a7b5-7d33b9699907,Ana Mena,"Ana Mena Rojas (born February 25, 1997) is a Spanish singer and actress. She began her career in 2011 in the TV series Marisol, la película (2011). Her musical career began in 2016, when she released her debut single ""No Soy Como Tú Crees"". Mena has collaborated with many well known artists since, including Becky G, CNCO and Lali. In 2018, she released her debut studio album, Index. Read more on Last.fm",124257,4101276,Vicco
efa56203-008a-422a-a863-4ddda4dc3aa4,Anonimus,"ATTENTION!! THIS IS A DIFFERENT ARTIST ""ANONIMUS"" FROM THE A.N.O.N.I.M.U.S. (AKA) ANO. PLEASE BE AWARE OF THE DIFFERENCE IS THESE TWO ARTISTS!! Read more on Last.fm",23527,188153,Benny Benni
9d692ebd-cbc0-4517-b37b-b70689120601,Andy Rivera,"Andrés Felipe Rivera Galeano nació en Pereira, hijo del cantante y compositor de música popular Jhonny Rivera y de Luz Galeano. Con su padre fue siguiendo el mismo paso de la música tempranamente a los 12 años, en los tiempos libres se dedicaba a la vocalización y al piano.

Su padre lo inclinó por la música aunque el escogió el género urbano. Su primer sencillo contó con el apoyo de su amigo Pipe Calderon y su productor Dj Cano quienes realizaron ""En Busca De Ella"". Read more on Last.fm",82428,803877,Reykon
c1dc8d9f-5e14-4161-b61d-db75fc48db66,Trapani, Read more on Last.fm,4006,69029,Dual TOD
299f7958-15f5-4ca2-b4ed-222b169dd74e,Dalex,"Pedro David Daleccio Torres Altura: 1.70, better known as Dalex, is an American Latin R&B singer. He was formerly part of the duo Jayma y Dalex. Currently, Dalex is signed to the Rich Music record label.  Read more on Last.fm",223234,3854855,Sech
267860c1-8f0e-4528-a692-31905d569c91,Tony Mendez,"Acoustic music from KS, also goes by the name ""Moon Racer"". Read more on Last.fm",242,660,Chris Micali
9aab3aaf-d99c-4a4c-8dca-e4bf2e8c0404,Mariah Angeliq,"Mariah Angelique Pérez, better known as Mariah Angeliq, is an American singer. Born in Miami to a Cuban father and a Puerto Rican mother, Pérez began writing music at the age of 16, and ran away from her home to follow her music career. She crossed paths with the reggaeton producer Nely El Arma Secreta who guided the artist and introduced Spanish music to her repertoire. She signed with Universal Music Group in 2018. Read more on Last.fm",88869,903433,Sofía Reyes
03684db4-7f0f-4175-8f92-7f791fb98d2d,Jessi Uribe, Read more on Last.fm,30042,376934,Pipe Bueno
6717e725-e71a-45e2-a8bf-fc8bc7aea9db,Jaycob Duque,"Jacob Duque, better known in urban music as Jaycob Duque, was born on September 8, 1997 in Pereira, Colombia, he is a young reggaeton singer. In 2013 he began his artistic career with his manager Kike Montoya, who has worked with great artists of the urban genre such as Farruko, Arcangel, Ñengo Flow, Kelmmit, Edup, Dj Luian, Sinfónico & Onix, Lil Genius and Super Yei. In 2014 he would come with a new musical conquest by Arcangel and the song titled ""A Fuego Lento"", which reached more than 500,000 views on the YouTube digital platform. Read more on Last.fm",6345,25631,RONALD EL KILLA
b90c0404-7eea-48a8-b926-078d10e7cc17,Lele Pons,"Eleonora ""Lele"" Pons Maronese (born June 25, 1996) is a venezuelan internet celebrity, YouTuber, actress, singer, dancer, model and former host of La Voz... México.

Pons came to prominence on Vine, before the platform shut down in 2016. She has since branched out, creating comedy sketches for YouTube, where she now has over 14 million subscribers, and 35.3 million followers on Instagram. She has acted in film, television, and in music videos, has released her own music, and co-authored a novel in 2016.  Read more on Last.fm",191325,1511415,Anitta & J Balvin
9664f46d-eea5-41e0-b0be-06666aa151cc,Christian Daniel,"Christian Daniel (born March 20, 1984) is a Puerto Rican singer-songwriter and actor.

Daniel is a singer-songwriter. At the age of 17, Daniel recorded his first demo with vocal coach Socky Torres. He sent demos to several recording companies until Emilio Estefan invited him to Miami to record his début album, Christian Daniel (2007). He was the first artist signed to the record label Bad Boy Latino. Several of his songs have charted on various Billboard charts. Read more on Last.fm",16228,111147,Ana Isabelle
89aa5ecb-59ad-46f5-b3eb-2d424e941f19,Bad Bunny,"Benito Antonio Martínez Ocasio (born March 10, 1994), known professionally as Bad Bunny, is a Puerto Rican rapper and singer. He is recognized as a leading figure in Latin trap and has played a significant role in popularizing Spanish-language rap in global mainstream music. Bad Bunny became the first non-English-language artist to be Spotify's most-streamed artist of the year, achieving this distinction in three consecutive years from 2020 to 2022. His 2022 album ""Un Verano Sin Ti"" holds the record as the most-streamed album on Spotify. Read more on Last.fm",2478918,383536581,Rauw Alejandro
fdd30cef-5337-4059-8c5a-a86117e7d067,Shadow Blow,"José Ariel Fernández Soto, Mejor conocido como SHADOW BLOW, nacido en el año 1983, Santo Domingo, República Dominicana. Sus inicios en el ámbito musical datan del año 1992, cuando incursiona en el CONSERVATORIO NACIONAL DE MUSICA de santo domingo, en el cual dura 10 años estudiando piano.

Es en el año 2001 es cuando este exponente se da cuenta que le gusta el género urbano, dando sus primeros pasos el grupo BLOKE C 37. En Poco tiempo SHADOW BLOW Read more on Last.fm",6981,63767,El Batallon
bf24ca37-25f4-4e34-9aec-460b94364cfc,Shakira,"Shakira Isabel Mebarak Ripoll is a Colombian singer. Born and raised in Barranquilla, She made her recording debut with Sony Music Colombia at the age of 13. Following the commercial failure of her first two albums, Magia (1991) and Peligro (1993), she rose to prominence in Hispanic countries with her next albums, Pies Descalzos (1995) and Dónde Están los Ladrones? (1998). She entered the English-language market with her fifth album, Laundry Service (2001), which sold over 13 million copies worldwide. Read more on Last.fm",4807672,176390128,Paulina Rubio
bfbd3940-14aa-4c4a-a2ab-67d040aae0f2,Sky Rompiendo,"Alejandro Ramírez Suárez (born May 23, 1992), better known as Sky Rompiendo (“breaking sky” or “Sky breaking”), Sky Rompiendo el Bajo or just Sky is a Colombian producer, songwriter and DJ. He gained recognition at a young age, creating hits with Latin trap and reggaetón artists such as Anitta, Feid, J Balvin, Karol G, Maluma, Nicky Jam and Ozuna. He has received six Latin Grammy Awards as a producer and songwriter.

Ramírez was born on May 23, 1992, in Medellín, Colombia. Read more on Last.fm",158511,2834913,Dei V
7cd0657a-a661-43c4-ad19-95819a6003eb,Steve Lean, Read more on Last.fm,21482,361827,kabasaki
45dc5f07-6609-4760-a933-8c9e0f858d05,French Montana,"Karim Kharbouch (born November 9, 1984), better known by his stage name French Montana, is a Moroccan-American rapper. Born and raised in Morocco, he immigrated to the United States with his family at the age of 13. He embarked on a musical career in 2002, releasing a slew of independent material until signing a joint-venture record deal with Puff Daddy's Bad Boy Records and Rick Ross's Maybach Music Group in 2012.
Kharbouch released his debut mixtape in 2007 and had his first breakthrough with the single ""Choppa Choppa Down"" in 2010. Read more on Last.fm",1939728,29115171,DJ Khaled
b7f5054e-c9de-49d8-b0eb-6deefb89b86b,Ñengo Flow,"Edwin Rosa, publicly popular as ""Ñengo Flow"" is a hip hop artist and composer of Puerto Rican music. Its fast and complex letters have referred to as the ""Real G"" urban type.

Flow Ñengo born on October 15, 1981 in the town of Rio Piedras. This great rapper grew and raised in the town of Bayamon, Puerto Rico. It is there since childhood he was interested the world of urban music. His beginnings as a rapper were developed with letters of the street, everyday living Edwin Rosa. Read more on Last.fm",237472,5269747,"Gotay ""El Autentiko"""
86e4ae25-f45b-4c52-904d-94c0004f907e,Brytiago, Read more on Last.fm,195795,3971330,Bryant Myers
aea8576d-7ad5-4430-bf2e-63725d80f05c,Bomba Estéreo,"Bomba Estéreo is a (cumbia + electronic music) band formed in Bogotá,  Colombia in 2005 and led by Simón Mejía. In 2007 they released their debut album Vol. 1. 

Currently the band has finished promoting its second album  Estalla throughout Europe, Latin America and the United States, and is preparing the recording of a third album.

The original lineup consists of:
Simon Mejía, Songwriting, Bass, Loops and Backing Vocals.
Li Saumet, Lyrics, Lead Vocals. Read more on Last.fm",362757,5767078,Systema Solar
60e7a87a-2a15-42cb-831a-fd699a8d9863,Chencho Corleone,"Orlando Javier Valle Vega (Guayama, Puerto Rico; 19 de febrero de 1979),4​5​ conocido artísticamente como Chencho Corleone o simplemente Chencho, es un cantante, compositor y productor discográfico puertorriqueño de  reggaeton Read more on Last.fm",93711,1145014,Darell
c63b3a59-cb13-4ed4-867f-b46f30fc7e45,Jory Boy, Read more on Last.fm,165490,1685201,Ñejo
9f653365-95d9-4adc-9296-3bf0b27ebee5,Kendo,"There are 2 artists named Kendo:

1) An IDM/Breakbeats producer

2) An Electronic/House producer from Chicago, Illinois.  His 6-track debut EP ""Two Blue Horizons"" was released in May of 2010 as a free digital download.

3) A now-defunct Romanian metalcore band with members of Prostest Urban Read more on Last.fm",4792,53485,Dissatisfaction
afd6e960-0e48-444d-b65d-99e85cae90ba,Willy William,"Willy William is a French-Jamaican DJ, music producer and singer songwriter and artist famous for his club remixes and vocal collaborations with a number of dance music artists.

He came to prominence in 2003 with his work with DJ Flex in the dancefloor hit B Boyz Shake da Body and in 2004 as producer of Tragedie using the pseudonym 'Lord William. He later joined the French music collective Collectif Métissé, also continuing to produce his own materials. Read more on Last.fm",155087,1122067,Jessy Matador
d2945137-b01d-4195-9f82-64d20f8ba657,Myke Towers,"Myke Towers, whose real name is Michael Torres, is a Puerto Rican rapper and composer born on January 15, 1994 in Río Piedras, Puerto Rico. Since his teenage years, Myke Towers has been involved in the underground rap scene in Puerto Rico under the name Mike Towers, and his first compositions and freestyles were published on his SoundCloud account. He gained recognition in 2014 with songs such as ""Día de cobro"", ""Por Mí"", ""Es Normal"" and ""En los Bloques"". Read more on Last.fm",644839,27286055,JHAYCO
e9adfa88-6767-4cb6-b07f-d4df5452d3b7,Rvfv, Read more on Last.fm,278632,4625057,Morad
