mbid,artist,bio,listeners,playcount,similar_artist
4e4ebde4-0c56-4dec-844b-6c73adcdd92d,Juice WRLD,"Jarad Anthony Higgins (December 2, 1998 – December 8, 2019), known professionally as Juice WRLD, was an American rapper, singer, and songwriter. He emerged as a prominent figure in emo rap and SoundCloud rap during the mid-to-late 2010s. His stage name, derived from the 1992 crime thriller film ""Juice,"" was intended to represent ""taking over the world.""

Higgins began his career in 2015 as an independent artist under the name JuicetheKidd and signed with Lil Bibby's Grade A Productions in 2017 Read more on Last.fm",2448007,510546528,Lil Uzi Vert
0dc831b2-f893-4ee1-a094-5daf03430f00,Trapperman Dale, Read more on Last.fm,4478,40715,Tha Landlord
a59a3fdd-4bcc-4c61-b4c5-7d0c1341f2e2,Boldy James,"James Clay Jones III (born August 9, 1982), better known by his stage name Boldy James, is an American rapper from Detroit, Michigan. His debut album My 1st Chemistry Set was released on October 15, 2013. 

Boldy James was born James Clay Jones III on August 9, 1982, in Atlanta, Georgia to his parents James Clay Jones Jr. and Toni K. Broadus. In 1983, Jones and Broadus returned to their original home of Detroit, MI with their son after Jones was wounded in the line of duty serving as a police officer. Read more on Last.fm",800817,29494909,Nicholas Craven
c1bffe99-fa6e-42d9-990f-72dcd25c4458,Factor,"Starting out as a DJ in 1998, Factor has evolved into one of Western Canada’s busiest super producers.  He is continuously working and touring with high caliber Canadian and American artists including: AWOL One, Moka Only, Myka 9, Ceschi, Sole, Aesop Rock, Buck 65, Gregory Pepper, Sunspot Jonz, Tha Liks, Xzibit, Kool Keith, Josh Martinez, Sadat X, and The Side Road Crew.   He is known for continuously dropping top-notch product out of Saskatoon since the late ‘90s. Read more on Last.fm",15358,300922,Awol One & Factor
923b5d99-4020-40d8-9db5-1390986bb4cf,MHD,"Mohamed Sylla, better known by his stage name MHD, is a French rapper from Paris. His music is the precursor of ""Afro Trap"", a mixture of African music and trap music. He is also part of the rap collective 19 Réseaux with other rappers. Read more on Last.fm",152865,3339915,KeBlack
384192ad-3818-496e-b535-1dbf926f4d7f,Camp Blood, Read more on Last.fm,552,3429,Censored Dialogue
2de7b854-4941-4aa5-aadf-817afa125c56,Moonkey,"Moonkey is based in Minneapolis, MN.  The vocalist, pianist, and composer is Tamara K.  The bassist is Joe V., and the drummer is Beth V.  our influences include Bjork, Chopin, Radiohead, Portishead, and many more....... Read more on Last.fm",23123,406238,YUNG SARRIA
b7081674-a3f1-4560-a0fd-1f8365a60bd6,Alka Produce,"Alka Produce es un productor colombiano. Sus trabajos publicados como solista se remiten a los instrumentales de Hip-Hop con influencias de soul, trip-hop, electrónica y chillwave. Read more on Last.fm",765,3666,realidad mental
22d060d3-9c26-44f2-a5e1-cda045a87eda,Juancho Marqués,"
Read more on Last.fm",29220,841745,Sule B
15d58b2e-63f9-454b-845b-397dc443f17f,Shad,"Shadrach Kabango (born 1982), credited as Shad or Shad K, is a Canadian hip hop musician and radio broadcaster. He is the host of the International Emmy and Peabody Award-winning documentary series Hip-Hop Evolution on HBO Canada and Netflix.

Born in Kenya, to Rwandan parents, Shad was raised in London, Ontario. His mother worked in London as a hospital lab technician; his father, as a machinist. He attended London Central Secondary School.

His debut album When This Is Over (2005) was self-made, financed with $17,500 he won from 91. Read more on Last.fm",123513,2974178,K-OS
f704a0b6-3213-411f-8ba1-4267d62a2ad0,Latrell James,"Latrell James is a rapper and producer based in Massachusetts. He runs a home studio out of his basement in Brockton, MA, and has received recognition at the annual Boston Music Awards.   Read more on Last.fm",20904,101454,MFnMelo
92099c41-6224-4ab4-9f50-9cc40b1ce953,Tokztero,"This vato represents Norte and can be found anywhere in Northern California, currently in Salas. He signed to Strong Arm Management in 2010 and released Tokztero Throwbacks alongside music producers Serg Knight from Strong Arm Management & Goldtoes from Black N Brown Entertainment exclusively on digital platforms only.  Read more on Last.fm",1785,5873,14 Caliber
0a81ff99-c783-4605-b338-863c182460ff,Baby Rasta,"Baby Rasta y Gringo (born July 3, 1978 Wilmer Alicea and Samuel Gerena, respectively) are a Reggaeton duo from Puerto Rico, famous for their track El Carnaval (The Carnival). They were originally called ""Eazy Boyz"". After changing their names they released three albums, New Prophecy in 1998, Fire Live in 2003 and Sentenciados in 2004. Sentenciados came out in both parental advisory and edited versions, and a ""platinum version"", including a bonus DVD, was released in 2005. Read more on Last.fm",86851,496930,Cheka
50a7ba7d-02fa-4ce6-9e09-f2194238bbe5,Gera MX,"Born Gerardo Daniel Torres Montante on July 15, 1994 in San Luis Potosí, Mexico. Read more on Last.fm",141927,4000915,Alemán
872f2b0f-ba95-477e-b873-ee43ea351ba1,Myke Bogan,"For Portland/ LA artist Myke Bogan, music is a journal—a place to work out life’s hard times, reflect on the moment, and conquer the present. Joe Fontana is Bogan’s most recent project to date. Tackling a range of emotions, Fontana plays like a snapshot of the artist’s mind, leading the listener on a path of retrospection, introspection, and self-actualization. Read more on Last.fm",48925,303856,Jimi Tents
029df128-d07f-42fc-8506-43208786d1d5,Gimma,"Gimma, civil Gian Marco Schmid, is a rapper from Chur in the canton Grisons with Swiss-German texts. 

General: Gimma belongs to the collective of the Bauers (farmers). The groups of Luut & Tüütli, X-Chaibä and Breitbild as well as section Kuchikäschtli are the signs of the successful collective. In addition is it initial member of the rap-group of OBK (Oschtblock Kuabuaba) which Ali de Bengali and Damos belong. In addition it is under the aliases DJ Ammig, party dictator or Fabrizio risk as DJ on the way. Read more on Last.fm",9722,217818,Breitbild
5b25501c-da72-454d-a682-d262d6bb5bf7,Guapdad 4000,"Akeem Douglas Hayes (born July 27, 1992), professionally known as Guapdad 4000, is an American rapper, singer, and songwriter. He is also a member of the hip-hop supergroup Zoink Gang, with JID, Smino and Buddy.  He released his first mixtape Scamboy Color on December 6, 2017. His debut studio album Dior Deposits was released on October 25, 2019. Read more on Last.fm",177454,2589398,Kenny Mason
3040b948-c439-4d4f-9355-45d34e98a84b,Shady Nate,"Born and raised in West Oakland’s notorious Acorn housing projects Shady Nate spent his youth surrounded by violence, drug dealings, and robberies. At the age of five Shady Nate would begin writing his thoughts and daily experiences down in a journal. These entries soon became full length poems and eventually would become the classic lyrics he raps today. After entering High School Shady Nate met and formed a friendship with his now longtime friend and mentor Lil Dame. Read more on Last.fm",20115,121871,Stevie Joe
b38a00f2-3746-4e9e-93de-8257ca5b1680,Residente,"Residente (born René Pérez Joglar; February 23, 1978) is a Puerto Rican rapper, writer, producer and co-founder of the alternative rap group Calle 13. He has won 25 Grammy awards, the most Grammys ever awarded to a Latin artist. 

He studied fine art for 8 years, before launching an independent career as a lyricist, performer and director of many his own music videos. His lyrics have been lauded by critics and studied by academics at universities around the world.  Read more on Last.fm",182146,2629975,Calle 13
c63b3a59-cb13-4ed4-867f-b46f30fc7e45,Jory Boy, Read more on Last.fm,165377,1683252,Ñejo
e66e5f1e-31fa-4b81-915b-1c58a30290e7,Радуга,"1) Russian Rock-band from Moscow
2) Russian Club-music project Read more on Last.fm",2116,13812,Mari! Mari!
cd277e93-dbc4-4565-be57-44264413f28b,Noriel, Read more on Last.fm,68156,732704,Juhn
9f3225ad-e686-4538-8cbe-99406c4a4caa,Aaron May,"There are 2 music artists named Aaron May

1/ Aaron May (born in May 2, 2001) is an American rapper from Houston, Texas, who is famously recognized for his debut EP “Chase” released in 2019. Aaron is immensely talented with a flow reminiscent of J. Cole and Nas.

2/ Aaron May (composer) is a music/movie soundtrack composer. He is well-known for accompanied with David Ridley hauting the score of top-notch Netflix series ""Adolescene"" (2025) 

Before composing the score of Adolescence Read more on Last.fm",1039270,31649171,Marlon Craft
fe11b440-ee76-419b-b40f-17ad0ae06c40,Dowba Montana, Read more on Last.fm,6718,130283,Martin Lora
52afa561-7384-433e-a8fb-037784a15466,Nitro,"Nitro were an American heavy metal band from Hollywood, California, formed in 1988 and disbanding a total of two times—once in 1993, and again in 2019. The band’s most prominent lineup included vocalist Jim Gillette, guitarist  Michael Angelo Batio, bassist  T. J. Racer, and drummer Bobby Rock.

In 1987, vocalist Jim Gillette released his debut solo album Proud to Be Loud, which featured contributions from Batio and Racer, the three of whom would later go on to form Nitro. Read more on Last.fm",78565,2760734,Danger Danger
68ad8b77-5451-4877-b73f-c5b4e44d96f0,RAIZA BIZA, Read more on Last.fm,22709,111787,IllBaz
e852986c-8ffd-45e3-9934-554612569c8b,Baby Smoove,"Jaelin Parker, known professionally as Baby Smoove is an American rapper and singer from Detroit, Michigan. He is noted by Ben Dandridge-Lemco of The Fader for his ""slick one-liners and clever storytelling delivered in a subdued, almost disinterested, flow.""



Smoove recalls recording in a studio for the first time at age 15. In 2018, he created a CD mixtape titled Why so Serious which he recalls not gaining attention. In 2019, he released his single Read more on Last.fm",401000,33850895,Babyface Ray
97c10407-bc59-4e2a-865d-e06bfe05d5be,Blezz,Blezz is a rapper and beatmaker/producer stationed in Norrköping sweden also known as Peking. Frenchies out there might recognize him from his collaborations with Soul Square (formerly Drum Brothers) Read more on Last.fm,494,5912,Broder John & Friman
c6160117-ebe4-44ba-8f00-da8ecaa0c80d,David Dallas,"David Dallas (born August 28 in Papatoetoe, Auckland) is an award winning New Zealand rapper and producer, formerly known as Con Psy, signed to P-Money's Dirty Records. He released his debut EP Something Now in 2008, and then his debut solo album, Something Awesome, was released in August 2009. His second next album, The Rose Tint, was released in May 2011 and featured appearances from Freddie Gibbs, PNC and Buckshot. He is also half of the award winning duo Frontline Read more on Last.fm",65489,761047,No Wyld
412c47c5-ea27-4ce9-b0f3-e036da967519,Mustard,"Born as Dijon Isaiah McFarlane on June 5, 1990 in Los Angeles, California, Mustard is well-known for his producer tag ""Mustard on the beat, ho"", said by YG. He has produced hit singles for artists such as Tyga, YG, Kendrick Lamar, Rihanna, Fergie, Big Sean, Tinashe, Jeremih, and Lil Dicky. Read more on Last.fm",1152688,22456761,YG
1094e2e4-0270-4ddd-b46d-9d26c42b30da,Kydd Jones, Read more on Last.fm,5460,16205,Avi Jay D
cf580d82-3f3e-4b86-8874-7e0fbe794f01,Aya Nakamura,"Aya Danioko, known as Aya Nakamura, is a French-Malian pop/R&B singer. Aya was born in Bamako, and immigrated to France with her family and grew up in Aulnay-sous-Bois. Coming from a family of griots (West African storytellers, praise singers / poets of oral tradition), she is the oldest of five siblings. She studied fashion at La Courneuve. She later launched into music with the stage name Aya Nakamura, after the character Hiro Nakamura of the NBC Heroes science fiction drama series. Read more on Last.fm",486165,11899947,Shay
96800e05-9924-4321-859a-76e0d4750f2f,Smino,"Smino (born Christopher Smith Jr. on October 2, 1991) is an American rapper and singer from St. Louis, Missouri. He is the founder of the musical collective Zero Fatigue with Bari Allen, Monte Booker, Jay2, and Ravyn Lenae. He is also a member of the hip-hop supergroup Zoink Gang, with JID, Buddy, and Guapdad 4000, as well as the supergroup Ghetto Sage, with Saba and Noname. Smino is signed to Downtown Records and Interscope.

Smino is from a musical family Read more on Last.fm",842531,45293630,Isaiah Rashad
45ef37f0-7a37-4f8e-9909-47c0f02ec668,Baby Gang,"Zaccaria Mouhib (Arabic: زَكَريا موهيب, romanized: Zakariyaa Mouhyb; born 26 June 2001), known professionally as Baby Gang, is an Italian-Moroccan rapper. He began his musical career in 2018 and released his debut EP ""EP1"" in 2021.

Baby Gang released his first single ""Street"" in 2018 in Calolziocorte, followed by ""Education"" and ""Cella 1"" in 2019, songs inspired by his experiences in prison. In May 2021 he released the EP ""EP1"", which peaked at number 15 on the FIMI Albums Chart. Read more on Last.fm",118280,6395345,SIMBA LA RUE
d22a1bbb-b02c-4e2a-abd8-df331b7d59a8,Brown Sugar,"There are at least five groups with this name:

1) Hardcore punk the way it should be.
2) Late 70's British lovers rock group with Caron Wheeler, Kofi and Pauline Catlin.
3) Brown Sugar featuring Clydie King. 1970's soul on the Chelsea label.
4)Thrashy punk rock band from buffalo.
5) Japanese female dance hall reggae group.
6) A co-ed Hindi/English fusion acapella group from Northwestern University (http://www.last.fm/music/Northwestern+Brown+Sugar)
6 Read more on Last.fm",20274,216863,Poison Idea
327269cc-7028-440e-b807-a1c29318265a,Fntxy,"Elihú Gándara, conocido en el mundo artístico como Fntxy -pronunciado 'Fantasy'- y apodado Taxi Dee, es un rapero y productor mexicano que nació en Los Mochis, Sinaloa, México, pero ha pasado la mayor parte de su vida en Tijuana, Baja California, México, detalle que influenciaría en su carrera musical. Forma parte del grupo La Plebada con Cozy Cuz, y es parte del sello discográfico Homegrown Entertainment.

Para inicios del 2019 se destacaba como uno de los mayores exponentes del trap en México Read more on Last.fm",10232,804687,WK
5bd77730-f368-496a-9f60-dc6392a9a33f,Vinci,"There is more than one artist with the name Vinci
1) A 5 piece band from Dublin
https://twitter.com/vinciband?lang=en

2) A French solo artist. At the end of the eighties, Cyril Adam began this musical solo project, between experimental songs and more ambient industrial soundscapes.
In middle nineties, he stopped producing music but never ceased dealing with sound, mostly integrating it in his work as a sound engineer.
In 2006, after ten years of excess, the Vinci project was reloaded. Read more on Last.fm",5526,56143,Jeromy
d721866d-5640-44ee-87f7-23dd062abd8a,Nekfeu,"Ken Samaras (Greek: Κεν Σαμαράς, Ken Samarás; born 3 April 1990), known as Nekfeu, is a Greek-born French rapper and record producer. Read more on Last.fm",133746,14118771,S-Crew
453b7024-ff07-4e34-8d3d-41ca6733e4f5,Ninho,"Ninho, pseudonyme de William Nzobazola, est un rappeur, chanteur et auteur-compositeur français né le 2 avril 1996 à Longjumeau dans l'Essonne.

Avec plus de 1,2 million d'albums écoulés, il est en 2020, le douzième rappeur à avoir vendu le plus de disques en France avec ses cinq projets (sans prise en compte des mixtapes gratuites) en moins de cinq ans d'activité. Read more on Last.fm",174644,12350857,Gazo
2bbcebe2-ab00-4f28-8e5b-58f6eeed61f2,Konshens,"There are multiple artist using this name.

1. Garfield Spence (born January 11, 1985), better known as Konshens, is a Jamaican dancehall and reggae musician, whose debut mixtape Sherlock di World Lock was released in November 2008, followed by Real Talk in 2010. He received acclaim for his hit ""Winner,"" and later for the song ""Good Girl"" performed along with Tarrus Riley. His consequent albums, Mental Maintenance and It Feel Good were released in 2012 and 2018 respectively. Read more on Last.fm",159160,1461959,Demarco
daca2609-7bb3-427a-bb4d-e68ea2f16542,Leo The Kind, Read more on Last.fm,8813,33696,LAV.ISH
1348122a-6e92-4e94-82af-18416d650ae7,Doble Porción, Read more on Last.fm,491,11493,Doble Porción & Crudo Means Raw
00b1b69a-5881-4dc7-add8-2529de378705,Wreckless Klan, Read more on Last.fm,448,10949,Klondike Kat
4e639053-0be4-48db-b280-62c01b895463,Solareye,"Former frontman of the much-missed live band D.O.P.E. (Disciples Of Panic Earth); veteran performer with a whole host of live improv bands and at open mics all over Edinburgh and Glasgow, Solareye has a confident, natural flow, combined with an innate gift for storytelling.

This debut offering is straight-up rap music that will appeal to jazz junkies, funk fans and hip-hop headz alike. Relying heavily on live instrumentation, ‘Somniloquy’ is a direct shot to the heart: not just for hip-hop fans, but music lovers in general. Read more on Last.fm",432,3680,Stanley Odd
b27f61b3-7599-46ea-a385-e150bf0b5b95,Ironik,"There is more than one artist with that name.

1. Ironik is the rapper / producer combo of Ironik and wily. 

2. Ironik was born on January 18th 1988 in London, England. He was interested in music from an early age starting his career at the age of 13 when he worked as a DJ in clubs, not just in his home country but across Europe.
Aged 20 he signed a contract with the record label Atlantic/Warner UK, releasing his début album 'No Point In Wasting Tears' on September 29th 2008.

3. Ironik is also a rapper from Quebec and member of L'Assemblée. Read more on Last.fm",149814,867788,McLean
1266823d-bd9d-4e1b-9ec2-601180e057b3,Tempo,"There are atl least two artists/bands named tempo, a Reggaetón-artist from Puerto Rico, and a German Punk Band from Berlin (1978-1982).

1. David Sánchez Badillo (nacido el 25 de septiembre de 1979 en Ponce, Puerto Rico) mejor conocido como Tempo, es un cantante de rap y reggaeton. Es uno de los artistas más influyentes del genero reggaetón y es considerado para muchos el rey del rap latino.

David Sánchez Badillo es uno de los raperos más activos en producciones musicales dentro del género del “rap”. Read more on Last.fm",105693,582000,Vico C
d4a7e509-a6d3-444a-ad73-89b078ea5750,Rapper School, Read more on Last.fm,10603,153202,Norick
1d5e7094-07c4-4d39-aabf-67ca7b9c3d90,Dana Williams,"Dana Williams is an American singer-songwriter, guitarist, and poet from Los Angeles. She rose to prominence in 2014 after placing fourth on the American singing competition series, Rising Star.

She is the daughter of the late David Williams, musician and songwriter best known for his thirty-year collaboration with Michael Jackson. Her father also collaborated with many other artists, including Madonna, Bryan Ferry, Earth Wind & Fire, Whitney Houston, and Mariah Carey. Read more on Last.fm",46056,246103,James Vincent McMorrow
ff958d63-c910-42d1-960e-a3f005855ddc,Ele A, Read more on Last.fm,20061,788364,saYf
36494952-f434-45d8-a958-8b4acdbcf8a8,Gucci Mane,"Radric Davis (born February 12, 1980 in Birmingham, Alabama), better known by his stage name Gucci Mane, is an American rapper and CEO of 1017 Brick Squad Records. In 2005 he released his independent debut album, Trap House, which featured the successful single ""Icy"" that he recorded with Young Jeezy. He has since released a further three albums including 2006's Hard To Kill, 2007's Trap-A-Thon and 2007's Back To The Trap House. His sixth studio album Read more on Last.fm",2731189,65631733,OJ da Juiceman
2f9512a0-45a1-416d-b6e2-7f69f9b8ed68,Nigma, Read more on Last.fm,4800,23869,Melisses
78e854b8-9713-4ff2-9218-6b3784893bff,Vince Staples,"Vincent Jamal Staples (born July 2, 1993) is an American rapper and actor from the Ramona Park area of North Long Beach, California.[2] He is a member of the hip hop trio Cutthroat Boyz alongside fellow Californian rappers Aston Matthews and Joey Fatts. Staples was once a close associate of Odd Future, in particular Mike G and Earl Sweatshirt. He is currently signed to Blacksmith Records, ARTium Recordings and Def Jam Recordings.

Staples rose to Read more on Last.fm",1394593,87241556,ScHoolboy Q
3b2ced6a-160b-4539-b6c0-9b58e3105361,Chegs, Read more on Last.fm,53,203,B3 The Third
efc5d365-a448-4e2f-9b5f-4a7c84be725c,Wizkid,"Ayodeji Ibrahim Balogun (born 16 July 1990), known professionally as Wizkid (sometimes stylized as WizKid), Wizzy, Big Wiz or Starboy, is a Nigerian singer and songwriter.[3] The recipient of received several international music award nominations and awards,[4] he began recording music at the age of 11 and managed to release a collaborative album with the Glorious Five, a group he and a couple of his church friends formed. Wizkid signed a record deal with Empire Mates Entertainment (E.M.E) in 2009. Read more on Last.fm",583791,14138573,Asake
ad87d52b-6780-484e-8ef3-e75b562f10ac,Stunner, Read more on Last.fm,2226,12599,Children of the Reptile
c678e019-b729-45a3-94ca-81df9dd6eb08,La Santa Grifa,"La Santa Grifa es una agrupación de hip hop/rap originaria de Tampico, Tamaulipas (México). Se distinguen por sus letras explícitas que hacen alusión al consumo de drogas y alcohol, reflejando de esta manera no solo su forma de ser sino el difícil camino que por nacimiento muchos jóvenes mexicanos enfrentan. Francos, sin ahorrarse una sola palabra para rimar y sin adornos, La Santa Grifa destaca en la escena del hip hop mexicano con beats inspirados en el gangster rap de la vieja escuela y con rimas que subliman la santa grifa. Read more on Last.fm",116446,5703817,Cartel de Santa
5a53a5b1-9cdc-4a44-a4cf-63c82f9b2e38,Serengeti,"Serengeti is a multidimensional artist that utilizes his eclectic versatility to create unconventional, political music deeply rooted in Hip Hop culture. The use of the title Serengeti is an artistic symbol of his conceptions, forged to mirror the dense lakes and jungles of the African landscape from which his name and lineage is derived. The Chicago-born talent makes music to invoke emotion and promote change, citing racial disharmony, political ostracism and personal conflict as inspiration. Read more on Last.fm",110956,1628003,Open Mike Eagle
938bbcc7-3c04-4209-85fb-fa8b3dcd2672,A$AP Mob,"ASAP Mob (stylized as A$AP Mob) is an American hip hop collective formed in 2006, in Harlem, New York, by members ASAP Yams, ASAP Bari and ASAP Illz . The Mob is a collective of rappers, record producers, music video directors and fashion designers, who share similar interests in music, fashion, style and art. The collective mainly consists of New York-based rappers, most of whom carry the ""ASAP"" moniker, such as ASAP Rocky, ASAP Ferg, ASAP Twelvyy, ASAP Nast and ASAP Ant. Read more on Last.fm",878540,26529172,A$AP Ferg
4e5eadb6-c269-4c33-808e-64c102c823a0,Nyanda,"2013 marked the start of a new chapter for the multi-talented singer/songwriter Nyanda Thorbourne, known to the world as Nyanda from the chart topping Pop/Reggae duo Brick & Lace. Born to a Jamaican father and an American mother, both of whom are musical, she was raised on the sounds of reggae, R&B, Hip Hop and Country – which explains the trans-eclectic sound you hear reverberating from her music.

Nyanda entered the music business in the late 90s singing background vocals for Jamaican icons Marcia Grifiths, Beres Hammond and Diana King. Read more on Last.fm",1401,7709,Ishawna
d252cca8-8214-43e5-b81a-101eb4a1447e,Maxwell,"Maxwell (born in Brooklyn, New York on May 23, 1973) is a Grammy Award Winning American R&B artist. He was enormously important in defining and shaping the soul sub-genre, neo-soul, over the latter half of the '90s. He recorded some of the most ambitious R&B of his time, becoming wildly popular and often earning critical raves in the process. What was more, his recurring theme of romantic monogamy set him apart from the vast majority of his bump'n'grind lover-man contemporaries. Read more on Last.fm",828845,11929113,Musiq
9880800a-f6f8-4f8f-a00e-b4b664776c0c,Jay Rock,"Johnny Reed McKinzie Jr. (born March 31, 1986 in Watts, Los Angeles, California), better known by his stage name Jay Rock, is an American rapper. He was named one of the top 13 most street artists by XXL. His voice has been called a cross between The Notorious B.I.G. and Shyne. He is a part of the rap group Black Hippy which also features Kendrick Lamar, Schoolboy Q and Ab-Soul. Rock signed to Strange Music and released his long-awaited debut studio album Follow Me Home on July 2011. Read more on Last.fm",1375747,25070409,Ab-Soul
43fd8456-e1db-47a0-b973-08ac74e1aa48,Hooss, Read more on Last.fm,12938,232639,Haristone
027716fa-8dcb-48fe-80e0-c7054974468d,Sunny Malton, Read more on Last.fm,1575,14458,Big Boi Deep
8fe3e272-6642-48f0-a887-65a79c451505,Erick Rush, Read more on Last.fm,42,287,Stogie T
0c222801-9b2e-4d94-a6c8-8d0803adc341,Liiight, Read more on Last.fm,298,2460,Ridgy
13331e6d-af8f-4090-8828-715ff946f3ee,Citizen Kay, Read more on Last.fm,14878,81653,Jackie Onassis
1b6d6af6-cf80-47ac-b3fe-d0f5c45c2c50,I.E.,"I.E. (aka Margot Padilla) has been helping audiences lose their inhibitions for nearly a decade now. Emerging out of the same LA “Ravesploitation"" scene that gave us Captain Ahab, I.E.’s music exists somewhere between bedroom K-Pop star, chola rave queen with a computer programming job, and outcast from the mall punk scene. Regardless of how you describe her music, Margot has always been intent on bringing the fun to everyone. So while a great deal of her shows happen at LA mainstay The Smell Read more on Last.fm",3862,16799,True Neutral Crew
