id_artist,artist,bio,listeners,playcount,similar_artist
7cc8802d-0c05-4f78-ad35-421fea79dd0c,Brray,"Bryan García Quinones (19 de septiembre de 1992), más conocido como Brray, es un cantante y compositor puertorriqueño del género urbano, hip hop y trap. Autor de temas como La Curiosa, Machuqueo y Flow, Brray llegó a la escena con el lanzamiento de Me siento bien en 2014. Read more on Last.fm",110413,1566704,Nio Garcia
24ec58e8-9d3f-482f-a07d-0ea11c2ffcd5,Jay Wheeler,"Reggaeton singer from Puerto Rico.  According to an article by Natacha Andueza:

""Jose Angel Lopez Martinez started singing in a church, where he played the piano and then began creating all types of beats with his computer. Wheeler was too scared and shy to sing due to bullying while he was in school. He felt insecure and did not want to show off his talents.

A few years later, everything changed, he fell in love and had to deal with heartbreak. Read more on Last.fm",268503,5691442,Alex Rose
70cb4669-ad7a-4d5c-b99e-7582df393cc7,Snow,"There is more than one artist with the stage name Snow: 

1) Snow (born Darrin O'Brien on October 30, 1968 in North York, Ontario) is an award-winning Canadian reggae musician. His music is an interplay between reggae, dancehall with toasting and singjaying.

One of his neighboring Jamaican families introduced him as a teenager to reggae and began calling him ""Snow"" and ""Snow White"". In 1988, Jamaican-born DJ Marvin Prince witnessed O'Brien deejaying at a party in Toronto and the two quickly became friends. Read more on Last.fm",404385,2664734,Vanilla Ice
e4bc69e2-a064-4f93-ada1-f7f209cc1cc3,Selena Gomez,"Selena Marie Gomez (born July 22, 1992) is an American actress, singer, and businesswoman. She began her career as a child actress on the children's television series Barney & Friends (2002–2004) and later gained prominence for her role as Alex Russo on the Disney Channel sitcom Wizards of Waverly Place (2007–2012). In 2008 she signed with Hollywood Records and formed the band Selena Gomez & the Scene, which released the albums ""Kiss & Tell"" (2009), ""A Year Without Rain"" (2010), and ""When the Sun Goes Down"" (2011). Read more on Last.fm",3131901,201489222,Selena Gomez & the Scene
25607613-aceb-445a-8519-83a2ee0f8402,Marc Anthony,"Marco Antonio Muñiz (born September 16, 1964), better known by his stage name Marc Anthony.
 A New Yorker born and raised, the product of a music-loving Puerto Rican family, his parents named him Marco Antonio Muñíz in honor of the great Mexican balladeer of the same name. 
Born Marco Antonio Muñiz September 16, 1964 (age 52)
New York City, New York, U.S.
Nationality American Puerto Rican
Occupation Singer songwriter actor record producer television producer Read more on Last.fm",817167,10842031,Gilberto Santa Rosa
28385ad9-0968-45f2-a4ea-23f902a305bb,Yandar & Yostin, Read more on Last.fm,103535,644779,Zarcort
4580c75c-9937-4a68-a659-168c705eb764,Atomic Otro Way, Read more on Last.fm,64247,512801,Lirico En La Casa
f0ab0e69-c1c7-427e-806a-d553744873f4,$kyhook,"$kyhook es el productor de algunos de los temas más importantes del panorama nacional.  Consolidó su carrera en 2019 con el lanzamiento de ""Moonchies’"" su primer disco como productor. 

Durante 2021, ha lanzado la tercera entrega de Skydrvg, un disco junto a Pedro LaDroga titulado “Casa de Brujas” y la también tercera entrega de ""Skyrich"" junto a Rico Snchez. Además de un EP de tres temas, titulado “Vida Futura”, en el que $kyhook en Read more on Last.fm",38728,504325,Israel B
c2258df3-cfce-4dec-a721-33ca87c1be8f,CNCO,"CNCO is a Latin American pop boy band formed in December, 2015, after becoming the winning members of the first season of the La Banda singing competition series created by Simon Cowell and produced by Ricky Martin. The band has toured with Martin and their singles, ""Tan fácil"" and ""Quisiera"", charted well soon after their debut. They released their first album, Primera Cita on August 26, 2016.

On May 9, 2021, Joel Pimentel announced his exit from the group, citing desires to ""grow and explore new artistic venues"". Read more on Last.fm",494286,9319435,Abraham Mateo
eb90c8b8-d733-4c14-a293-105c3d1ba9b3,Becky G,"Rebbeca Marie Gomez, known professionally as Becky G, was born in Los Angeles on March 2, 1997. She is an American rapper, singer, and songwriter. Her musical career began in 2009 when she joined a girl group called G.L.A.M., and later another group named B.C.G.. Before her music career took off, Becky had already made small appearances in modeling and acting.

Her breakthrough came in 2011 when she posted a remake of Kanye West and Jay-Z’s Otis on YouTube. Read more on Last.fm",1418423,24974163,Natti Natasha
768ba077-c2ae-4c59-9212-5ff05c8db0f7,Gadiel,"Playing reggaeton since 1997, Gadiel Veguilla is younger brother of Llandel Veguilla from the Reggaeton duo Wisin y Yandel. Along with release of videoclip ""Pegate"", he announced his solo career officially. Read more on Last.fm",31322,171851,Jayko
0f2baefc-e714-4a48-94a4-36ca667928ce,IAmChino,"IAmChino is best known as Pitbull's canny and crowd-pleasing DJ. But Cuban Jose Garcia (his real name), based in Miami, has been a professional musician since he was 13. He got his first big break in 2005, after he met Pitbull's manager, Mike Calderón.  Read more on Last.fm",123248,628247,Nicky Jam
dcbbd72c-2511-4d6c-a313-0b45bac4d229,Mozart La Para,"Rapper Mozart La Para grew up on the outskirts of Santa Domingo in the Dominican Republic on a diet of classic Reggae en Español, and by the age of 12 had developed a knack for freestyling. Taking the skills he'd established, La Para entered local freestyle battles and eventually would become a regular finalist in the Batalla de los Gallos. While most of his contemporaries were embracing dembow and tropical pop, La Para continued to develop his Latin hip-hop sound. Read more on Last.fm",34651,225334,Black Jonas Point
3c490f79-d333-47d6-8a4a-8d676da4d1d2,Paulo Londra,"Paulo Ezequiel Londra Farías, más conocido como Paulo Londra (Córdoba, Argentina; 12 de abril de 1998) es un rapero, cantante, compositor y músico argentino

 Read more on Last.fm",378236,16293017,LIT killah
929e5ed7-217b-40b7-a87e-8ddbba4fc4d2,Frank Miami, Read more on Last.fm,20421,92788,Carbon Fiber Music
35f343df-3b87-4475-b0e4-d2ba5cc26eea,Romeo Santos,"Anthony ""Romeo"" Santos (born July 21, 1981) is an American singer, featured composer and lead singer of the Bachata group Aventura. As a member of Aventura, Santos has been a key figure in popularizing Bachata, with hits reaching near the top of the Billboard Latin charts and the top of charts in Europe. In 2002, the band's song ""Obsesión"" was number one in Italy for sixteen consecutive weeks. Santos was born in The Bronx, New York, United States to a Dominican father and a Puerto Rican mother. Read more on Last.fm",804934,24165519,Aventura
68416724-6cc4-41ee-b81c-1ce169c00f03,Guitarricadelafuente,"Álvaro Lafuente Calvo, better known by his stage name Guitarricadelafuente, is a Spanish singer-songwriter, guitarist and musician based in Barcelona. 
Lafuente started posting covers on different social media platforms like Instagram in 2017 while being unsigned. Those covers attracted a modest number of people at first thanks to their mix of folk, rumba, and flamenco music. Read more on Last.fm",126067,4935379,pablopablo
898da36d-1d3c-4df5-ba60-928d89c4ce70,Maite Perroni,"Maite Perroni Beorlegui is a Mexican singer and actress. She was born in March 9, 1983 in Mexico City, Distrito Federal. Maite gained international popularity as a member of the successful group RBD and her roles in telenovelas.

Maite Perroni was only eleven months old when she and her family moved to Guadalajara, the capital of the state of Jalisco in Mexico. Her father, Javier Perroni, was transferred to that city by his job, where the Perroni family lived for twelve years. Read more on Last.fm",80189,2042221,Dulce María
b5e48298-41ec-4933-8e3d-d6b2c0b49030,Omar Varela, Read more on Last.fm,37034,281398,Salastkbron
c0f72373-8947-4509-9611-fff7fd9dee4c,Marcianos Crew, Read more on Last.fm,16338,264438,Santoz
f09abfeb-9190-425a-98d1-fc258d10f841,El Conejo,"There is more than one artist with this name, including: 
1) El Conejo is Brazilian musician Bruno Nunes Coelho. 
2) El Conejo is Colombian trombonist Alberto Barros. 

1) El Conejo is Brazilian musician Bruno Nunes Coelho. He has released a single entitled ""A Lullaby for Elisa"". 

2) El Conejo is Colombian trombonist Alberto Barros. Read more on Last.fm",1750,10113,Juseph
5c139369-7a1a-4929-8559-6b899ab5782f,Mym, Read more on Last.fm,7859,52557,El Nene La amenaza
75be165a-ad83-4d12-bd28-f589a15c479f,Major Lazer,"Major Lazer is a Jamaican-American electronic dance music and DJ trio, which includes record producer Diplo, and DJs Walshy Fire and Ape Drums. They originate from Kingston, Jamaica, founded in 2008 by Diplo and Switch, with Switch leaving after three years in 2011. He was then replaced by both Jillionaire and Walshy Fire. In June 2019, Jillionaire left the group and was replaced by Ape Drums. Its music spans numerous genres, mixing reggae with dancehall, reggaeton, soca, house and moombahton. Read more on Last.fm",2932099,68439370,Calvin Harris
6143403a-df6c-429e-8ee6-ef869896b0da,Quavo,"Quavious Keyate Marshall (born April 2, 1991), known professionally as Quavo, is an American rapper and record producer, one third of Atlanta hip-hop group Migos alongside Takeoff and Offset.

Quavo’s individual career was initiated by a series of guest features for acclaimed hip-hop artists like Travis Scott, Young Thug, A$AP Ferg, Post Malone and DJ Khaled. On December 21, 2017 he released a collaboration album with Travis Scott called Huncho Jack, Jack Huncho. He released his debut solo album QUAVO HUNCHO on October 11, 2018. Read more on Last.fm",1254557,29950714,Migos
d94722fe-0503-405a-a454-c9181208056f,Princesa Alba,"Trinidad Valentina Riveros Inostroza, better known by her stage name Princesa Alba, is a Chilean singer and artist.

She gained recognition for her first single ""Mi Only One"", released on YouTube in 2017. In 2018 she released her Mixtape Del Cielo with productions by Gianluca, OSSA and with a collaboration with the French Lean Chihiro. 

In December 2018, she released her single ""Summer Love"" (in collaboration with Gianluca, and produced by Francisco Victoria) Read more on Last.fm",152178,3390176,Paloma Mami
bc154a90-890b-409e-b850-53ca299ab0d6,Eloy,"Eloy is a progressive rock band from Germany, whose musical style includes symphonic and space rock, the latter being more prevalent on earlier albums. The band took their name from the Eloi, a futuristic race of people in the H.G. Wells novel The Time Machine.

Founded in 1969 by guitarist Frank Bornemann, the band has endured several line-up changes, with Bornemann being the only consistent member. In the 1980s, after a series of major splits in the group (which disbanded in 1984 and reformed in 1988) Read more on Last.fm",383879,5779394,Nektar
2b67658e-429f-425a-adf5-345b13112fc1,JHAYCO,"Jesús Manuel Nieves Cortez (born April 9, 1993), known professionally as Jhayco (formerly Jhay Cortez), is a Puerto Rican singer and rapper from Río Piedras, San Juan. After releasing multiple EPs, his debut studio album, Famouz, was released in 2019. The album contained features from J Balvin, Bad Bunny, Rafa Pabön, C. Tangana, Almighty, Tainy & Zion y Lennox. The album also contained his breakout songs No Me Conoce and No Me Conoce - Remix.
 Read more on Last.fm",435236,17236947,Mora
532e4ed5-1ad9-4997-9fa2-4271fe7eb757,Pacho, Read more on Last.fm,1540,5593,Pacho El Antifeka
776b2c10-31fe-4c4b-9982-f408279b80a9,Elvis Crespo,"Elvis Crespo (born July 30, 1971 in New York City, U.S.A.) is a Grammy Award and Latin Grammy Winner Puerto Rican-American Merengue singer. He was named ""Elvis"" after American singer Elvis Presley. When he was young, he and his mother moved to Caguas, Puerto Rico, where Crespo spent his childhood and adolescent years.

Crespo first gained fame in the mid-90s when he joined Grupo Mania, in Puerto Rico. Eventually he decided to try to go solo in 1998. Read more on Last.fm",561530,4271594,Los Hermanos Rosario
28e6d28f-e134-476f-bcad-26051c27c9ba,Darell,"One of the most sought-after artists from the latest wave of the Urban Latin movement, Puerto Rico native Darell emerged as both a sought-after composer in 2018, playing a definitive role in numerous hits and attracting a rapid fan base back home. Among many smashes, Nío García, Casper Mágico y Bad Bunny’s “Te Boté REMIX” [feat. Ozuna, Nicky Jam y Darell] stood out as one of the year’s most heard and streamed songs, spending 41 weeks on the Latin Airplay chart and peaking at #2. Read more on Last.fm",205715,2191835,Brytiago
ea103218-16a7-4260-b1d7-1d1fea4d1d8c,El Kanka, Read more on Last.fm,57076,1262493,Muerdo
3c2a5fdf-c2ca-409c-a548-b011c55bc708,Elilluminari, Read more on Last.fm,42279,271499,Anthony Godfather
59bc1ba2-ce50-4c2c-985b-0502b281f19a,Miky Woodz,"Miguel Ángel Rivera Rodríguez, known as Miky Woodz, is a Puerto Rican Latin trap rapper born in Carolina, Puerto Rico. To date, Woodz has released two studio albums, Before Famous in 2017, and El OG in 2018, which were both commercial successes. Read more on Last.fm",70025,1187693,Bryant Myers
fec16fa7-f0a9-40ae-a5f5-46823e1e1de1,Galvan Real, Read more on Last.fm,8401,126430,Raul Camacho
87295375-9be1-40f1-b151-3b5cd47befdb,Yaviah,"Javier Alexis Marcano Rodríguez es el nombre de quien es conocido como 'El Gato' BlackFather Yaviah. Yaviah sencillamente interpreta lo que vive. Esa es su pasión. Su estilo ha sido crear éxitos musicales uno tras otro de forma sostenida desde el año 1993. 

Su estrategia: participar en las producciones musicales de mayor venta en el Mercado y mantenerse al margen de la exposición negativa, factor que ha beneficiado su proyección como artista profesional Read more on Last.fm",21168,101096,Johnny Prez
d836bdef-52ef-4142-baba-573e5b529478,rusowsky,"Rusowsky is the artistic alter ego behind which Ruslan Mediavilla hides, a young man from Madrid with Belarusian roots and classical musical training. He is one of the representatives of the new underground scene that is flourishing these days thanks to the ease of being able to record songs from home, without having large technological means. Read more on Last.fm",322125,13459269,Sen Senra
e79cbc79-426e-4efe-85e5-26379f241178,Leslie Grace,"Leslie Grace was born on January 7, 1995 in The Bronx, a borough of New York City. She was raised and attended school in Davie, Florida. Grace, born to Dominican parents, was entertaining her five older siblings and parents when she could barely speak, at the age of two. She speaks fluent English and Spanish. Her family gave her the confidence to trust in her talent and pursue success doing what she loves: writing and performing songs. She launched her professional career with her single Read more on Last.fm",118776,1517723,Toby Love
23dbcf0f-5875-48d5-9983-5dc98223a142,El Super Nuevo, Read more on Last.fm,35672,224619,Musicologo The Libro
fe2d4768-80a4-4a00-b606-4872b6996a6a,Juan Magán,"Juan Manuel Magán González, también conocido como Magán, es un productor discográfico, remezclador, DJ, compositor, letrista y cantante español, nacionalizado dominicano Read more on Last.fm",222020,2470263,Don Omar
709f5e96-51cd-49b4-a8e4-0ca0bf808de3,Sech,"Carlos Isaías Morales Williams (born December 3, 1993), better known as Sech, is a Panamanian singer. In April 2019 he released his album Sueños, reaching number three on the Billboard Top Latin Albums chart. In an interview with Billboard, Sech mentioned El General being an influence for his music. He first reached popularity with his song ""Miss Lonely"", in 2017. Read more on Last.fm",363533,7420247,Dalex
38ae1a57-de55-4183-adb4-75ff3739bc4d,Los Hermanos Dalton, Read more on Last.fm,7415,59127,091
e79f452c-d174-4c36-919e-a80f71aa4cf6,Revol, Read more on Last.fm,90366,851919,Trap Capos
9fff2f8a-21e6-47de-a2b8-7f449929d43f,Drake,"Aubrey ""Drake"" Graham (born October 24, 1986) is an Canadian rapper, singer, songwriter, record producer, actor, and businessman. Drake was an actor on the teen drama television series Degrassi: The Next Generation in the early 2000s. Intent on pursuing a career in music, he left the series in 2007 after releasing his debut mixtape, Room for Improvement. He released two further independent projects, Comeback Season and So Far Gone, before signing to Lil Wayne's Young Money Entertainment in June 2009. Read more on Last.fm",6647803,1128993735,PARTYNEXTDOOR
18590a6e-8372-478d-9a17-288678051e39,Mackie, Read more on Last.fm,21611,184460,Jossef
5fdae5d2-8aff-4671-8cf8-3b216f63265f,Costa,"There are at least 5 artists that use this nickname:

1) Konstantin Gerasimov - Electronic music producer from Kaliningrad, Russia
2) Costa - rapper from Spain
3) Costa - rapper from Sri Lanka
4) Costa - MPB and Folk singer from Brazil.
5) Costa - rapper from France Read more on Last.fm",40743,768929,Aurosonic
61401637-c94b-4e0d-aab9-b1b796be21e5,Fred De Palma,"Fred De Palma, the stage name of Federico Palana (Turin, 3 November 1989) is an Italian rapper.

Fred De Palma began his musical career in 2007 in Turin, with freestyling skills. Many freestyle contests in Turin and Milan put him in attention of the industry, and in 2010 he collaborated with Dirty C, creating the band Royal Rhymes, and started to experiment in the studio. At the beginning of 2010, the group signed a recording contract with the independent record label Trumen Records, and collaborated with producers Jahcool and Double H Groovy. Read more on Last.fm",100780,2089658,Rocco Hunt
149f91ef-1287-46da-9a8e-87fee02f1471,Pharrell Williams,"Pharrell Williams (born April 5, 1973 in Virginia Beach, Virginia, United States), also known by his mononym Pharrell, is an American singer-songwriter, rapper, record producer, and fashion designer. Williams and Chad Hugo make up the record production duo the Neptunes, producing soul, hip hop and R&B music. He is also the lead vocalist and drummer of rock, funk, and hip hop band N*E*R*D, which he formed with Hugo and childhood friend Shay Haley. Read more on Last.fm",2699924,47689841,N*E*R*D
5af3690d-3d9b-48f2-8aa2-6ed7fd1251b1,Antonio Cartagena, Read more on Last.fm,26330,230752,Los Titanes
21029ef5-0842-46f8-b068-d99e2f06d231,Javiielo, Read more on Last.fm,50349,601240,Jossef
c19f2f11-d8c0-4cf0-88e8-3c6d9f8794e9,Cadenza,"There are multiple artists named Cadenza

1)
Cadenza Collective is a band from Kathmandu, Nepal, which plays a mix of jazz/funk/soul/Afrobeat. They can be seen live at Jazz Upstairs, Kathmandu, Nepal on Wednesdays and Saturdays from 8:00 pm to 10:00 pm. They also headline the annual Jazz Festival in Kathmandu.

Their official website is www.cadenza.com.np, you can listen to some tracks on this myspace page www.myspace.com/cadenzakath.

2)
Cadenza is a dubstep producer
----------------------------------------------------------

 Read more on Last.fm",74331,330372,Synth Girl
ae44dccd-8fdc-42ff-84a6-2a0549bacca4,Abraham Mateo,"Abraham Mateo (born in San Fernando (Cadiz), Spain on August 25, 1998) is a Spanish teen actor and pop singer. Abraham was discovered in 2009, when he was ten, by producers of the record label EMI Music Spain, who happened across Abraham's videos in Youtube and his multiple performances in the television show Menuda Noche on the Canal Sur TV of Andalucia, Spain. His self-titled debut album, Abraham Mateo, was released in Spain in December 2009. The album was produced by the spanish composer and producer Jacobo Calderon Read more on Last.fm",167547,2685266,Vicco
ff958d63-c910-42d1-960e-a3f005855ddc,Ele A, Read more on Last.fm,20085,790149,saYf
5e43ba45-a97f-40a0-a159-8686f7c7614c,Kiko Rodriguez,"Kiko Rodriguez, was born in Tamboril, Santiago de los Caballeros, Dominican Republic. From the age of 10 years, Kiko Rodriguez felt that the music, in this case the bachata or music of the bittered, touched the heart of him, which motivated the youngster to practice with percussion instruments, although after that he was interested in the guitar, that later accompanied him in his songs. 

He made his first presentation when he was 12 years of age, which opened the doors to which is today the successful carreer of Kiko Rodriguez. Read more on Last.fm",43506,228889,El Chaval
eaee97f6-f2e4-414a-966c-f31a1fb4696a,Feid,"Salomón Villada Hoyos, also known as Ferxxo or Feid, is a prominent Colombian singer and songwriter in urban music. Born on August 19, 1992, in Medellín, Colombia, he developed a passion for music from a young age and participated in music extension courses with his parents. Starting with the clarinet, he later shifted his focus to his voice and became a member of the University of Antioquia choir.

Since 2015, Feid has dedicated himself to singing and songwriting Read more on Last.fm",629672,57167195,Mora
a06afacd-7894-442e-95ba-49366b2b3e02,Zion & Lennox,"Zion & Lennox are a reggaeton duo from Carolina, Puerto Rico; in late 2010 Zion & Lennox released their 3rd studio album titled Los Verdaderos under Pina Records.

They have been in the music business for a long time, but had failed to get any recognition for the majority of those years. They had minor hits such as ""Baila Conmigo"" for the 2003 compilation album ""Desafío"" and ""Me Pones Tensión"" for the album The Noise: La Biografía. These hits, along with others in the near future and increased radio play gave them more recognition. Read more on Last.fm",793437,8898584,Wisin & Yandel
947f21fa-4244-433c-8d51-bf43513d3f71,Natos y Waor,"Dúo de rap madrileño. Cuentan con 8 trabajos a sus espaldas: ¨POR LA JETA¨ (2011), ""CATARSIS"" (2012), ""HIJOS DE LA RUINA"" (2012, ft Recycled J), ""CAJA NEGRA"" (2014), MARTES 13 (ganador del Premio MIN a mejor álbum de Hip Hop de 2015), ""HIJOS DE LA RUINA Vol. 2"" (2016, ft Recycled J), ""CICATRICES"" (2018) e ""HIJOS DE LA RUINA Vol. 3"" (2021, ft Recycled J, que es a día de hoy el disco de hip hop más reproducido en España el día de su lanzamiento en la historia de las plataformas digitales). Read more on Last.fm",52167,2772331,FERNANDOCOSTA
55393d51-d45a-444a-bbca-52e7265e1729,Alex Sensation, Read more on Last.fm,103960,695925,Gente de Zona
27728d8c-7427-4975-bc5c-a41dd68622f8,Jantony, Read more on Last.fm,10261,51035,Sinfonico
2ef5b393-02fd-486e-a195-a8ac5d92401e,Ceky Viciny, Read more on Last.fm,34318,249313,Flow 28
0887484d-aed1-4aa6-9862-930a25815696,El Alfa,"Emmanuel Herrera Batista, known professionally as El Alfa, is a Dominican dembow recording artist, In 2015, after receiving criticism for insulting the founding fathers of the Dominican Republic in a music video, El Alfa was sentenced to 15 days of community service. The President of El Instituto Duartino, Cesar Romero called for the boycott and destruction of El Alfa's albums for having disrespected the founding fathers. Part of El Alfa's sentencing Read more on Last.fm",661167,15950397,Rochy RD
7e1f24ca-0f7d-4da8-aac8-d953008b8984,La Nueva Escuela, Read more on Last.fm,35422,488620,La Deskarga
56715579-33a2-4887-b478-8e9709eee5ff,Camin,"caMin (previosuly known as Hallowitch) is an all-female visual kei rock band from Nagoya, Japan. They formed in 2005. The band have been on a indenfite hiatus since 2013, Shinri and Kokoro have remianed active and both currently play in Spark.

Members:
Vocal: Saeco
Guitar: あさき (Asaki)
Bass: しんり (Shinri)
Drums: 心 (Kokoro)

Ex. members:
Guitar: Nagisa Read more on Last.fm",17106,279935,JC El Diamante
7de398f0-b4cf-476d-ac60-41d47d3511ca,Rawayana,"Rawayana is a band formed in Caracas, Venezuela. Line up: BetoMonte (vocals, guitars). Tony (bass, chorus). Abeja. (guitars, chorus). Ro-ro. (drums, chorus). Toño (latin percussion). It's a mix of many genres like reggae, rock and acoustic. And make all the people dance to their music. It's made with love and for everybody! Read more on Last.fm",142930,4573387,Los Mesoneros
7e3a670c-b4aa-4f27-8682-1b28c063aff2,Kasher Quon,"Marquon Fulton, known professionally as Kasher Quon, is a rapper from Detroit, Michigan. His rise to popularity in late 2019 followed his lively and hard-hitting contributions within the then-burgeoning scam rap genre, particularly alongside former collaborator Teejayx6.

As of May 2022, he no longer drinks lean. Read more on Last.fm",35333,692274,Teejayx6
a008fd17-9e77-4980-879a-57bc9785b9a8,Alexis,"There are at least six artists called alexis.

1) alexis

German-Danish artist. The music can be describet as IDM, Downbeat or Chillout with Breakbeat-elements - sometimes it makes you happy sometimes very sad. It can you make feeling in love or it could also make you feel stupid.

For more informations about and free downloads from this german guy, please visit the official myspace-Site www.myspace.com/lxsmusic.

2) Alexis, Chanson-Singer

3) Alexis, aka Elena Ferretti Read more on Last.fm",20577,131379,Robert Patton
786ce8c5-cb6c-4667-ad27-f61b6bfc3ed0,Dímelo Flow,"Jorge Valdés Vázquez, más conocido como DJ Flow o Dímelo Flow, es un DJ y productor panameño afincado en Estados Unidos.​ Read more on Last.fm",98728,957736,Dimelo Flow
