mbid,artist,bio,listeners,playcount,similar_artist
a6d4c9c7-2459-4754-8956-5c41cdce2d23,Saske,"Ο Saske (πραγματικό όνομα: Βλάσης Οδυσσέας Ντζιμάνης - Μυτιλήνη, 14 Απριλίου 1998) είναι Έλληνας ράπερ με καταγωγή από τη Χρυσούπολη Καβάλας. Αποτέλεσε ένα από τα ιδρυτικά στελέχη της ανεξάρτητης δισκογραφικής εταιρείας Offbeat Records ενώ μέχρι σήμερα έχει κυκλοφορήσει χρυσά Read more on Last.fm",21746,2365109,Sidarta
f83c5385-84ae-413c-8057-18d2f4fcac67,Kalash Criminel,"Kalash Criminel is a French rapper of Congolese descent. He started rapping in a group called Hall 14, releasing their first album in 2012. He was spotted by Kaaris in 2016 and they released a single together which kick-started Kalash Criminel's career. He then released his first album R.A.S. in late 2016 and his second album Oyoki in 2017.

Kalash Criminel is albino and wears a balaclava to conceal his identity. Read more on Last.fm",56796,1965350,Kaaris
217c844d-dc5c-439d-b27a-a227ff3039bb,Josylvio,"Joost Theo Sylvio Yussef Abdel Galil Dowib (Naarden, 14 april 1992), bekend onder zijn artiestennaam Josylvio, is een Nederlands rapper.

Biografie
Josylvio werd geboren in Naarden als de zoon van een Nederlandse moeder en een Egyptische vader. In 2015 deed hij een Zonamo-sessie onder de naam Jaybay. In 2015 bracht hij de single Le7nesh uit (met Sevn Alias). Het was de aanleiding voor het album Ma3seb, dat hij samen met hiphopproducent en jeugdvriend[1] Esko uitbracht. Read more on Last.fm",51859,3143066,Sevn Alias
96cf8760-18ee-443e-b950-4a219e55e443,VETO,"There are 4 artists with this name:

1) Veto is a Danish indie rock band formed in 2004. They released their first EP, I Will Not Listen, in 2005 and their first full-length album, There's a Beat in All Machines, in 2006, both released on the Danish hip hop label, Tabu Records/Playground Music Denmark.

In February 2007 Veto won the award for Best New Act, as well as Best Danish Music Video at Danish Music Awards. Their song ""You Are a Knife"" was featured briefly in the American television program NCIS episode ""Suspicion"". Read more on Last.fm",131063,4085912,Turboweekend
ed5c0b54-0fd1-4076-aa45-f876f2081669,Khaotic,"Created in june 2012 by D. Profaner, Khaotic is not only a project, but a very personal art in music form, it was created to express deep feelings and thoughts about the obscure, the human weakness and total hatred and repudiation to christianity. Khaotic came to praise the true darkness, unmask the lies, to defy those who are submissive to the farce, to fight against alienation, to desecrate the word of god. Read more on Last.fm",1871,9691,Luvart
1f5673dc-cef7-4d07-8bef-a96f0eeb81d8,Plutonio,"João Ricardo Azevedo (born 28 June 1985), mostly known for his stage name Plutónio or Plutonio, is a Portuguese rapper and hip-hop singer. Read more on Last.fm",26255,1948709,Dillaz
d1689304-23ac-4eae-a147-bd2e4100581a,Prince Royce,"Geoffrey Royce Rojas was born and raised in the Bronx, New York. His parents are both from the land of bachata, The Dominican Republic. His parents got divorced, so it was just him, his mom, and siblings. Geoffrey loved singing, so one day he asked permission to remake the song ""Stand By Me"". After that song the record company signed him, and he makes many songs. His two popular songs are ""Stand By Me"" and ""Corazon Sin Cara"". He has won two Latin Grammy Awards! Read more on Last.fm",734653,14099947,Romeo Santos
a0aab79a-4515-4c3a-a708-49277b4f06ce,DJ Sem, Read more on Last.fm,11814,87523,Basada
5fb797a5-523f-431f-9d83-4d72ab1daead,CISKO, Read more on Last.fm,311,2139,Drupey
bce2c380-ef99-4c34-80dc-ad04b490d3b1,JAY1,"Jason Andrè Juami (born 27 January 1998), better known by his stage name Jay1 (stylised as JAY1), is a British rapper and songwriter who is from Coventry. He is of Congolese ancestry. He has had two top 20 singles in the UK.

Jay1 is best known for his single ""Your Mrs"", which was released in March 2019. He released his debut EP titled One Wave on 4 July 2019. Read more on Last.fm",154898,2348040,AJ Tracey
01ece22c-de66-4513-ad11-6d47825c6168,Caroline Smith,"Merging ’90s R&B and neo-soul with her indie-rock roots, Caroline Smith‘s new music has settled comfortably into a new backdrop as she takes a step from girl to woman. Half About Being a Woman is a record about self-acceptance and growing into yourself; it’s about going back to the roots of ‘feel-good’ music. “I wanted to find my way back to the reason why I started playing music in the first place,” says Smith. “Over the last year I began to embrace that being a strong Read more on Last.fm",27092,233151,Ruby the Rabbitfoot
c6390b3d-e0c9-454d-813b-2a8d8bdddaf8,Atchi, Read more on Last.fm,279,10302,Novem
f5dfa020-ad69-41cd-b3d4-fd7af0414e94,Wiz Khalifa,"Cameron Jibril Thomaz (born September 8, 1987 in Minot, North Dakota), better known by his stage name Wiz Khalifa, is an American rapper based in Pittsburgh, Pennsylvania, signed to Rostrum Records. According to the Black and Yellow Songfacts, his stage name is derived from khalifa, an Arabic word meaning ""successor"", and wisdom. His nickname growing up was ""Wizard"" which was shortened to Wiz when Khalifa was fifteen.

In 2005 he released his first official mixtape Read more on Last.fm",3851111,87867946,Juicy J
43b00210-e20d-48a8-8c50-812636d84b4a,Bad Balance,"Bad Balance is a Russian rap group considered to be one of the first rap acts in USSR. The group maintained a devoted underground following during 1990's.
Bad Balance was formed as a breakdance crew in 1980's in Saint-Petersburg by students from Donetsk named Vlad Valov (SheFF) and Sergey Krutikov (Михей). Group switched to rapping and recorded the debut album ""Vishe Zakona"" in 1989 for Gala Records.

The band toured France and US. Classic Bad Balance albums ""Naletchiki Bad B. Read more on Last.fm",37667,784851,Detsl aka Le Truk
6a12275f-4e18-4909-ba4d-7394224de7d2,Dizzy Wright,"La'Reonte Wright (born November 26, 1990) is an American rapper better known by his stage name Dizzy Wright. In December 2011 he signed to rapper Hopsin's independent record label Funk Volume. After signing he released his debut studio album SmokeOut Conversations in April 2012. He followed that with The First Agreement in December of that year, and then a mixtape The Golden Age in August 2013. All three projects managed to chart in the top 50 of the Billboard Top R&B/Hip-Hop Albums chart. Read more on Last.fm",143015,1841107,Jarren Benton
5aa1be36-7f9b-4a6a-931e-d831e25c6247,Diaz Grimm, Read more on Last.fm,2288,13599,PNC
27fb68a3-10b6-4dc7-afe5-9428412dcc60,Stacy Barthe,"Packing a background as exotic as it is homegrown, Atlanta-based Haitian/Dominican songwriter Stacy Barthe has earned a startstudded client list in her short time on the scene.

With credits for the likes of Black Eyed Peas, Britney Spears, Keri Hilson, Enrique Iglesias, New Kids on the Block, Ciara, Tiffany Evans, Cassie, and Diddy to name a few, Barthe has become one of the most indemand young songwriting talents. So much so that Universal Music Publishing took notice of her work, and signed her to their already impressive assembly. Read more on Last.fm",22060,142335,Joi Starr
d2b870c8-da5c-4812-b0dd-59f8c198671f,Cliff Notez, Read more on Last.fm,634,4551,oompa
a5cd23ce-eb85-4fe0-bddd-f00f8cd6640a,Zxmyr, Read more on Last.fm,18111,274704,Toser One
0a3a9755-6bd2-4bc1-a173-d54d45056382,JURI,"There are at least four artistes called Juri:

1) Juri is a German rap artist. His most recent album, Bratans aus Favelas reached the #1 position on the official German album charts.

2) Juri is a Finnish musician who makes ambient and atmospheric electronic music.

3) Juri is a Japanese singer and pianist. She is a member of 黒百合姉妹 (Kuroyuri Shimai) alongside Lisa. Her song ""薔薇の失墜-SANCTUS-"" appeared on the Angel Sanctuary Audio Drama soundtrack released in 1999 Read more on Last.fm",20901,480994,Herzog
3af2b07e-c91c-4160-9bda-f0b9e3144ed3,Texta,"Texta is an Austrian Hip Hop group consisting of the MCs Flip (Philipp Kroll), Huckey (Harald Renner), Laima (Klaus Laimer), Skero (Martin Skerwald) and DJ Dan (Daniel Reisinger). Existing since 1993 they have released 8 albums so far: Gediegen (1997), Gegenüber (1999), Blickwinkel (2002), So oder so (2004), Paroli (2007), Grotesk (2011) and Nichts dagegen, aber (2016). After the death of rapper Huckey in 2018, who was one of the founding members of the band, it was unclear if Texta would continue making music. Read more on Last.fm",35360,487442,Main Concept
36d55954-5105-4a92-a577-ea4163008d36,Reke, Read more on Last.fm,3599,38634,Prieto Gang
f30340bc-4746-42aa-b62a-fe2473a31bc3,STL GLD,"STL GLD (Moe Pope x The Arcitype)

Lyricist Moe Pope has received the Boston Music Awards honor as Best Hip-Hop Artist for two years running. On his newest venture, he collaborates with producer The Arcitype for a project they call STL GLD. Their album My Monday Morning Music (MMMM) comes out via AR Classic/Brick Records on August 12th.

About Moe Pope: Moe Pope is an indie hip-hop artist, songwriter and contemporary painter. As a lyricist, Pope chronicles the stories of his life and his community by touching upon subjects like fatherhood Read more on Last.fm",3530,26853,ILLA GHEE
fcb49118-d8b2-48a1-8f99-a01d3aeb4749,Georgia B., Read more on Last.fm,43,108,Citizen Kay
e2e593af-0b56-4a12-90fd-53611e14abcd,DELLAFUENTE,"Artista, que no rapero, under-underground granaíno.

Dellafuente empezó distribuyendo su música en YouTube, en donde ganó fama y tracción desde 2012. Más tarde sus colaboraciones con otros artistas de la escena del trap como Yung Beef y C. Tangana lo catapultaron al éxito nacional, aunque él siempre ha sido muy propio, lo cual se puede ver en su música, difícil de catalogar en un único género.

A donde va llena las salas, y no es de extrañar Read more on Last.fm",130949,5509499,Cruz Cafuné
d351ae75-1ceb-49fe-a188-bd7ae55902a1,AVA,"There are many artists sharing this name.

(1) AVA - Éabha McMahon (pronounced AY-va) is a contralto Irish singer and a former member of the ensemble Celtic Woman. In 2020 she began recording music under the name AVA.

(2) ava - Indie rock band founded in Lafayette, Indiana in 2001. Original band members include Rob Soden (Rob Banks), Kalli Scheffen (Kalli Fox), Brad Threlkeld (B-rad), Dave Evans, later replaced by Jon Sommer (Jonny Magic). Ava's music has been featured on NPR as well as motion pictures. Read more on Last.fm",72975,1104127,Nabi
25b7b584-d952-4662-a8b9-dd8cdfbfeb64,A$AP Rocky,"Rakim Athelston Mayers (born October 3, 1988), known professionally as ASAP Rocky (stylized as A$AP Rocky), is an American rapper, record producer, actor, fashion designer, and model. Born and raised in Harlem, New York, he began his music career as a member of the hip hop collective ASAP Mob, from which he adopted his stage name. In August 2011, his single ""Peso"" was leaked online and gained radio airplay, contributing to the mainstream attention of cloud rap. Read more on Last.fm",3389842,357103920,A$AP Mob
5386511f-b7bd-4058-9b5e-2c5dc426e1c9,Lomepal,"Antoine Valentinelli, dit Lomepal, né le 4 décembre 1991 dans le 13e arrondissement de Paris, est un rappeur et chanteur français.

Après ses débuts dans le rap en 2011, Lomepal publie quatre EP puis deux albums studio, FLIP, sorti en juin 2017 et certifié triple disque de platine, et Jeannine, sorti en décembre 2018 est certifié disque de diamant. En 2019, Lomepal sort la réédition de Jeannine sous le titre Amina.

En parallèle, il se lie d'amitié avec d'autres rappeurs comme les belges Caballero et JeanJass Read more on Last.fm",128761,9345152,Nekfeu
7b9e2f3e-bf56-4ec4-acaa-34c8bfac3d09,Brighty, Read more on Last.fm,489,2592,Chris Bullen
b4411d5d-2130-49f2-b075-8e727333f192,Eskimo,"The name ""Eskimo"" can refer to a :
1 - (UK) psy-trance producer,
2 - (US) horrorlounge band,
3 - (Russian) alternative band,
4 - (Brazilian) rock band 
5 - (Estonian) instrumental hip-hop artist, 
6 - experimental coldwave / post-punk  band from the 80-s.
7 - (Latvian)  indie rock / electronic  band

UK Eskimo:

Eskimo aka Junya is one of the new generation of trance producers. He released his debut artist album ""Can You Pick Me Up"" aged 17.  Including his DJ Sets as DJ Junya, he has been playing worldwide since he was 13. Read more on Last.fm",73504,809050,Eskimo Vs Dynamic
4d7304f6-7fe3-4959-9d98-01a5af84afe6,Trey Songz,"
Tremaine Aldon Neverson (born November 28, 1984 in Petersburg, Virginia, USA), better known by his stage name Trey Songz, is a Grammy award nominated American singer, producer and actor. After releasing many mixtapes under the name Prince of Virginia he signed to Atlantic Records in 2005 and released his debut album I Gotta Make It. His second album, Trey Day, was released in 2007 and earned him a Grammy nomination. His latest album, Ready, was released in September 2009 and debuted at #3 on the Billboard 200. Read more on Last.fm",2227780,33578008,August Alsina
45dc5f07-6609-4760-a933-8c9e0f858d05,French Montana,"Karim Kharbouch (born November 9, 1984), better known by his stage name French Montana, is a Moroccan-American rapper. Born and raised in Morocco, he immigrated to the United States with his family at the age of 13. He embarked on a musical career in 2002, releasing a slew of independent material until signing a joint-venture record deal with Puff Daddy's Bad Boy Records and Rick Ross's Maybach Music Group in 2012.
Kharbouch released his debut mixtape in 2007 and had his first breakthrough with the single ""Choppa Choppa Down"" in 2010. Read more on Last.fm",1938960,29100331,DJ Khaled
774fe81d-a126-42aa-b889-534eaebe72f7,Miranda,"NOTE: This is NOT ""Miranda!"", the Argentinian electropop band. If your Miranda! tracks lead to this page, please correct the artist field in them and help keep last.fm's stats correct.

Miranda may refer to:

1) French/Latin eurodance group fronted by Sandra Miranda García.
This short-lived French eurodance group, founded by producers Louis Corte AKA Louis Element and Harry Verschuere AKA Johnny Williams, existed from 1999 to 2001. Fronted by model Sandra Miranda García Read more on Last.fm",142974,1967170,Prana
a3e6fd84-a059-4baa-a275-56353cabd048,Bang On!,"One of the most exciting artists Big Dada has signed recently is the Liverpool bred Bang On. A born MC, Elliott Egerton's delivery effortlessly moves between funny and furious, as he spins yarns and nails metaphors that make rap sound like a good idea again. Combined with raw, bass-hefty production that could make a bleeding-edge dubstepper weep, he's set to be a force to be reckoned with in the coming year. Read more on Last.fm",11512,41327,Soul P
b4acaad3-fdec-48aa-b5b4-8df13361b003,So', Read more on Last.fm,886,9371,inflow
ee3f3f84-e95f-4381-83b7-8165c022d760,Gradur,"Wanani Gradi Mariadi (born November 28, 1990), better known by his stage name Gradur, is a French rapper of Congolese origin from Roubaix, Hauts-de-France. He first gained recognition from a series of freestyles called Sheguey. He started as part of the rap band 59. Read more on Last.fm",73719,1448120,Niska
8837b875-3689-4646-b3fd-d8b53815c7a8,Lil Uzi Vert,"Symere Bysil Woods (born July 31, 1995, Philadelphia, USA), known professionally as Lil Uzi Vert, is an American rapper, singer, and songwriter. Characterized by their face tattoos, facial piercings, eccentric hairstyles, and androgynous fashion, their music is often defined by dark subject matters and imagery built on a melodic emo approach to trap.

They attracted mainstream attention following the release of their debut single ""Money Longer"" in 2016. Read more on Last.fm",2694002,421039099,Playboi Carti
f1d07f2d-e148-4605-bee0-0c86359aeacc,Vaze Haze, Read more on Last.fm,96,389,Young Ree$E
2baf3276-ed6a-4349-8d2e-f4601e7b2167,Playboi Carti,"Jordan Terrell Carter (born September 13, 1995), known professionally as Playboi Carti, is an American artist from Atlanta, Georgia. Known for his eccentric vocal style and fashion, he is considered an influential figure in modern hip hop and a pioneer of the rage microgenre.

Carti began his musical journey in 2011 under the name Sir Cartier — a twist on his last name, but also a reflection of his growing interest in fashion and luxury brands. He changed his stage name to Playboi Carti in May 2013 and joined Awful Records. Read more on Last.fm",2438179,765040341,Ken Carson
ad53f799-95f5-4b54-9092-edab47290ada,Koncept Jack$on, Read more on Last.fm,4977,162239,Big Kahuna OG
1815dc2e-dfc2-4874-8876-f7f9e4af0753,Quentin40,"Rapper from Acilia

 Read more on Last.fm",13535,314194,Gianni Bismark
37259c7d-9b23-4db5-99c9-2b2fff23df28,220v,"Two artists/bands share the same name:

1. Psytrance duo from Brazil. The members are Eduardo Souza (also known as Tactical Strike) and Victor Leti (V-Storm).

Brazilian project 220V aka Victor Costa is one of the most promising new artists in the psytrance scene today. In less than 3 years, his tracks have been released across the globe on the foremost psy labels in the world ,such as Mind control records France (home of Talamasca), Phantasm records UK Read more on Last.fm",4019,30497,Krome Angels
c65e3fcc-5c6c-4237-a23d-5bccc75e8262,SCH,"There are multiple artists by the name of SCH.

1) Sch (from Schwarzer, his real family name) is a French rapper from Marseille, of German descent. He blew up in 2015, after releasing his debut mixtape A7, reaching 30'000 sales by the end of the year. His first studio album, Anarchie, was released in 2016. THe second one, Deo Favente, came out in 2017. In january 2018 he created his own label Maison Baron Rouge. Later in 2018 he released a third album JVLIVS. Read more on Last.fm",107796,15308659,Laylow
d0c4f2b5-3a9a-4edc-8dd5-b4425e15c137,Movimiento Original, Read more on Last.fm,50189,1301695,ChysteMc
76f96ddf-1fc5-4650-b686-5828bae65e82,Makro,"'makro' is a duo of Filipino-American cousins based in Memphis, TN - Eric Makapugay and Kristoffer Ruaro. Their sound is heavily influenced by R&B but overall incorporates all types of genres. 
Follow the band's journey on social media @makromusicofficial Read more on Last.fm",2853,34641,Grind
b3ea5e4e-5f59-4e13-a873-1dc1e4c9da58,Q052, Read more on Last.fm,416,2104,Anachnid
4d01d0b5-98e4-4fea-bf68-41123d27abbc,MYKKA, Read more on Last.fm,1498,3995,Andrea Mir
b3fb1f9c-c003-41b8-9835-c92727c42509,Zaidbreak, Read more on Last.fm,2292,14149,Swit Eme
6ed69aba-7216-4114-83e0-bfc2f6cb81a7,Dolla Dame, Read more on Last.fm,1622,8612,Yhung T.O.
346ff43a-1ce1-405c-8b87-c7ea5b59a6e5,Stupid F,"STUPID F is a estonian MC, who's respected for his lyrics, powerful voice and energetic live shows. Many think that he's one of the best MC's rappin' in estonian language. With DJ HASH they work as a duo named STUPID F & HASH (aka ELEMENT), that has gained a lot of respect from estonian hip-hop heads. In addition Stupid F is also a producer and has made music not only for himself, but also for MC's like RASSAKAS, VORR POKSJORR, MÓRE and others. He's also a member of DEF RÄÄDU MASSIVE and the lead singer of JAM SESSIONS.  Read more on Last.fm",797,10765,Põhjamaade Hirm
b0c79856-a849-470c-8bd2-3a247ce1e7f4,Makassy, Read more on Last.fm,11762,63029,T2R
59aa4ee5-8ea1-464a-a5ed-3ab92702f86a,Checkmate,"There are several artists and groups named Checkmate
(For the standalone article for K-pop group CHECKMATE please go here:체크메이트):

1.) CHECKMATE (Hangul: 체크메이트)  is a South Korean co-ed group under GRACE COMPANY Entertainment. The group consist of 4 members: Sieun, Suri, Yongseok, and Noah. They debuted on September 21, 2020 with the single DRUM as a 5 member group that had Nason as part of the lineup. Nason left the group in November 2020 and was replaced by Haechang. Read more on Last.fm",17442,154633,Limitless
0f16ba6c-1874-42b9-b7a6-e060c2be454e,SAINt JHN,"In the words of SAINt JHN:

""Nobody needs to write a bio for me. This is stupid. My name is SAINt JHN, that's my real name, it's spelled a little different tho. I'm from Brooklyn, I spent half of my childhood growing up in Georgetown, Guyana. I was dirt poor in Brooklyn and some version of rich in Guyana, because apparently 2 nickles can buy you a sports car in a 3rd world country. Who knew?! I'm from a SUPER Christian household where my mom forced us to go to every church imaginable, EVERY, SINGLE, WEEK! I hated it. Read more on Last.fm",966598,21251630,6LACK
3b4b37c1-e8db-471b-99bd-e2a184869ac9,Jaloner, Read more on Last.fm,4241,140017,Santiuve
8032cf05-d916-4b2a-9c53-6e75d4a24bd8,Trippie Redd,"Michael Lamar White II (born June 18, 1999) professionally known as Trippie Redd, is an American rapper, singer, and songwriter from Canton, Ohio. He is known for contributing to the development of emo rap and rage, a subgenre of trap music.

Trippie Redd released his debut mixtape, ""A Love Letter to You"" (2017), through 10K Projects, which entered the Billboard 200. Its lead single, ""Love Scars,"" was certified double platinum by the Recording Industry Association of America. Read more on Last.fm",1859419,183773536,Lil Uzi Vert
f61c7cf5-bc99-4f80-ac9f-512c42bcbd8e,Side,"There are multiple artists called Side:

1)  Side were established in 2003 and working in the desert city of Beer-Sheva, in the south of Israel. The band’s music combines innovative electronic elements and warm harmonic rock sounds.

Side has seven members, including a bass guitarist, a drummer, two electric guitarists, an analog keyboard and laptop operator, another keyboard player who uses a synthesizer and operates special effects, and a soundman who also plays guitar. All band members sing backing vocals along with the lead vocalist. Read more on Last.fm",4196,16788,Mirko Grozny
3a8e388d-5e95-45d7-b1ab-52085cd2a17b,Mr. 2-17, Read more on Last.fm,1888,10478,Mr.2-17
cfebec9a-2042-45b2-9242-1b2275efc3f0,Dada,"There are at least six artists that use the name Dada: a '90s USA rock band, an English dance artist named Matti Schwartz, a '70s Japanese electronic band, and a short-lived Jazz-fusion band in 1970, MC/producer and Lithuanian rapper/

(1) Dada - USA rock band:
 
In 1992, Dada exploded on the scene with their critically acclaimed debut release Puzzle on Miles Copeland’s now defunct IRS Records. The single ""Dizz Knee Land"" set the alternative radio movement - just then hitting its stride - on fire Read more on Last.fm",94321,921343,Toad The Wet Sprocket
5f583334-3bd2-47e5-a712-fc9019761878,Hielo Beats, Read more on Last.fm,1248,11807,Charlie Hijos Bastardos
6b914bcc-0f3d-4443-8310-1e26ab07a236,ACRU, Read more on Last.fm,37065,1194295,Kamada
d2ad8774-9173-4970-8427-06b04df201c1,Venom,"Venom is an English heavy metal band formed in 1978 in Newcastle upon Tyne. Coming to prominence towards the end of the new wave of British heavy metal, Venom's first two albums—Welcome to Hell (1981) and Black Metal (1982)—are considered a major influence on thrash metal and extreme metal in general. Venom's second album proved influential enough that its title was used as the name of the extreme metal subgenre of black metal. However, Venom's later discography remained speed/thrash metal Read more on Last.fm",488122,16966859,Hellhammer
48262e82-db9f-4a92-b650-dfef979b73ec,Future,"Nayvadius DeMun Cash (born Nayvadius DeMun Wilburn), better known by his stage name Future, is an American rapper, singer, songwriter, and record producer from the Kirkwood neighborhood of Atlanta, Georgia.

After releasing a series of moderately successful mixtapes between 2010 and 2011, Future signed a major label deal with Epic Records and fellow American rapper Rocko's A1 Recordings, which helped launch his label imprint Freebandz. Future subsequently began working on his debut studio album Read more on Last.fm",3171840,449794315,Young Thug
a98827ce-0484-4ae5-a1f1-8e7750c087e4,Jay Romero, Read more on Last.fm,4908,40445,Neto Peña
7a9ba401-50d8-4383-9012-be201d58766f,Smoke,"There are many artists performing under the name Smoke. 


1) A widely acclaimed band from Atlanta, USA. During their brief existence the band never rose above local cult status, but following lead singer/writer Benjamin’s death in 1999 critical appreciation of the band grew substantially. The band enjoyed the vocal support of rock luminaries such as Patti Smith and Michael Stipe. Following his death Benjamin was the subject of an award winning documentary “Benjamin Smoke” which chilling profiled the tortured life of the artist. Read more on Last.fm",59708,416098,Nebula
9689aa5a-4471-4fb4-9721-07cecda0fa9f,A Tribe Called Quest,"A Tribe Called Quest was an American hip-hop group formed in St. Albans, Queens, New York, in 1985, originally composed of rapper and main producer Q-Tip, rapper Phife Dawg, DJ and co-producer Ali Shaheed Muhammad, and rapper Jarobi White. The group is regarded as a pioneer of alternative hip hop music.

In 1991, the group released its jazz-influenced second album, The Low End Theory, regarded for helping shape alternative hip hop in the 1990s. In 1998 Read more on Last.fm",2447402,109688865,De La Soul
ba0fc370-3414-4009-82f8-fdf4c67c7584,Yantz, Read more on Last.fm,392,4690,Casper Locs
22889d97-2f5a-4984-9daa-0540ee0141a7,ZetaZeta, Read more on Last.fm,4170,75509,Zof ziro
