mbid,artist,bio,listeners,playcount,similar_artist
ec537684-67ef-45a5-a783-74f913e8e01a,Ruelle,"Maggie Eckford (born c. 1986), better known by her stage name Ruelle, is an American electronic pop singer-songwriter. Her music is widely used on many television series, and she is the singer of the opening theme songs of Shadowhunters (""This Is the Hunt"") and The Shannara Chronicles (""Until We Go Down"").

Born the middle child of three sisters to a trucker in Mississippi, Ruelle was raised on a dairy farm. She attended music school in Sydney, Australia. Read more on Last.fm",497989,8603529,Fleurie
6c248dbb-f6ae-41dc-8f89-71e2b0e3e3de,Icaki, Read more on Last.fm,416,9953,Novem
5a42040d-2ae5-4e2a-a362-22e7b19d993c,Smokepurpp,"Omar Pineiro (born May 15, 1997), known professionally as Smokepurpp (or Purpp), is an American rapper from Miami, Florida. Pineiro released his first music video ""It’s Nothin"" with Lil Ominous on September 23, 2014. Pineiro initially found success on the audio distribution platform SoundCloud in 2016. 

His earliest songs on SoundCloud date back to July of 2015. Popular associated acts include Lil Pump, XXXTENTACION, and Swaghollywood.

Smokepurpp and Lil Pump perform often together as Gucci Gang. Read more on Last.fm",455173,9974812,Lil Pump
41acb83d-394a-453c-936b-8d6d5098bfdd,Ours Samplus,"Ours Samplus is a duo of producers from France. They make chillout/Trip-hop music from sampling Jazz and adding an electronic twist. Trip-Hop, Electro Hip-Hop, Jazz, Instrumental.  Read more on Last.fm",102254,1735032,Boztown
9ac81498-7b2d-42a5-9795-72da9d1eb6fb,Sabino,"Guadalajara, Mexico. ""El estilo de Sabino funciona de maravilla con gente que no necesariamente quiere tener un iPod de rap 24/7. Es un rapero que sabe ser elocuente sin clavarse en la textura, es gracioso sin hacerse el chistoso y en general suena fresco, con una lectura puntual de la vida cotidiana en sus letras, la cual funciona como espejo para una gran mayoría de personas que lo escuchen. Y que no es cosa fácil."" Noisey Music by Vice Read more on Last.fm",60369,2763673,Tino El Pingüino
7e2012a4-2752-46c1-90b8-f48f3fa43412,Kaydy Cain,"Daniel Gómez Carrero (Dani Gómez; born 12 February 1990), known professionally as Kaydy Cain, is a Spanish rapper and former member of the music group Pxxr Gvng (pronounced as poor gang; later known as Los Santos). He is recognised for his original style and his contributions to the explosion of the genre trap in Spain.

Dani Gómez began his artistic journey in the 2010s as a member of the trap group Pxxr Gvng, with which he was able to turn his life around thanks to the popularity that hip hop began to enjoy in Spain Read more on Last.fm",92988,4006724,Yung Beef
4168d745-0072-4657-be4e-e355665414b1,Lil Supa,"Marlon Morales, mejor conocido en la movida cultural del hip hop como Lil Supa o “Lil Zoo”, nace en 1985 en Caracas, es un cantante, compositor, breakdancer y escritor venezolano.

Inicios de Lil Supa en la Música:
Para el año 2000, comienza sus primeros pasos en el movimiento en el 2000 con el breakdancer y el graffiti en proyectos junto a la banda “Niggaz Feel Da’ Hood”. Con esfuerzo y experiencia forma junto a Dann Niggaz y Afromak “Supremacy Hip Hop Clan”. Read more on Last.fm",43405,2206554,Akapellah
a28499fa-6ec4-40f3-bc8f-e5481c02ecb0,Tacit, Read more on Last.fm,3423,21724,Zolarium
2114beff-3ca3-4d96-b268-fb5dd5c640c7,Dirty Porko, Read more on Last.fm,5921,106714,Matasvandals
4db5a9a8-42bc-4c9e-812b-067cbab04db7,Jon Z,"Jonathan Resto, también conocido como Jon Z, nació el 20 de mayo de 1991 en San Juan, Puerto Rico. ... En realidad, Jon Z eligió su nombre artístico como un homenaje a su madre, cuyo nombre es Nancy. ""Cy"" en español sueña similar a la letra ""Z"" en inglés. Su primer álbum, ""The Game Is About to Change"", fue lanzado en 2015. Read more on Last.fm",119234,2177858,Ele A El Dominio
e6fdf3f9-8077-4126-b0cf-94da9a8b627e,Lil Tecca,"Tyler-Justin Anthony Sharpe (born August 26, 2002), known professionally as Lil Tecca or Tecca, is an American rapper, singer and songwriter. He gained recognition upon releasing his breakout single, ""Ransom"", which has amassed over 1 billion plays on Spotify and peaked at number four on the Billboard Hot 100. 

Tecca first gained traction during an early 2018 beef with Toronto rapper ""Lb Spiffy"" after Lb accused Tecca of stealing his flow on the track ""Callin"". Read more on Last.fm",1742450,156441639,Don Toliver
cbff85ee-41eb-4e25-8925-11ad1683d034,Achille Lauro,"There are at least two artists who perform under the name ""Achille Lauro"":

1. Achille Lauro (stage name of Lauro De Marinis, born in Verona in 1990) is an all-round Italian artist. Since 2012 he has released numerous works, going through different music genres and experimenting new ones, such as Samba Trap and jazz. In 2019 and 2020 he participated at the Sanremo Festival, respectively with the songs Rolls Royce and Me ne frego. In 2022 he won Una Read more on Last.fm",88688,2794163,Rkomi
8ed3a829-c678-44de-89e9-6a13566b4a6a,B.I.G,"There are more than one artist using the name B.I.G.

1) B.I.G (Hangul: 비아이지; an acronym for Boys In Groove) is a five-member South Korean boy band under GH Entertainment. The group consists of J-hoon, Gunmin,  Heedo and Jinseok.
Gunmin is currently part of the group NIK.
Benji left the group in 2020, in 2021 Minpyo announced that he has left the group as well.

2) Dimos and Michalis Siavelis, 29 and 27 years old respectively, started off with the best possible foundations Read more on Last.fm",21052,258534,Boys Republic
f086a769-59d7-43b3-a6d8-9c59152c7101,Frank Takuma, Read more on Last.fm,4537,35225,ALI aka MIND
58471fdf-59b6-46ed-9816-8ce8b8609bff,Aerophon, Read more on Last.fm,8687,110968,ALI aka MIND
7af2ae9c-fb88-45e0-8ce4-e5d902a688f4,FERNANDOCOSTA, Read more on Last.fm,27665,1202871,Natos y Waor
be7dca06-dd2d-4098-a6a1-38392140819a,Skinny Stylus, Read more on Last.fm,487,3650,Danase
1555664b-5198-4ec2-b6c5-41a9214b7e74,Illinformed, Read more on Last.fm,19612,126443,Smellington Piff
6cab2891-be30-4957-a0b3-243e2fca27c4,DrefQuila,"Chilean rapper that with the use of Autotune and synthesisers blend their voice, using pre recorded reggaeton tracks, in what it's known as ""Latin Trap"". Read more on Last.fm",77159,4055359,Young Cister
0b68575e-aad9-42d4-a4d8-13f914531fb6,Bohemia,"There are at least three artists with this name:

* The first is a Pakistani-American rapper:

Roger David (Punjabi: راجر ڈیوڈ), better known by his stage name Bohemia is a Pakistani-American rapper, singer, songwriter and record producer. Bohemia was born in Karachi, Sindh and received his education in Peshawar, Khyber Pakhtunkhwa. At the age of 13, he moved to the United States with his family.

In his early teens, Ra (short for Raja) arrived with his family in America, settling in San Francisco’s Mission District. Read more on Last.fm",26113,358421,Blue Effect
ea3bf2aa-7311-4372-9289-f3fec8f12759,Killer Kamal,"Killer Kamal (also known as Kamal) is a dutch rapper from Eindhoven, the Netherlands. Killer Kamal is best known for his collaborations with Youssef (Youssef & Kamal) and Gino Pietermaai (Gino Pietermaai & Killer Kamal). Read more on Last.fm",22540,468375,Braz
89fe777e-8d33-411d-9fe9-027f67c1e8f1,Bryant Myers,"Bryan Robert Rohena Pérez, known professionally as Bryant Myers, is a Puerto Rican Latin trap and reggaeton singer and songwriter. Rohena was born in Loma Alta, Puerto Rico. He began sampling and making his own songs in 2013 and launched them on social media via his SoundCloud, Instagram and YouTube accounts. Read more on Last.fm",196636,7093031,Anuel AA
f6beac20-5dfe-4d1f-ae02-0b0a740aafd6,"Tyler, The Creator","Tyler Gregory Okonma (born March 6, 1991) also known as Tyler, The Creator, is a Grammy award-winning American rapper, singer, record producer, director, fashion designer, and the head of his independent record label, Odd Future Records. He was the leader of the now-defunct Los Angeles, California, USA hip-hop collective Odd Future Wolf Gang Kill Them All (OFWGKTA). Since his first recordings had debuted on The Odd Future Tape in 2007, he had rapped on, and produced for, nearly every OFWGKTA release.  Read more on Last.fm",4255100,1027180546,OFWGKTA
0f9a04f0-ac4b-4a92-9cc4-5c5dbee7759c,Red Shaydez, Read more on Last.fm,220,1441,oompa
1f1a47d4-0167-4ed1-983e-acc40cee4881,Boef,"Sofiane Boussaadia (Aubervilliers, 28 februari 1993), beter bekend als Boef is een Nederlandstalige rapper en vlogger met de Algerijns-Franse nationaliteit.[1]

Binnen een jaar na zijn start in 2015 behoorde hij na Lil' Kleine en Ronnie Flex tot de populairste rappers van Nederland.[2] Hij bracht een album uit en verschillende singles. Zijn vlog en rapvideo's werden vele miljoenen malen bekeken op het internet. In 2020 kreeg hij zijn eigen documentaire: Gewoon Boef. Read more on Last.fm",70698,3636143,Josylvio
0bdedd71-038a-4bf9-94d5-c5a8ce4e1b21,Raj,"1.Raj is a producer and DJ from an unknown location. His most recent releases have dealt mostly in ambient sonics.

He releases his music and mixes for free from his Bandcamp website: http://rajsonic.bandcamp.com.

He updates a Tumblr regularly with inspiration: http://rajjj.tumblr.com.

2. RaJ are an acoustic folk duo from Scotland http://the-musical-stylings-of-raj.bandcamp.com/ Read more on Last.fm",35294,113291,Huez
6604167b-3d45-4a38-9371-712703175cb1,Pouya,"1) Kevin Pouya (born December 20, 1994), simply known as Pouya, is an American rapper that comes from the South Florida underground scene. He grew up in Kendall, Florida near Hialeaha. He is one of the 3 founding members of Buffet Boys (2011-2022), as well as one of the owners of the ALL BUT 6 record label, collective, and clothing brand.

Known for his collaborations with New Orleans group, $uicideboy$, and other rappers, such as, Fat Nick, Shakewell, Ghostemane, Ramirez, KXLLSWXTCH and Robb Bank$. Read more on Last.fm",548946,24748967,$uicideboy$
59bc1ba2-ce50-4c2c-985b-0502b281f19a,Miky Woodz,"Miguel Ángel Rivera Rodríguez, known as Miky Woodz, is a Puerto Rican Latin trap rapper born in Carolina, Puerto Rico. To date, Woodz has released two studio albums, Before Famous in 2017, and El OG in 2018, which were both commercial successes. Read more on Last.fm",70001,1187045,Bryant Myers
2c74aaa4-b7d0-4ee1-8249-f389c330ca16,Iva Lamkum,"Close your eyes and imagine yourself in street soul heaven listening to a rootsy, soulful and unique voice. Now open your eyes and meet Iva Lamkum – this outstanding 22 year-old Wellington singer/song writer is bursting to make an impression on the NZ music scene.

Born a Kiwi, Iva has New Zealand, Samoan and Chinese blood running through her veins. She is the complete package who pens lyrics and finds melodies that match her soulful sounds, beliefs and original sense of fashion. Read more on Last.fm",2096,17110,Hollie Smith
1d77b0c4-c395-4106-8e72-db3ea03740d7,Wet Bed Gang,"Gson, Kroa, Zara G e Zizzy são os Wet Bed Gang, colectivo de Vialonga, já uma das principais referências do hip hop português com milhões de streams das suas músicas e centenas de concertos um pouco por todo o mundo português.

“Ngana Zambi”, é o nome do primeiro álbum da banda, e como diz o narrador do disco, o icónico Bonga, representa “A entidade que abrange todo o conhecimento do ser, da criação, da potência, das originalidades, de tudo o que faz parte da humanidade. Read more on Last.fm",25858,1394342,Dillaz
09a7cf5c-3042-4ee9-b1e4-44e9525f1a66,MACHETE,"There is more than one artists using the name - not to be confused w/ The Machete (Finland thrash metal band).

1) An hip-hop Italia crew composed by Salmo, Slait, Hell Raton, Nitro, Dani Faiv e Jack The Smoker.

2) An upstate NY band that employs deep swelling synthesized bass with the raw energy of classic punk and new wave… The sound runs the gamut from heavy punk to dark pop without alienating either crowd. Their debut album is ""Too Weird To Die"". Read more on Last.fm",61770,2097447,Mace
b87b38cc-b446-4a0c-968a-addb0e244c9d,Kreayshawn,"Natassia Zolot, better known by her stage name Kreayshawn, born September 24, 1989 in Oakland, California, United States, is an American hip hop singer-songwriter and up-and-coming music video director who rose to fame in 2011 (but has been active since 2008) with the release of her single, ""Gucci Gucci"", a rap anthem describing Zolot's disdain for designer labels. According to the Gucci Gucci Songfacts, the video generated nearly three million views Read more on Last.fm",512893,7416411,Lil Debbie
381086ea-f511-4aba-bdf9-71c753dc5077,Kendrick Lamar,"Kendrick Lamar Duckworth (born June 17, 1987) is an American rapper. Regarded as one of the most influential hip-hop artists of his generation, he was awarded the 2018 Pulitzer Prize for Music, becoming the first musician outside of the classical and jazz genres to receive the honor.

Born in Compton, California, Lamar began releasing music under the stage name K.Dot while attending high school. He signed with Top Dawg Entertainment (TDE) in 2005, and co-founded the hip hop supergroup Black Hippy there. Read more on Last.fm",5023800,1010480682,Baby Keem
8ab5d936-49d1-415e-92c8-151e0e7dd912,A$AP Ferg,"Darold Ferguson, Jr. (born October 20, 1988), better known by his stage name ASAP Ferg (stylized as A$AP Ferg), is an American hip hop recording artist from New York City's Harlem neighborhood. He is a member of the hip hop collective A$AP Mob, from which he adopted his moniker. In January 2013, Ferg signed a solo record deal with Polo Grounds and RCA, the same labels that helped launch A$AP Worldwide, when Ferg's A$AP Mob cohorts ASAP Rocky and ASAP Yams, negotiated their own respective deal in 2011. Read more on Last.fm",1605753,41663421,A$AP Mob
a4d62ced-2f87-488a-9c76-ab88ea7a2cbf,Pharoahe Monch,"Monch released three albums as part of the rap duo, Organized Konfusion with partner Prince Po: The self-titled Organized Konfusion, Stress: The Extinction Agenda, and The Equinox. The duo handled a large amount of production on these albums themselves. All albums received positive critical reviews, but moderate sales. As a result, the duo split up after recording their final album The Equinox in 1997. Prince Poetry has since denied the possibility of an Organized Konfusion reunion. Read more on Last.fm",542320,6289047,Organized Konfusion
776dbbce-25aa-411e-b344-ac9067d39f17,SiR,"SiR (born Sir Darryl Farris on November 5th, 1986) is an American singer, songwriter and record producer from Inglewood, California. He is currently signed to Top Dawg Entertainment and has released four studio albums; ""Seven Sundays"" (2015), ""November"" (2018), ""Chasing Summer"" (2019) and ""HEAVY"" (2024). Read more on Last.fm",795521,21269753,Lucky Daye
c752331c-d854-4e61-af3d-745c73af0cc5,Versatile,"There are at least three artists with this name. 

Versatile is also a band from Barcelona, founded in April 2005, after a meeting between Dani Dòriga and Sergi Cameron, connected by Eliana Martínez. In 2006 they recorded their first demo Versatile Magic Experience, it brings them to win prizes like Embrió 2006 in Bocanord and the second prize in the spanish national contest ""U-play"", organized by Sennheiser & Hard Rock Café. In 2008 they self-produce their first LP “La Habitación de la Luz”. Read more on Last.fm",38239,571078,...and Oceans
f7fe9407-46a8-4388-b742-e9bd43c5663e,Tanaya Winder, Read more on Last.fm,64,424,Frank Waln
bdda248b-7517-44d1-90c2-d442ef48f951,Brianna Perry,"Brianna Perry (born January 11, 1992), also known as Lil' Brianna, is an American female rapper from Miami-Dade County, Florida. She was the youngest act signed to Missy Elliott's label The Goldmind Inc. and affiliated with Slip-N-Slide Records, home to rappers Trina and Rick Ross. Perry made her debut on Trina's album Diamond Princess on the track ""Kandi"". Since then, she has released six mixtapes, four mainstream singles and various viral freestyles.

 Read more on Last.fm",3747,35295,Nyemiah Supreme
a466063b-24a6-4235-bc95-352c93d8ce47,Hard GZ, Read more on Last.fm,27112,1316026,Arce
11f4adc5-afc5-4b6b-b6dd-f2c0aeb578f4,Summer Cem,"Cem Toraman, born on April 11, 1983, and better known as Summer Cem, is a German rapper of Turkish descent. He gained recognition through frequent collaborations with other prominent artists, including KC Rebell and Eko Fresh. Summer Cem has released several successful albums, with three reaching the top of the German albums chart: his solo album Cemesis in 2016, and the joint albums Maximum with KC Rebell in 2017 and Endstufe in 2018.

Summer Cem was born to parents from Malatya, Turkey, and grew up in the Rheydt district of Mönchengladbach. Read more on Last.fm",144206,4523578,KC Rebell
c1c53ef7-213c-4d4b-9953-68dc0f9f8e7a,Jul,"Julien Mari (born January 14, 1990 in Marseille)  better known as Jul (/dʒuːl/, stylized as JuL)  is a French rapper who released three albums in 2014, his debut Dans ma paranoïa on the independent Liga One Industry label on 24 February 2014, followed by Lacrizeomic and Je trouve pas le sommeil. All three have reached the French SNEP official albums chart. Read more on Last.fm",196352,16639979,Naps
e662ea36-81bf-4840-a143-cbbf8b2a74eb,ECKO,"Ignacio Matías Spallatti, better known as Ecko, was born on June 7, 1999 in La Matanza, Buenos Aires province.

He was dabbling in freestyle, trap, rap and reggaeton, until giving his first shows around the country.

He attended rap battles, winning the best competitions and earning 3rd national place in the Red Bull Battle of Roosters. Meanwhile he recorded some songs, among them ""Dealer de Skilles"", ""Disputa"", ""Cash"", and ""Legend"".

On December 14, 2017, “Dorado” was released, a single that positions it as a reference in the genre. Read more on Last.fm",54272,690122,Callejero Fino
18e2ddb9-5ff2-4e15-a0da-df8b6e7e80d3,Foxx,"There are at least four artists by the same name:

1. A rapper from Baton Rouge, LA. Signed to Trill Entertainment, the label fronted by Webbie and Lil Boosie. “Wipe Me Down is a movement,” says Foxx who notes himself as the ‘last to sign, but the first of his kind’. “This is some different shit for Trill but we bringin’ all kinds of shit from under the table. We hit-makers and that’s the bottom line.”

The music described as a street version of Southern funk differs from the neighboring New Orleans bounce Read more on Last.fm",78440,295230,C-Loc
c458e9dc-e0d5-45ea-9e83-f9d0395f030d,Nicky Jam,"
Nick Rivera Caminero better known as Nicky Jam was born to a Puerto Rican father and a Dominican mother in 1980 in Boston Massachussets which he live in until he was six and moved to 
Barrio Obrero, P.R. He is a reggaeton artist known for hits like:
""Me Voy Pa'l Party"" ""Chambonea"" 
""No Soy Tu Marido"" ""I'm Not Your Husband"" which is a remix in spanglish of ""No Soy Tu Marido""
 Read more on Last.fm",1045454,15397646,Ozuna
530a9937-4229-4d7e-8457-4853d7d5dd7a,Soolking,"Abderraouf Derradji (Arabic: عبد الرؤوف درّاجي‎; born 10 December 1989), known professionally as Soolking, is an Algerian singer and rapper. He started his career under the pseudonym MC Sool until 2013 before adopting his new stage name. He incorporates reggae, soul, hip hop and Algerian raï in his music. 

Derradji was born in Algeria in a northern suburb of the capital Algiers, also known as Stouali . His father was a percussionist and he started very young in a rock band incorporating music and dance. Read more on Last.fm",183636,4412386,Khaled
9eafb740-6ad7-4cdb-97fb-2601fbef794f,La Maravillosa Orquesta del Alcohol,"According to the legend, this peculiar band was created in Grafton Street, one of the main streets in Dublin, where musicians from all over the world meet to make a living by playing alive. Joselito Maravilla (accordion) and Maravilloso David (main vocals, guitar) met over there.

After some months playing on the streets, they decided to come back to Spain and start up a band mixing traditional music (Irish, American and Slavic), rock&roll structures and the most classic blues. Read more on Last.fm",46944,1998061,Xoel López
45bcfb74-6d35-427f-b581-22aa62e3b383,PB, Read more on Last.fm,2364,33935,Maycash
b8be605b-40b5-40ed-b93b-38249fcac935,Porto,"There are at least two acts under the name Porto

Porto is the solo project of Richard Ribeiro (Debate, Diagonal, São Paulo Underground). His debut EP, Fora de Hora, was released in 2009. Ribeiro plays both drums and metalophone on Fora de Hora, as well as having arranged the electronic beats and bass. Renato Rebeiro features on guitar. 

Porto is also an acoustic / progressive rock band out of Wallingford Connecticut. They have released at least 2 eps and at least one full length album under the title ""Nemesis. Read more on Last.fm",3917,28067,São Paulo Underground
96a83a1f-f78f-4f1c-bf89-9b8dd3d91872,Logic,"Sir Robert Bryson Hall II (born January 22, 1990), known by his stage name Logic, is an American rapper, producer, and author.  Raised in Gaithersburg, Maryland, Logic developed an interest in music as a teenager and ventured into a musical career in early 2009 releasing Logic: The Mixtape under the name ""Psychological"", and releasing a mixtape titled Young, Broke & Infamous in 2010. He signed with Visionary Music Group, before releasing three more mixtapes over three years. Read more on Last.fm",1713464,103637901,Cordae
63019469-e1f5-488c-9e6f-f16661a77ea8,Öökülm,"Öökülm is a hip-hop group from Rakvere, Estonia. The band consists of beatmaker and producer DJ Melkker and MC Lord. Öökülm released its debut album Välk selgest taevast (""Like a Lightning out of Clear Sky"") under Estonian premier alternative label Lejal Genes in fall 2007. The album was critically acclaimed, gaining positive reviews from major Estonian reviewers.

""Viskit"" (""Whiskey""), a punk and rave influenced track from the album ""Välk Read more on Last.fm",2042,41342,Toe Tag
0cabab36-b982-4893-b989-380fcae41b17,Icee, Read more on Last.fm,1242,6522,Baby Boy Ene
5acc7893-7ee2-42e6-9e24-73506c70cb23,Grind,"More than one group is listed as 'Grind'.

After the unfortunate breakup of Jailhouse in the early 90's, Danny Simon started to hatch the plans for his new project entitled GRIND in 1993. Recruiting WARRIOR bass player Kelly Pattrik,  FEMME FATALE  drummer Bobby Murray and eventually coming across his soon to be best friend, guitarist and songwriting partner Greg Leslie -  the band was set to reclaim a piece of the Sunset Strip magic.  

Deriving influence from the great bands of the 70's Read more on Last.fm",14043,284209,Astray
1e28971a-b892-4b9f-82bc-a591244fe436,AMBKOR, Read more on Last.fm,12616,416920,Rafa Espino
3cef89c4-efca-4160-8741-82999cf5ee56,Eligh,"In first grade, at a friend's birthday party, Eligh and the rest of the kids watched a movie called ""Beat Street."" The movie made quite an impression and inspired Eligh to make a trip to his local record store where he picked up LL Cool J's ""I'm Bad."" After one listen, he knew what he wanted to do. The year was 1985. Eligh's first official step into the hip-hop world was under the name lower m.c. and his first crew was the Boogalu Badboys with his friend Scarub. Read more on Last.fm",35781,591996,The Grouch & Eligh
61b0dcce-1483-4c25-8c23-e1b489e32b3d,Desloc Piccalo, Read more on Last.fm,2536,12888,Unda Surveillance
26895123-efb1-4b0b-9868-9fc2138d46b6,Poldoore,"Cutting that soul, funk and jazz into atmospheric instrumental hip-hop, Thomas Schillebeeckx is the production stature behind Poldoore. Spending parts of his youth in the US as well as in Belgium, Poldoore quickly found himself making beats. With his ears both in old and new, he carved out his own distinctive, melodic sound. When in his late teens, his productions caught the eye of L.A.-based label Cold Busted, signing him for various releases and two full-on albums. Read more on Last.fm",168064,1546228,Akshin Alizadeh
33bdaf85-f604-49a5-8ccb-6f57ee1ff0f5,Bo,"There are various artists with the name Bo.

1. Bo is a greek hip-hop artist.

2. Bo is a UK DJ/Producer from West Yorkshire, specializing in Bassline 4x4 and house music. 

From a young age Bo realised he had a huge interest in music. Producing started for Bo at the age of 20 when he managed to get hold of the software ‘Reason'. He began making grime music in his spare time, with most of the music talent around him being mc's he wanted to produce, and attempt to establish himself in the bassline/house scene. Read more on Last.fm",17911,207022,Erin
44e5f152-3c1e-4492-bae9-b682d7a27a76,YG,"Keenon Daequan Ray Jackson (born March 9, 1990), is an American rapper better known by the stage name YG (an initialism for Young Gangsta). In 2009, he released his debut single, ""Toot It and Boot It"", featuring Ty Dolla Sign, which peaked at number 67 on the Billboard Hot 100.[1] The single's success resulted in him signing to Def Jam Recordings.[2] In the following years, YG released various mixtapes such as The Real 4Fingaz and Just Re'd Up 2 among others. Read more on Last.fm",1208174,22570478,Nipsey Hussle
43800897-443f-41ff-a680-886b10f1c081,TBF,"There are at least two bands named TBF:

1) TBF (The Beat Fleet) is a Croatian hip/hop band from Split,Croatia. The band was founded in 1990. Members of the band are: Mladen Badovinac (vocal, samples), Luka Barbić (vocals, keyboards, samples), Aleksandar Antić (vocals, lyrics, samples, harmonica), Ognjen Pavlović (bass guitar), Nikša Mandalinić, (electric guitar), Janko Novoselić (drums).

They are heavily influenced by reggae, the British trip-hop scene, electronic and experimental music. They have 6 albums. Read more on Last.fm",18936,746817,Dječaci
