mbid,artist,bio,listeners,playcount,similar_artist
100b8734-f4f0-4536-9960-47f7c59d1b4c,Gunna,"Sergio Giavanni Kitchens (born June 14, 1993), known professionally as Gunna, is an American rapper, singer and songwriter. Best known for his collaborations with Young Thug and Lil Baby, he is signed to Thug's record label, YSL Records, as well as 300 Entertainment and Atlantic Records.[2] He released his debut studio album, Drip or Drown 2 on February 22, 2019 and followed it up with his second studio album Wunna on May 22, 2020, which debuted atop the Billboard 200.[3] Read more on Last.fm",1779003,176439461,Lil Baby
b1ea248b-ca18-47b9-a875-ef54c2c37d48,Bartofso, Read more on Last.fm,18896,376820,De Fellas
8c84a9f3-75ac-487f-abad-d883e40e6f59,Landro, Read more on Last.fm,2086,12444,Ab Arel
d0612291-74a8-45bb-afa2-119c35d4515d,Xhelazz,"Xhelazz is an MC from Zaragoza, Spain. He gained some popularity opening for Violadores del Verso, labelmates from Rap Solo and one of the most important hip hop bands from Spain. Read more on Last.fm",16310,308311,Falsalarma
3d0030eb-d054-41f9-b5b2-f6456ccc023b,Nito NB,"UK drill rapper Nito NB hails from gang ""156"" which beef sets from ""1011"" and ""Rayner's Lane"". He started on to drill in mid 2017 with banger ""Drilling"" with association by MadMax. With his potential in the drill scene, he has grew a fan base with his hit song ""Next Up"" on Mixtape Madness following with a ""Mad About Bars"". He also grew with legendary UK drill songs ""Rise & Tan"" and his ""Lightwork Freestyle"". Since then, he has improved his craft with every new songs and made bangers such as his ""Plugged In"" with Fumez Read more on Last.fm",67137,995330,SR
3e251abc-b265-4d24-8785-8280daf71b02,Ansa,"Ansa ist ein österreichischer Rapper. Seit 2006 ist er als Mitglied der Hip-Hop-Gruppe Die Vamummtn bekannt. Im Frühjahr 2010 kündigte er das Album Niedaschlog an, das er mit dem Rapper MOZ aufnahm. Dieses erschien am 5. Mai 2011 und stieg in die Ö3 Austria Top 40 ein.[2] Anfang 2014 veröffentlichte er sein erstes Soloalbum „Ansa unta Millionan“, mit dem er Platz zwei in den österreichischen Charts erreichte. Read more on Last.fm",3896,54450,mojapołowa
e0c845f0-395c-452a-9ab6-16d766e2a844,Lady J,"Lady J is a rapper from Detroit, Michigan who is signed to Drop Muzik.

Her debut mixtape ""The People's Choice"" was released in 2009.  The mixtape featured mainstream rap artists such as Gucci Mane, Plies & Trey Songz as well as Detroit rap artists such as Chedda Boy Malik, Big Herk & Nefu Da Boss of The ABF.

The People's Choice was relased on Datpiff.com for a free download and released an offical video for her single ""Rain Money"". Read more on Last.fm",728,3431,Rich Ken
031bc934-28c9-491a-8648-c078450187dc,Action Bronson,"Ariyan Arslani (born December 2, 1983), better known by the stage name Action Bronson, is an American rapper, writer, chef, and television presenter. In August 2012, he signed with Warner Bros. Records, but was later moved to the Atlantic Records-distributed label Vice Records.

Arslani hosts a talk/variety show The Untitled Action Bronson Show, as well as his travel program Fuck, That's Delicious, on Viceland. His frequent collaborators Meyhem Lauren, The Alchemist, and formerly Big Body Bes are regulars on both of his television series. Read more on Last.fm",807412,25873151,Action Bronson & The Alchemist
87ae83df-6173-40cc-a0f2-bad543faa6aa,DaBaby,"DaBaby was born Jonathan Kirk in Cleveland, Ohio in 1991. By age six, he'd relocated to Charlotte, North Carolina and spent his adolescence engaged in street life. In December 2014, Kirk made a quick decision to become a rapper, taking the name Baby Jesus and issuing his NonFiction mixtape a month later. Never having been on a stage before, he headed to South by Southwest in the spring of 2015. Kirk changed his name to DaBaby, going so far as to explain the ""political reasons"" for this decision in the lyrics to ""DaBaby (Intro) Read more on Last.fm",1466801,54055455,NLE Choppa
859d0860-d480-4efd-970c-c05d5f1776b8,Beyoncé,"Beyoncé Giselle Knowles-Carter  (born September 4, 1981 in Houston, Texas, USA) is an American singer, songwriter, businesswoman, and actress. Beyoncé performed in various singing and dancing competitions as a child and rose to fame in the late 1990s as the lead singer of Destiny's Child, one of the best-selling girl groups of all time. Beyoncé herself is the best-selling black female musician of all time and second best-selling female artist of all time, behind only Madonna. Read more on Last.fm",6322308,686725671,The Carters
36a3343f-10cd-4c78-a016-47a41903b55c,Козачок, Read more on Last.fm,764,7944,Джон Дір
d7059bb3-511e-4758-a573-92ea64b1156a,Y2, Read more on Last.fm,7822,71284,J.Blaze
77faf2bf-9627-4349-a5c5-8227101a39be,Sleazy F Baby, Read more on Last.fm,1299,10489,Cult of the Damned
b0ca0d85-24a8-4a00-860d-357ff688b69c,Bootsy Collins,"William ""Bootsy"" Collins (born October 26, 1951 in Cincinnati, Ohio) is a pioneering funk bassist, singer, and songwriter. Bootsy was instrumental in Parliament and Funkadelic together with George Clinton and Bernie Worrell. He is well known as one of the founding members of the 'P-Funk' sound. He also played a major part in resurrecting James Brown's career in the late 60s and early 70s, co-writing some of Brown's greatest hits along with his brother, Phelps ""Catfish"" Collins. Read more on Last.fm",368057,2929117,Parliament
12398bf3-1b99-47b7-930c-f3956773f35a,Aminé,"Adam Aminé Daniel, better known as Aminé, is an American rapper. He was born and raised in Portland, Oregon. He released his debut album Good for You on July 28th, 2017.

On January 17, 2014, Aminé released his debut mixtape, Odyssey to Me. On September 4, 2014, Aminé released his debut extended play (EP), En Vogue. On August 31, 2015, Aminé released his second mixtape, Calling Brío. 
On March 9, 2016, Aminé released his debut single, called ""Caroline"". Read more on Last.fm",1471238,62580273,Smino
a4ab6bb1-2b7e-4d5f-bad6-dcd6b6daa5d6,Djadja & Dinaz, Read more on Last.fm,55204,3092307,Ninho
fde950c1-452d-44e8-94c3-de4c503fcfc7,Mayo 214, Read more on Last.fm,8417,266096,Blanco 43720
38474d18-9204-4f60-a137-1fcc6750b869,Skepta,"Joseph Junior Adenuga, better known as Skepta, is an English Grime MC from Tottenham, North London, England. Originally from and born to Nigerian parents he moved from Lagos to London aged three. His family history can be traced back further to Ethiopia, to the Falash Mura community. He is a producer and DJ commonly associated with the North London Grime scene, including Roll Deep and Boy Better Know. 
The name ""Skepta"" originated from the word Sceptre, a type of staff. Read more on Last.fm",1022555,38149166,JME
965c6053-0bfb-42c1-97e7-84b34218ac53,Super Yei, Read more on Last.fm,132419,1650508,Brytiago
87a75fc3-59e7-4598-925c-8e230bce5db9,Anuel AA,"Emmanuel Gazmey Santiago, known professionally as Anuel AA, is a Puerto Rican rapper and singer, a pioneer of the Latin trap movement. Gazmey's music addresses topics such as street life, violence, sex, and drugs. He is seen as a controversial figure in the Latin music scene for his legal troubles and feuds with fellow Puerto Rican rappers Cosculluela and Ivy Queen and with American rapper 6ix9ine.  His music often contains samples and interpolations of songs that were popular during his youth. Read more on Last.fm",604735,33047897,Bryant Myers
f65f3578-bdb3-42a2-b40c-f78d5ebeb797,RKO, Read more on Last.fm,249,1510,ameba.
d5651d1a-6ddd-4650-96fc-0e475d77862d,Rilès,"Rilès Kacimi, born 4 January 1996, better known by his stage name Rilès, is a French rapper, songwriter, composer and record producer from Rouen (FR).

His music video ""Brothers"" has reached 56 million views and his music video ""PESETAS"" reached 78 million views on YouTube.

Rilès released multiple EPs, ""Vanity Plus Mind"" (2015) and ""LVL 36"" (2020), and an album ""WELCOME TO THE JUNGLE"" (2019).
in 2016 and in 2021 he decided to release one song per week every Sunday for a year (RILESUNDAYZ). Read more on Last.fm",113321,3391644,Nekfeu
525f1f1c-03f0-4bc8-8dfd-e7521f87631b,Charlie Puth,"Charles Otto Puth Jr. is an American singer, songwriter and record producer. His initial exposure came through the viral success of his song videos uploaded to YouTube.

Puth initially signed with the record label eleveneleven after performing on The Ellen DeGeneres Show, while songwriting and producing for other artists. With primary intent on a solo career, Atlantic Records and Artist Partner Group eventually sought the artist and released his debut single, ""Marvin Gaye"" (featuring Meghan Trainor), in 2015. Read more on Last.fm",2410781,132342443,Lauv
9bb6f964-9d6a-4c07-bdb5-2d3b3f9632ef,Mad Division, Read more on Last.fm,1599,10464,Fyahbwoy
5a839afc-95d4-491c-9fb6-0a691bfe8afd,Alias,"There is more than one artist with this name:

1) Alias was an AOR/hard rock band, formed by vocalist Freddy Curci and Steve DeMarchi of the Canadian soft rock band Sheriff (""When I'm With You""), along with Heart founding members Roger Fisher, Steve Fossen and Mike DeRosier in 1988.

The band released its self-titled debut album that same year and went gold, scoring hits with ""Waiting For Love"" and the power ballad ""More Than Words Can Say"". They also recorded the Tonio K song ""Perfect World"" Read more on Last.fm",166047,2279469,Themselves
ee91d3e5-1c9a-49fd-b238-2935c7692f8a,Mr. Thing,Mr. Thing is a DJ and turntablist from the UK. He is also a former member of The Scratch Perverts with whom he won the DMC World Team Championships in 1999. He's a massive fan of Adidas Superstar sneakers and even mixed a CD for the launch of their 35th Anniversary editions in 2006. Read more on Last.fm,861,5056,Kenny Dope Presents The Unreleased Project
d0a51b75-b179-49fa-8f12-05dc6bc65b3c,Baze,"Baze aka Brocoli George gilt als einer der talentiertesten Rapper der Schweizer Hip Hop Gemeinde. Kaum ein anderer polarisiert und versteht es Worte und Stimmungen auf eine so tiefgehende Art in Bildern zu vermitteln wie er. Gerne lehnt er sich dabei auch mal über die Grenzen des Genres hinaus, beweist damit aber nur seine musikalischen Qualitäten und seine Vielfalt. So konnte es schon passieren, dass er einen Chlöisu Friedli Song mit Greis und Read more on Last.fm",10478,216108,Chlyklass
934321ef-a29d-4229-9385-5f22a4bbd107,Sophiegrophy, Read more on Last.fm,3342,19214,Antony & Cleopatra
a9295d17-b511-4ad7-bb02-06b2b680a1f1,Rochy RD, Read more on Last.fm,128386,1710448,Bulin 47
b4f8ba9d-3003-4554-b10e-9f325046a26b,Hooligan,"There are several artists/group who share the name Hooligan. One of them is a Korean rock band.
Here is what Hooligan (훌리건) have to say about themselves on their official site:

These aren’t the hooligans that go crazy over football.
No, these five guys simply share a common passion for music and their music is listed #1 on their crucial list.

They don’t care what the world thinks of them nor do they give any concerns to how others might see them.  Read more on Last.fm",7465,36379,Nightwatchers
3258b15c-3712-4e89-a90f-2e3a7c7d7330,Theory Hazit,"Who is Theory Hazit?
One MC with enough style to give the impression that he is a 3-man group.

Who is Theory Hazit?
A producer/DJ who feels at home rhyming over his own beats – or collaborating with high profile producers.

Who is Theory Hazit?
A husband and father – emerging from his days as a troubled youth and developing into a wise family man.

Theory Hazit is a Hip Hop artist – born and raised in Winchester Kentucky with the support of his granny, an aunt and 2 uncles. Read more on Last.fm",22540,292978,Tre-Dot
59466d51-6806-41d2-86cc-2cb33630bb39,Swarmz,"Swarmz (born Brandon Scott on September 11 1996, in Greenwich, London, United Kingdom) is a British rapper and singer and professional boxer. 

Swarmz was heavily inspired by the music his family was listening to, including a variety of Jamaican artists. He and his friends had begun rapping by the time he was attending school. Although he initially went by the name Swarmzy-B, he shortened it to Swarmz when he started making music professionally. His breakthrough single Read more on Last.fm",48874,545384,Kenny Allstar
532e4ed5-1ad9-4997-9fa2-4271fe7eb757,Pacho, Read more on Last.fm,1540,5585,Pacho El Antifeka
b04c952c-16c4-41ad-bd62-ace5047cdf6e,Laylow,"Laylow is a French rapper originating from Toulouse, of his real name Jeremy Larroux. In 2018, Laylow released the EP's .RAW and RAW-Z. On his first album Trinity that came out on the 28 February 2020, inviting Lomepal, S.Pri Noir, Jok'Air, Wit. and Alpha Wann for collaborations.The album reached number 3 in the French Albums Charts of the week. 

Laylow was born in 1993 in Toulouse a city in the south of France. He lived there until the age of nine Read more on Last.fm",89372,15016881,Josman
f7a94446-aa3f-41e6-b3d0-46dd695d7d6e,Dreamville,"Dreamville is a record label founded and owned by American rapper J. Cole, and Dreamville Records A&R and President Ibrahim Hamad. There are currently eight artists signed to the label, J. Cole, Bas, Omen, Cozz, Lute, JID, Earthgang, and Ari Lennox. Dreamville also houses producers Elite, Ron Gilmore, K-Quick, and Cedric Brown Read more on Last.fm",902442,36716013,EARTHGANG
27c29140-7bfd-4019-8a9a-a75932678524,Conspiracy,"There is more than one artist with this name:

 1) CONSPIRACY was a progressive rock band founded by Billy Sherwood (formerly of Yes) and Chris Squire (bassist in Yes). The band released two albums: Conspiracy (2000) and The Unknown (2003), and a live DVD (2006). It is currently inactive. The Unknown was re-released digitally in 2010 by Inside Out Records.
Squire and Sherwood share lead vocals on the album, with Squire playing most of the bass parts and Sherwood playing most of the guitar and keyboard parts, plus contributing some drumming. Read more on Last.fm",8276,65639,Chris Squire & Billy Sherwood
ce09ea31-3d4a-4487-a797-e315175457a0,Tyga,"Micheal Ray Stevenson (born November 19, 1989 in Compton, California), better known by his stage name Tyga, is an American hip hop artist signed to Lil Wayne's Young Money Entertainment and Decaydance. He is of Vietnamese and Jamaican descent.  He is the cousin of Travis McCoy, lead vocalist of the group Gym Class Heroes. 

In 2006 he released his first mixtape, Young on Probation, and released his debut studio album, No Introduction, in 2008. He has since released a further mixtapes Read more on Last.fm",2731433,37954821,Kid Ink
dc999240-731a-416d-bb87-816bf47b7984,Lazza,"Lazza, nome d'arte di Jacopo Lazzarini (Milano, 22 agosto 1994), è un rapper, produttore e pianista italiano.

Dopo aver studiato pianoforte al conservatorio Giuseppe Verdi di Milano, comincia a fare rap e da adolescente è membro del collettivo Zero2. In quel periodo partecipa anche a varie gare di freestyle e nel 2012 pubblica il suo primo lavoro, Destiny Mixtape.

Nel 2013 lascia la Zero2 per entrare in Blocco Recordz, etichetta di Emis Killa, per la quale rilascia l'anno successivo il mixtape K1. Read more on Last.fm",105206,11733515,Sfera Ebbasta
b7f5054e-c9de-49d8-b0eb-6deefb89b86b,Ñengo Flow,"Edwin Rosa, publicly popular as ""Ñengo Flow"" is a hip hop artist and composer of Puerto Rican music. Its fast and complex letters have referred to as the ""Real G"" urban type.

Flow Ñengo born on October 15, 1981 in the town of Rio Piedras. This great rapper grew and raised in the town of Bayamon, Puerto Rico. It is there since childhood he was interested the world of urban music. His beginnings as a rapper were developed with letters of the street, everyday living Edwin Rosa. Read more on Last.fm",237352,5263463,"Gotay ""El Autentiko"""
2914e0a2-5431-4427-a8e6-e6268ba92390,Crudo Means Raw,"Crudo Means Raw (nombre real: Fernando Bustamante) es un productor musical, rapero y cantante colombiano nacido en Medellín. Se ha destacado por su estilo versátil, que mezcla el hip hop clásico con sonidos latinos como el funk, el jazz, el bolero, la salsa y el reguetón. Su propuesta musical se caracteriza por la fusión de lo vintage con lo moderno, y por letras que reflejan vivencias personales, reflexiones sociales y una estética callejera y elegante al mismo tiempo. Read more on Last.fm",29625,1293203,granuja
30521510-4108-47ed-8495-992624bd304c,SLiNK, Read more on Last.fm,8016,41139,Guacáyo
3ae54eaa-3bd5-4e7a-b85b-5273f2c5e839,Rich Vagos, Read more on Last.fm,38475,659332,Faruz Feet
4efc4d86-18b5-4b6f-9380-6b8910482d37,Mac Dre,"Andre Hicks (July 5, 1970 - November 1, 2004), better known by his stage name, Mac Dre, was a Bay Area based gangsta rapper from the Crest side of Vallejo, California, active since 1988 and considered one of the predecessors of the hyphy movement. During his career in the rap world, he worked with artists like Andre Nickatina, Yukmouth, Snoop Dogg, Mac Mall, Dubee and Keak da Sneak.

Career

Mac Dre's music gained popularity in the early to mid 1990s throughout the Bay Area Read more on Last.fm",231607,4432775,The Jacka
62d71e3c-6164-4a0b-800e-12179a2c2ee0,Lord Apex,"Shaeem Santino Wright (born 12 July 1996) known as Lord Apex, is a British MC who grew up in White City, London, United Kingdom. His music crosses multiple styles of rap, including UK hip-hop, alternative hip hop, and lo-fi hip hop.

Apex's stage name was inspired by hip-hop producer Madlib's alter ego, Quasimoto aka Lord Quas.

Apex frequently states that he doesn't like to be put into any one genre with his music. Journalists, and Apex himself, often reference lo-fi, 90s US hip hop acts like J Dilla and MF Doom as influences. Read more on Last.fm",162160,2180434,Finn Foxell
789e25c5-e8ad-4f89-b3b8-a0d2128d543d,Boss Doms, Read more on Last.fm,4809,19251,Wayne Santana
65482a1b-3e48-4074-83da-dde269faddb1,FIJI,"There are numerous artists with this name, including: 
1) Polynesian reggae/hip-hop/R&B artist George “Fiji” Veikoso (died 2025); 
2) a Danish metal band from København/Slagelse, Sjælland;  
3) a Swiss electro band located in Berne; 
4) a Russian electronic musician; 
5) a project from The Kills lead singer Jamie Hince; 
6) a female rapper. 

1) 
Born George Brooks Veikoso on 10 May 1970; died 24 July 2025. 
Fiji was one of the biggest polynesian artists of our time. Read more on Last.fm",59353,902499,J Boog
2f522f5c-111c-4ce8-8bd0-d82e97c227ad,Daddy Yankee,"Ramón ""Raymond"" Luis Ayala Rodríguez (born February 3, 1976), known artistically as Daddy Yankee, is a Latin Grammy Award winning Puerto Rican reggaeton recording artist. Ayala was born in Río Piedras, the largest district of San Juan, Puerto Rico, where he became interested in music at a young age. In his youth he was interested in baseball, and aspired to become a Major League Baseball player. He was unable to continue this sport when he got shot in the leg by being mistaken for his friend by a unknown man Read more on Last.fm",2200125,50346045,Don Omar
cde65e2a-3e77-45b3-9320-fd10f813621f,Quality Control,"Quality Control Music is an Atlanta-based record label founded by Pierre “Pee” Thomas and Kevin “Coach K” Lee in 2012. The label’s releases are now distributed through Motown and Capitol Music Group.

The label has many acts signed, including the Migos (Quavo, Offset and Takeoff), Lil Yachty, City Girls, Duke Deuce
 and Lil Baby. Read more on Last.fm",836217,17410088,Huncho Jack
aa1c8575-6322-4788-9cd9-7c849fee2fa8,Dani Ribba,"Daniel Ribba, más conocido como Dani es un cantante de trap argentino, nacido el 6 de agosto de 1999. Conocido por su etapa como freestyler, participó en competencias como El Quinto Escalón y FMS Argentina. Read more on Last.fm",45286,1008740,LIT killah
fa8e7fb9-c595-4811-aad9-16b37ac27f5b,Ayax y Prok,"
Read more on Last.fm",38376,1699125,FERNANDOCOSTA
875203e1-8e58-4b86-8dcb-7190faf411c5,J. Cole,"Jermaine Lamarr Cole (born January 28, 1985), better known by his stage name J. Cole, is an American hip hop recording artist and record producer. Cole was born on an American military base in Frankfurt, Germany, to two American parents. Raised in Fayetteville, North Carolina, Cole posted songs on various internet forums at the age of 14 under the name ""Blaza"", but later switched to the name ""Therapist"". 

Cole initially gained recognition as a rapper following the release of his debut mixtape Read more on Last.fm",3807253,298561920,Cozz
8a99c12d-47c5-4b42-bb5c-cefec396bae7,Ronpe 99, Read more on Last.fm,22406,1246627,Oney1
c818a5e5-2835-4776-be0e-fc672691b893,Metta, Read more on Last.fm,1800,8085,Vanilla John
6dc65b53-0ec4-45cc-9229-ef75804eb687,Adán Cruz,"Adán Cristóbal Cruz López, mejor conocido como “Adan Cruz” nació un 18 de Septiembre del año 1992.
Crece rodeado por instrumentos musicales, discos y vinilos, de rock clásico” entre otros géneros. A la edad de 10 años recibe por parte de un compañero de clase un disco de Rap, a nivel local influenciado por grupos tales como: “Cartel De Santa” y “Control Machete”.

Al paso de 3 años se lanza como autor e intérprete independiente Read more on Last.fm",20318,884374,Fntxy
b6802d58-6e84-4a60-b5bc-e6f926763978,Bundi, Read more on Last.fm,268,1136,Izzie Gibbs
bc3ead02-18f6-4b63-8214-638ffbb42a11,Kane,"As it happens there are 3 bands named Kane:

One - KANE is a Dutch rock band from The Hague, formed in 1998. The two original members were Dinand Woesthoff (lead singer) and Dennis van Leeuwen (guitarist, vocals). They added drummer Martijn Bosman in 2002 after the former drummer had left the band. Their music can be described as soft guitar rock. Nowadays, they are one of the best selling bands in The Netherlands and, after The Golden Earring, one of the most successful rock bands in Dutch music history. Read more on Last.fm",156587,2830416,Anouk
a6b15fa1-f326-4ab8-93b7-7e90870f337e,Edwin,"There is more than one artist named Edwin:

1. Edwin refers to the original the lead singer for EMI-signed Canadian Rock recording artist I Mother Earth.  He went solo and recorded the SONY 1999 album ""Another Spin Around The Sun"" which featured four strong singles, including the radio hit ""Alive"".  Columbia released his solo debut in the USA in 2000.

2. Edwin was the guest lead vocalist on a special solo project called Victor that was assembled by Rush guitarist Alex Lifeson.  Edwin would later form Edwin & The Pressure.    Read more on Last.fm",38962,333140,I Mother Earth
8e7cde9d-1212-4d34-9c20-4189de563bae,Big Stan, Read more on Last.fm,8622,71207,Bazaar Royale
7fdb17ff-fcbf-4d17-95ba-ae361ee40c8e,OBOY,"Mihaja Ramiarinarivo (born 6 January 1997), better known by the stage name OBOY, is a Malagasy-born French rapper. Read more on Last.fm",104971,5209774,Josman
a0e8a1b1-5f8f-475a-a253-17415c17d0ff,Mac Miller,"Malcolm McCormick, also known by his stage name Mac Miller, was an American rapper, singer-songwriter and record producer from Pittsburgh, Pennsylvania. He was also a noted record producer under the pseudonym Larry Fisherman. Raised Jewish and teaching himself music from a young age, McCormick defied the stereotypes of hip-hop and released his first mixtape under the name EZ Mac, titled ""But My Mackin' Ain't Easy"" in 2007, when McCormick was only fifteen. Read more on Last.fm",3466486,422425806,Joey Bada$$
6e500783-dbd1-435d-b3d7-aba7e2d2ff32,Spectacular Diagnostics, Read more on Last.fm,58383,250545,Boldy James
2aff77f3-8195-46c3-bc2f-0042ada5cd86,Violence,"Violence may refer to at least 3 groups:

1. A hardcore group from the UK
2. An synth pop duo from Canada
3, Metal, Industrial, Bass-Music band

1. Originating from Newcastle in 2008 Violence has been working hard to make a name for themselves in the Newcastle hardcore scene and has just recently been featured in Reverb Street Press. They deliver a full and heavy traditional style of hardcore while maintaining a distinct originality particularly through front man Glen Mountford’s vocal style. Read more on Last.fm",26905,219663,Hella Sketchers
85b0112b-50ce-4b3e-8857-6ca7ea3f3584,Keko Musik, Read more on Last.fm,893,2931,NAYHLO
031dd255-f118-403c-869c-2373340c8ff4,Bhavi,"Bhavi es un cantante de trap nacido como Indra Bhalavan en Bélgica, el 22 de octubre de 1997, y radicado en Argentina. En 2017 comenzó a grabar y al poco tiempo se conectó con Mueva Records, la productora con la cual trabaja. 

En 2018 volvió a Bélgica a probar suerte, donde comenzó una gira con Coely y Dvtch Norris, presentándose en distintos festivales. Lanzó varios singles junto a otros artistas reconocidos: “Mojaa”, el 30 de enero Read more on Last.fm",130989,6218216,Duki
0ed1066b-e0e3-4c4e-aa99-b3e9062197cc,Aerstame, Read more on Last.fm,11712,176007,Adickta Sinfonía
2b63ea57-8619-4fba-9dff-9a20a1af6cb8,Watkin Tudor Jones,"Genius chameleon of South African hiphop over the past decade, Mr Jones has incarnated in many forms, aka MaxNormal.TV, aka The Constructus Corporation, aka Max Normal, aka Yang Weapon, aka The Man Who Never Came Back, aka Watkin Tudor Jones etc. Watkin Tudor Jones (his real name), spat out one album under that moniker - The Fantastic Kill. not recommended for sheep.
Currently incarnating as Die Antwoord Read more on Last.fm",17931,185908,MaxNormal.TV
b49a9760-c675-4724-b258-d494a2a29ca9,Young Lox, Read more on Last.fm,292,4020,Ampichino & Young Bossi
e3205c99-f283-4a32-9057-05ee8db15c28,Manu Crooks, Read more on Last.fm,33020,270686,B Wise
81060c7e-ec55-4f28-aee8-aa78c5993155,Kung Foo Grip,http://www.myspace.com/kungfoogripsucka Read more on Last.fm,690,6117,Porter Ray
5cc35970-eb45-4621-816a-ea3e65de782f,AG Cubano, Read more on Last.fm,203,1073,J. Stalin
e1e9b4bc-0a3d-489b-9593-97d528934691,Stailok, Read more on Last.fm,4337,53632,cestar
